,Unnamed: 0,Unnamed: 0.1,date,text
1,1,560,2018-11-26 23:59:16,Fuck it. Late night pokemon stream at like 8:30pm cst 9?
2,2,561,2018-11-26 23:58:57,I WASNT EVEN CHAINING!! I WAS JUST LOOKING FOR EEVEES 
5,5,564,2018-11-26 23:58:48,I got a shiny diglett! Hes got pretty decent stats too!'
7,7,566,2018-11-26 23:58:40,Love with more shiny hunting in ! Maybe this time I wont completely ignore a shiny Magikarp  come keep me company! 
8,8,567,2018-11-26 23:58:37,Final team is ready 
12,14,573,2018-11-26 23:57:45,Still gay 
14,16,575,2018-11-26 23:57:00,Not to be really sappy but playing remakes of old pokemon games feels like visiting home again after being away for a long time. 
15,17,576,2018-11-26 23:56:55,PERFECT 
18,21,580,2018-11-26 23:56:13,"Looks like is the winner for tonight! Starting up stream now. Come chat and join me at where we will meet Bill, battle the Cerulean gym and more! "
19,22,581,2018-11-26 23:56:11,Going live in one hour! We're going to be hunting even more in 
21,24,583,2018-11-26 23:55:31,Attention to detail man!! She's been afflicted with sleep during battle so you can't play with her eeeeeeeeeee she's so cute 
22,25,584,2018-11-26 23:55:23,I love her 
23,26,585,2018-11-26 23:55:14,Done  
26,29,588,2018-11-26 23:54:45,that was completely unexpected 
27,30,589,2018-11-26 23:54:39,Anyone want to trade? 
28,31,590,2018-11-26 23:54:30,Niiicce :3 
31,34,593,2018-11-26 23:54:25,"After breaking the first chain, I got this!! "
32,38,597,2018-11-26 23:54:10,Caught it!2/2 
33,39,598,2018-11-26 23:54:09,love this lil guy 
34,40,599,2018-11-26 23:54:08,I chose Who will you choose for your adventure on 
36,43,602,2018-11-26 23:53:51,Asks a question then immediately challenge me to battle. Ok then xD 
39,46,605,2018-11-26 23:53:37,Tonights  stream is delayed I forgot about the Pokmon Movie. Ill be Live tonight at 10pm est.   
41,48,607,2018-11-26 23:53:22,BROKE MY VULPIX CHAIN AGAIN BUT LOOK!!!!!!!! 
43,50,609,2018-11-26 23:53:16,tiny koffing 
44,51,610,2018-11-26 23:53:14,Shiny Vulpix!!! 1/2 
45,52,611,2018-11-26 23:53:11,i played with her 
49,57,616,2018-11-26 23:51:21,Farewell 
50,58,617,2018-11-26 23:51:17,WHAT A HANDSOME LAD 
51,59,618,2018-11-26 23:51:15,My little Hipsterchu! 
54,63,622,2018-11-26 23:50:23,premier shiny farm caninos 31
55,64,623,2018-11-26 23:49:57,eevee's tail acts as a dowsing rod. the closer you are to an item the faster they wag their tail! 
56,65,624,2018-11-26 23:49:47,Omfg I cant even handle Venasaur hopping around like a toad it's too perfect. I knew I always loved the flower amphibian 
57,66,625,2018-11-26 23:49:44,"Got most eevee exclusives multiple times if anyone wants to trade &amp; trade to evolve. I still need Hitmonlee, growlithe, oddish, Machamp "
58,67,626,2018-11-26 23:49:44,I'm so happy to have my tiny ghost boy and I can'twait for him to be a proper ghost man gengar dude 
59,69,628,2018-11-26 23:49:33,My first ever shiny! Finally! 
61,71,630,2018-11-26 23:49:23,It's the final stretch of ! Come join me for the Elite Four! 
62,72,631,2018-11-26 23:49:14,WHY THO 
63,73,632,2018-11-26 23:49:13,"Sabrina reaction meaning, she dislikes losing a battle. "
64,77,636,2018-11-26 23:48:45,eeveeeeee &lt;3 
66,79,638,2018-11-26 23:48:36,"Pokemon league champs! Now, time to complete my pokdex!"
69,82,641,2018-11-26 23:48:13,pink sea noodle 
71,85,644,2018-11-26 23:48:01,what's up 
72,86,645,2018-11-26 23:47:55,Thank you 
74,88,647,2018-11-26 23:47:42,"I like to mess around with my favourite computer programs like and when I'm not drawing. Since earphones don't work for me, headphones will do! "
76,90,649,2018-11-26 23:47:39,We did it! We caught them all! 
77,91,650,2018-11-26 23:47:24,intothe\\(*^*)/elite4! 
78,92,651,2018-11-26 23:46:50,Just completed the pokedex! Shiny Charm is mine! 
79,93,652,2018-11-26 23:46:45,I love how I can just lay down on my bed stare at the tv and just have my hand in one controller when I play Let's Go. Like this is luxury right here. 
81,95,654,2018-11-26 23:46:42,You've made your appearance! 
82,96,655,2018-11-26 23:46:32,Let's goooooooooo 
83,97,656,2018-11-26 23:46:30,I love how Shellder and Cloyster move like some mollusks in real life. It's adorable. 
84,98,657,2018-11-26 23:46:29,WE MEET AGAIN OLD FRIEND 
85,100,659,2018-11-26 23:46:20,Finally got a shiny Meowth and this is how many normal ones I caught before it appeared :|
86,101,660,2018-11-26 23:46:17,I just lost my shit! Finally got it! 
87,104,663,2018-11-26 23:45:47,Cross Stitched Pictures made by my daughter.For sale for 5 each + 3.50 postage to UK.
88,108,667,2018-11-26 23:45:17,Full odds shiny! Anyone have any names for her?  
91,112,671,2018-11-26 23:44:34,Kia ora Celadon City - style upgrade! 
92,113,672,2018-11-26 23:44:03,"Okay I really like the game a lot, but I'm just a tad disappointed about the fact that it's a bit too easy. The gameboy &amp; DS etc versions of the gym leaders etc were harder to battle.  "
94,115,674,2018-11-26 23:43:56,"So I was browsing through reddit and it seems that I am not the only one having problems with shiny Pokemon in There seems to be a really weird thing going on that sort of bugs it, but no one is sure about how and why.This is ... certainly interesting.'"
96,117,676,2018-11-26 23:43:46,Ok I was chaining Ghastly and this happened. I slowed down the clip so you could see what happened when I entered the menu to get a berry. I hope this never happens to anyone else. 
97,118,677,2018-11-26 23:43:45,I have waited my whole life for this moment 
99,121,680,2018-11-26 23:43:41,Going for my sixth badge. 
100,122,681,2018-11-26 23:43:29,Just traded online with to get these gems. 
101,123,682,2018-11-26 23:43:24,"Thank god made the cord on this thing, super small. Cant even put it on my table. "
103,125,684,2018-11-26 23:43:08,"At long last, this baby finally appeared on Phase 5. Hopefully I can get another one before the chain breaks. "
106,137,696,2018-11-26 23:41:51,2nd shiny Caterpie while looking for Bulbasaur 
107,138,697,2018-11-26 23:41:45,Erstes shiny in lets go nach 40min hunt *_* 
108,139,698,2018-11-26 23:41:43,MY LIFE IS WORTHLESS COMPARED TO YOURS 
110,146,705,2018-11-26 23:41:22,24 New Nintendo Switch Games ANNOUNCED for the 4th Week of November 2018  Video  ------&gt; 
112,149,708,2018-11-26 23:40:42,More shinies 
113,150,709,2018-11-26 23:40:32,New episode of taking down T-series. 
114,151,710,2018-11-26 23:40:23,Found a Shiny  
115,152,711,2018-11-26 23:40:07,Hunting for a shiny vulpix!
116,154,713,2018-11-26 23:39:41,wipes up in France! 
119,157,716,2018-11-26 23:39:13,Is this normal?? 
122,161,720,2018-11-26 23:38:29,Just found a shiny Graveler randomly 
125,164,723,2018-11-26 23:38:07,"I was trying to get a shiny Ghastly, not Chansey. lol "
126,166,725,2018-11-26 23:38:01,Add another one to the shiny count. Shiny Ponyta. Really happy that I got it. Just love the blue flames it has. Looks so epic. 
127,167,726,2018-11-26 23:37:54,My sweet boy &lt;3 
129,170,729,2018-11-26 23:37:39,RIP Shiny Dragonite (Insert Sad Face) 
133,174,733,2018-11-26 23:37:01,boom! is cleaning up! 
135,176,735,2018-11-26 23:36:24,Work hard ... 
136,180,739,2018-11-26 23:35:49,4th time lucky! 
137,181,740,2018-11-26 23:35:31,heck yeah~ 
138,182,741,2018-11-26 23:35:20,Phase 4 Ponyta got me yet another Shiny Pidgey. I didn't catch it too to keep the chain going! 
139,184,743,2018-11-26 23:35:06,Digimon Poketmonsters! That is what this is right?Live Now!
140,186,745,2018-11-26 23:34:47,FINALLY! WOOO 
141,188,747,2018-11-26 23:34:35,Wish I had a Pikachu on my shoulder irl  
144,194,753,2018-11-26 23:33:21,OH NO 
145,195,754,2018-11-26 23:33:09,if they make a Johto edition and they dont remake reds theme im gonna be upset'
146,196,755,2018-11-26 23:33:02,Only the best 
147,197,756,2018-11-26 23:33:02,The only shiny that matters 
148,200,759,2018-11-26 23:32:21,if only i had a dollar for each pikachu... 
149,201,760,2018-11-26 23:32:19,stream starts in 20! tonight we shiny hunt ponyta and if that goes swimmingly we will move on to a gym battle! See you there Pokenerds for some sweet gameplay! 
150,204,763,2018-11-26 23:32:05,ATV DRAGONSLAYER 
151,205,764,2018-11-26 23:31:54,One of my favourite shinies! 
152,206,765,2018-11-26 23:31:50,COCKFUCKINGBLOCKED 
153,207,766,2018-11-26 23:31:50,Rate my Eevee on the cute scale 
155,209,768,2018-11-26 23:30:58,That went well lol I thought it would take days to find one ^^ 
156,212,771,2018-11-26 23:30:54,Well that just made me Smile like a Dork ^_^ 
157,214,773,2018-11-26 23:30:45,I finally completed the pokedex!!!! After playing pokemon games for all my life this is the first time I've been able to do it!!!! FINALLLYYYYY  
160,218,777,2018-11-26 23:30:09,bro why is this a pokemon 
161,220,779,2018-11-26 23:30:00,First come first serve on this Legendary code! Snag this Kyogre and Groudon code for your game! 
163,222,781,2018-11-26 23:29:49,I-IT KNOWS 
164,224,783,2018-11-26 23:29:22,al fiiiin 
165,225,784,2018-11-26 23:29:17,what's her problem now? 
166,227,786,2018-11-26 23:28:56,"Phase 2 for shiny pikachu, taking a break from it to hunt something else! "
167,228,787,2018-11-26 23:28:53,we out here 
169,231,790,2018-11-26 23:28:41,"Going live with Post Elite Four Pokemon now! Come hang out whilst I catch 'em all and train my friends to beat Red, Blue and Green! I'll be Shiny Hunting too once the Dex is complete!Hope to see you there whilst I fail!"
170,232,791,2018-11-26 23:28:27,brand new shiny! 
171,233,792,2018-11-26 23:28:16,Why is Raichu having a seizure 
173,236,795,2018-11-26 23:27:15,"This is the first time I have ever done this, but I wrote a review with pros, cons, and QOL improvements for Please tell me your thoughts and if you agree or disagree. "
174,237,796,2018-11-26 23:27:10,"Got the guide today, to help me out with the unexpected. "
176,239,798,2018-11-26 23:27:07,Finally got my boi!!!! 
177,240,799,2018-11-26 23:27:00,This would be fabulous! 
178,241,800,2018-11-26 23:26:50,I also don't regret making my rival.  At least we have our respective hair colors. 
180,244,803,2018-11-26 23:26:31,yall im so close. do any locals want to trade? i dont want to have to pay for online just to trade 1 pokemon 
181,245,804,2018-11-26 23:26:27,Phase 1 for shiny pikachu 
182,247,806,2018-11-26 23:26:04,and here it ends 
184,249,808,2018-11-26 23:25:40,So cute! 
186,252,811,2018-11-26 23:25:23,A journey through Kanto continues on Victory Road! Mega Charizard! Moltres! Let's go Eevee!! 
187,253,812,2018-11-26 23:25:10,shiny Chansey/Chaneira 
189,256,815,2018-11-26 23:24:58,c.can i please get a shiny already 
191,259,818,2018-11-26 23:23:57,Safari Zone? More like Friend Zone 
192,260,819,2018-11-26 23:23:56,"""Hey kid... Draw me like one of those Kalos region girls"" "
193,267,826,2018-11-26 23:22:03,So can I change the name of my game from Let's Go Pikachu to Let's Go Charizard? 
194,268,827,2018-11-26 23:22:03,here's a random glitch I found. rival uses a Full Restore but the game says I used it. 
195,269,828,2018-11-26 23:22:00,i heard lt. surge is jacked. i heard he has an 8-pack 
196,270,829,2018-11-26 23:21:58,when Eevee is in the mood.. 
197,271,830,2018-11-26 23:21:57,So our journey led us to the Indigo Plateau at last.  I really loved this shot. 
198,272,831,2018-11-26 23:21:48,"My ""late night"" hunt ended with a Shiny Bulbasaur and a 6IV Pikachu who\'s currently named ""Detective"" but I am going to probably rename Reynolds. "
199,273,832,2018-11-26 23:21:38,I wanted one more Clefairy and this poped right in my face... What should I do!? 
203,277,836,2018-11-26 23:21:09,ohhhh man 
204,278,837,2018-11-26 23:21:07,May have just found my favorite look for the fancy little guy. ^_^ 
205,279,838,2018-11-26 23:20:59,Just want everyone to know Im almost done playing and Im sad about it'
206,280,839,2018-11-26 23:20:54,So we threw a poll out for tonight's stream in discord and Twitter and you all chose ! See you all at 7pm EST Fam! 
207,281,840,2018-11-26 23:20:43,Team actual :)
208,282,841,2018-11-26 23:20:42,This is awful... 
209,284,843,2018-11-26 23:19:54,Absolutely horrendous stats but she's still gorgeous! 
211,287,846,2018-11-26 23:19:46,THIS GAME IS SO CUTE WTFFF 
213,289,848,2018-11-26 23:19:42,Continuing my Pokemon Let's Go Gameplay! Come hang out! 
214,291,850,2018-11-26 23:19:25,FIRST LETS GO SHINY!!! 
215,292,851,2018-11-26 23:19:15,"Evolved my Shiny Growlithe, then immediately came across another one "
218,298,857,2018-11-26 23:17:45,"Wasn't what we were hunting, so it broke our catch combo... but a shiny is a shiny :P "
220,301,860,2018-11-26 23:17:09,lol with only two pokemon 
221,302,861,2018-11-26 23:16:55,Brill I know several little lads who would love this!! '
222,303,862,2018-11-26 23:16:55,Stream tonight over on gonna collect some badges and pokemon and chill till I get tired and pass out
226,312,871,2018-11-26 23:15:35,My 2nd shiny! 
227,314,873,2018-11-26 23:15:12,Just been flying around Kanto and found this golden girl in the sky! 
229,316,875,2018-11-26 23:15:01,Finally completed the pokedex! I can sleep in peace. 
230,318,877,2018-11-26 23:14:59,"After a 6 hour wait, I finally got favorite little green dude "
232,320,879,2018-11-26 23:14:54,Shiny part. 3 
233,321,880,2018-11-26 23:14:43,First time completing a pokedex :D 
234,323,882,2018-11-26 23:14:28,ok THIS time I got it right 
235,324,883,2018-11-26 23:14:15,"look at this soft boi,,,, "
236,325,884,2018-11-26 23:14:11,My second shiny! Jolly nature too without using the nature lady ^__^ 
237,326,885,2018-11-26 23:14:10,lemon is home 
238,329,888,2018-11-26 23:13:50,Crud.... 
239,330,889,2018-11-26 23:13:50,Finally!!!  
241,333,892,2018-11-26 23:13:35,this fucking jumpy bastard 
242,334,893,2018-11-26 23:13:27,It's time! One JRPG after another! Pokemon Let's Go Pikachu begins TONIGHT AT 9:30pm!
243,335,894,2018-11-26 23:13:24,second shiny but first screenshot  
244,336,895,2018-11-26 23:13:10,Suppose It's about time i started this meow~ 
245,337,896,2018-11-26 23:13:02,Gonna be returning to tonight. Trying to shoot for 5pm pst tonight. Ive been trying to gauge when to start streaming so hopefully you guys will bear with me.'
246,338,897,2018-11-26 23:12:20,Here is a link to tomorrows video  
247,343,902,2018-11-26 23:11:35,"First shiny in letsgo baby!! Only 4 maxed ivs, but I'll take it!  "
248,344,903,2018-11-26 23:11:27,"she so thiccc that she aint even gotta touch the ground ,,,, "
249,346,905,2018-11-26 23:10:53,Forgot to post this the other day. SRing for shiny Zapdos btw. 
250,347,906,2018-11-26 23:10:49,guess who's finally level 100?? 
251,348,907,2018-11-26 23:10:44,That's it rn. My team so far 
252,350,909,2018-11-26 23:10:32,BEGONE THOT 
253,351,910,2018-11-26 23:10:14,Annnnddd 2nd :)
254,352,911,2018-11-26 23:10:13,WE DONT DESERVE 
255,353,912,2018-11-26 23:10:09,ONE IN THREE-HUNDRED FIFTEEN CHANCE! No shiny yet! WHAT IS THIS!? 
256,354,913,2018-11-26 23:10:06,I had no catch combo..full odds? 
257,358,917,2018-11-26 23:09:43,Why do I keep finding random shinies at the start of chains  
258,361,920,2018-11-26 23:09:21,tell me why i'm crying 
260,363,922,2018-11-26 23:08:48,Well that was easy! still fantastic trip down memory lane 
261,364,923,2018-11-26 23:08:38,Couple more pit pats before we wreck the elite 4 
263,366,925,2018-11-26 23:08:22,And Shiny Charmeleon evolves to Shiny Charizard. Love how different his colour pallet is. 
264,367,926,2018-11-26 23:08:08,Potential johto let's go games coming at some point?? 
265,368,927,2018-11-26 23:07:36,Go Have A Look At Bigmike's Latest Unboxing Video @FAMafia
266,369,928,2018-11-26 23:07:35,RNG can fuck itself! I have a 70+ Nidoran and STILL NO FUCKING SHINY! I'm using a Lure FFS! 
267,371,930,2018-11-26 23:07:08,ngl...kid me is very happy rn 
268,374,933,2018-11-26 23:06:54,Everyone on the internet are posting how much fun they're having with the let's go titles meanwhile I'm just playing on Smogon. 
269,375,934,2018-11-26 23:06:40,All of these people posting their shiny Pokmon on gets me so amped for my first one. Hopefully its a cool one!'
270,376,935,2018-11-26 23:06:40,1er shiny... 
271,377,936,2018-11-26 23:06:25,I swear Ive only played about 5 minutes since I got the Golduck and already another random encounter shiny (no combo this time)! 
272,378,937,2018-11-26 23:06:23,"I'm Champion, baby! "
274,382,941,2018-11-26 23:06:08,NO WAY! I JUST GOT A SHINY EEVEE!! 
275,383,942,2018-11-26 23:06:00,Shiny Abra! 
277,385,944,2018-11-26 23:05:27,I am now streaming Eevee! 
279,387,946,2018-11-26 23:05:22,"Our new ep, ""Movie Sweatpants,"" is now avail! We discuss, among other things, and We also review the new animated film "
280,388,947,2018-11-26 23:05:12,That is how we roll 
281,389,948,2018-11-26 23:05:11,LIVE  Taking on the Elite four tonight! Last week until the Giveaway. Art Contest is LIVE! Come hang out with us in the Sugar Stream and Collect SgrBits the Giveaways!
282,390,949,2018-11-26 23:05:01,why tho 
283,391,950,2018-11-26 23:04:39,Oh yeah I forgot... 
284,392,951,2018-11-26 23:04:29,pics_that_make_you_go_hmm.jpg 
285,393,952,2018-11-26 23:04:12,"In you can cheese lures. Lures wear off with steps. But the effects of a Lure continue to happen even while standing still. Stand in a patch of grass, use a Lure, and only move if a Pokemon you want has appeared! Perfect trick for "
286,394,953,2018-11-26 23:03:54,Starting up early! LIVE with attempting some Light farming in Pagos. Probably*** some later!
288,398,957,2018-11-26 23:03:30,lmao i'm so overpowered rn 
289,400,959,2018-11-26 23:02:22,Finally! Shiny Charmander was an all day affair! 
291,402,961,2018-11-26 23:02:20,just walking with my Mewtwo... 
292,403,962,2018-11-26 23:02:13,Love this bad bitch 
293,404,963,2018-11-26 23:02:10,A random shiny Pidgey showed up at Nugget Bridge and ran after the first throw! My first shiny fail. 
294,406,965,2018-11-26 23:01:44,Looks like a lot of trainers are on Twitter asking for help in evolving trade-only evolutions and for receiving game-exclusive Pokmon. Sounds like a great idea for a stream :)'
295,407,966,2018-11-26 23:01:39,"uh, yessssssss honey "
296,408,967,2018-11-26 23:01:05,Ouh yeah! 
297,410,969,2018-11-26 23:01:01,perf way to spend the evening 
298,411,970,2018-11-26 23:00:58,8 badges 100 pokemon 
299,412,971,2018-11-26 23:00:38,Pokemon 3D new vid. Fuck farfetch'd thats all that needs to be said
301,415,974,2018-11-26 22:59:49,"on another note, it seems like CP maxes out at 10,000 "
303,418,977,2018-11-26 22:59:03,"Trying a different style, with a little sleepy bun. I think it turned out really cute! "
306,423,982,2018-11-26 22:57:54,"What's up We are live on playing Stop in and hangout as we try and catch em all!"""
307,424,983,2018-11-26 22:57:03,"sorry i had to let you go, pidgey  "
308,426,985,2018-11-26 22:56:40,Working on my living dex for the night!
309,429,988,2018-11-26 22:56:13,"Me, playing on an airplane, arriving at Fuchsia city for the first time, forced to put my in airplane mode: "
310,430,989,2018-11-26 22:56:11,"However, what is keeping me engaged, gaming-wise, is the I've fallen in love again with the console, and the incredible games I've been enjoying... I've been having a great time getting sucked into and returning to and more!"""
311,431,990,2018-11-26 22:56:08,"i wasn't even shiny hunting, didnt chain.... "
312,432,991,2018-11-26 22:56:06,YOOOOOOOOOOOOOOOOOOOOOOOOOOOOOOOOOO DOODOO GREEN DODUO 
316,436,995,2018-11-26 22:55:10,"I\'ll be playing more tonight! Tune in for more amazing voices like ""Old man"" "
318,438,997,2018-11-26 22:54:42,"Silph Co scientist knew Dig was the only Ground type move you could get, so he gave his Weezing Protect "
319,439,998,2018-11-26 22:54:36,Getting some weird compliments in this game 
320,440,999,2018-11-26 22:54:36,I just spent ten minutes on my feet lobbing pokeballs at Zapdos. It was amazing. So much fun. Absolutely loving every second of arm is killing me though. 
322,442,1001,2018-11-26 22:54:03,Probably should have been revising for my theory test but instead I finished 
323,443,1002,2018-11-26 22:53:53,"WOAAAAAAAAAA CHARIZARD, LETS FLY"
324,446,1005,2018-11-26 22:52:44,Anyone have a Clefable they could trade me?!? I need it to finish my Pokdex 
325,447,1006,2018-11-26 22:52:42,FUCKKKKKKKKK 
326,449,1008,2018-11-26 22:52:34,"i swear ... this games onix is going to give me a damn heart attack, CAUSE IT IS TOO DAMN BIG "
328,452,1011,2018-11-26 22:52:16,This is what happens when I combo offscreen... 
330,455,1014,2018-11-26 22:51:45,Can a 6-year-old play about getting it for my son for Christmas. Then his takeover of my Switch will be complete...'
332,457,1016,2018-11-26 22:51:35,I'm dying 
333,459,1018,2018-11-26 22:51:14,Shiny Golduck is such a letdown. 
334,461,1020,2018-11-26 22:50:45,Welcome to the new party member Hitmon-san! He'll need some work to catch up now. Only one member left! 
335,462,1021,2018-11-26 22:50:45,I mean I had fun but now it's literally just a shiny hunting game... No competitive merit when Mewtwo is allowed on any team lol 
336,464,1023,2018-11-26 22:50:40,What do you all think? 
338,466,1025,2018-11-26 22:50:36,this yellow blob makes me so happy 
339,467,1026,2018-11-26 22:50:29,This game console is so darn ridiculous 
341,470,1029,2018-11-26 22:50:03,this wing is forever associated with pui 
343,473,1032,2018-11-26 22:49:41,looking for that diamond in the ROUGH  
345,476,1035,2018-11-26 22:49:25,"Can ya, like, stop following me? "
346,478,1037,2018-11-26 22:49:17,I'm also now the Eevee master 
347,480,1039,2018-11-26 22:49:09,"Glad you gave it a try, everything isn't for everyone, but if that's what's killing it for you try underhand throws with motion controls or use handheld mode, it's OP. Would be sweet to see the Battle Buddies play through """
348,483,1042,2018-11-26 22:49:01,You can play as Pikachu!?!? 
350,486,1045,2018-11-26 22:48:35,Going live with an attempt at the elite 4 
352,489,1048,2018-11-26 22:47:47,"THAT'S MAD RACIST, PIKACHU "
353,491,1050,2018-11-26 22:47:36,TuT so pure 
354,492,1051,2018-11-26 22:47:30,My Shiny Charmander evolving into a Shiny Charmeleon! If you're wondering his nickname is Irish or Shiny ;) 
355,494,1053,2018-11-26 22:47:15,What a fabulous idea! Meetup + Chicago enthusiasts = Co-Hosts with the mosts!!! Wish I could be there for this!'
356,497,1056,2018-11-26 22:46:53,Time To Fight Misty! 
357,499,1058,2018-11-26 22:46:22,streaming Pokemon let's go Pikachu tonight gonna catch those legendarys!!! come join later
358,500,1059,2018-11-26 22:46:16,I mean thank you buuuuut....who told you to look? 
359,503,1062,2018-11-26 22:45:45,I think I'm ready to Shiny Hunt for Mewtwo now. 
361,507,1066,2018-11-26 22:45:27,I really need to get back into competitive Pokemon LOL. come hang out with me while I stream Wi-Fi Battles: 
363,510,1069,2018-11-26 22:45:17,"After sending things from pokemon go all I need now is Scyther(rip it's the only lgp exclusive I didn't have on go) and the 4 pokemon that trade evolve, making 5 to go in total,, Anyone help a girl out with completing the pokedex please, "
364,511,1070,2018-11-26 22:45:12,Yaaay!!! My first shiny! 
365,513,1072,2018-11-26 22:44:59,Yay our guide/Pokdex for has arrived  along with our t-shirts  will be enjoying his shirt a lot  
366,514,1073,2018-11-26 22:44:58,Ta-da! A fresh happy childhood just arrived!   
367,515,1074,2018-11-26 22:44:57,Time to hunt. 
368,516,1075,2018-11-26 22:44:46,interesting 
369,518,1077,2018-11-26 22:44:14,This Gloom loves his sunny spots  
370,519,1078,2018-11-26 22:44:07,So sick of 
371,521,1080,2018-11-26 22:43:57,"The Pokeball Plus is terrible for controlling the game! I can more accurately aim my ball throws with a Joy Con than with the Pokeball! least it's very useful for Pokemon GO when driving up Main St for spinning stops automatically.Also only 1 Mew PER BALL"""
372,523,1082,2018-11-26 22:43:32,TuT the 4 day grind was worth it 
373,530,1089,2018-11-26 22:42:35,These were cute uwu 
374,531,1090,2018-11-26 22:42:27,With my TV busted I couldn't get a PS4 right now. So in the mean time I picked this up for myself. Early Christmas gift to me!  
375,532,1091,2018-11-26 22:42:10,IT'S HIMIT'S THE BOYTHIS IS THE DEEP LORE I EXPECT FROM REMAKES 
377,535,1094,2018-11-26 22:41:54,We're back at it again with more 
378,537,1096,2018-11-26 22:41:45,That kind of night in this pouring rain. --
379,540,1099,2018-11-26 22:41:38,Thanks I think so also. 
380,541,1100,2018-11-26 22:41:37,The music was really nice here 
384,545,1104,2018-11-26 22:40:49,;) hell yeah 
385,546,1105,2018-11-26 22:40:41,SHINEY CHARIZARD 
387,548,1107,2018-11-26 22:39:52,For this week until friday we are going strong with combined with a little bit of and As always the same time (12 pm gmt+1)Visit us over on 
388,549,1108,2018-11-26 22:39:51,SHINY MOTHERFLIPPIN' GASTLY BRUH!!! 
389,552,1111,2018-11-26 22:39:43,Me and my eevee (named Macho) in little matching sailor outfits 
391,554,1113,2018-11-26 22:39:21,My new painting be jealous ash 
392,555,1114,2018-11-26 22:39:20,Guess who's the champion now ;) 
393,556,1115,2018-11-26 22:39:17,Shiny parte 2 
395,558,1117,2018-11-26 22:39:02,so i made my chansey kinda strong 
396,559,1118,2018-11-26 22:38:54,I didn't even chain.  
397,560,1119,2018-11-26 22:38:11,Sandshrew Shiny parte 1 
398,561,1120,2018-11-26 22:38:01,BEHOLD HIS DIVINE POWER! 
399,562,1121,2018-11-26 22:37:59,found my 2nd shiny!!! 
401,565,1124,2018-11-26 22:37:25,"Hunting for a shiny Vulpix, but a shiny Psyduck works too! "
402,566,1125,2018-11-26 22:37:23,you are my babychild 
403,567,1126,2018-11-26 22:37:13,Going back live with some 
