,Unnamed: 0,Unnamed: 0.1,date,text
1,2,93846,2018-11-19 23:59:55,best title screen 
2,3,93847,2018-11-19 23:59:54,WE SISTER STAN 
3,4,93848,2018-11-19 23:59:52,I chose Who will you choose for your adventure on 
4,5,93849,2018-11-19 23:59:50,Hooked me a Goldie boi!! 
5,9,93853,2018-11-19 23:59:45,Prepare for trouble!James: And make it double! 
8,15,93859,2018-11-19 23:59:35,watch the tail!!!! 
10,20,93864,2018-11-19 23:59:20,150th Stream for 2018! That's one for every Gen 1 Pokemon! More tonight. See you in a few minutes! &lt;3 
11,21,93865,2018-11-19 23:59:12,My Heart... 
12,22,93866,2018-11-19 23:59:12,After shipment shenanigans resulted in dashed expectations: the time is finally here and I'm wearing my uniform  
13,25,93869,2018-11-19 23:59:07,Shiny evolution 
15,28,93872,2018-11-19 23:58:52,SO FUCKING CUTE!!!! 
16,29,93873,2018-11-19 23:58:51,Ahhh that's a cool pose. James with the rose. 
17,32,93876,2018-11-19 23:58:48,this is either a popular pose or gamefreak got lazy 
18,34,93878,2018-11-19 23:58:40,My mans thirsty 
20,38,93882,2018-11-19 23:58:29,My little ponyta 
21,40,93884,2018-11-19 23:58:23,Is starting with Mew cheating? 
23,43,93887,2018-11-19 23:58:14,"This is absolutely disgusting, these stats are wild. "
24,45,93889,2018-11-19 23:58:12,coming 
25,48,93892,2018-11-19 23:58:05,Second shiny Vulpix 
29,53,93897,2018-11-19 23:57:55,Must protect at all times 
30,54,93898,2018-11-19 23:57:53,2 30+ combos broken later c: 
31,60,93904,2018-11-19 23:57:32,Pokemon Let's Go Episode 3: Mt. Moon Chronicles via 
32,64,93908,2018-11-19 23:57:18,Shiny Mega Blastoise is *everything* 
33,65,93909,2018-11-19 23:57:14,omg my heart &lt;333
35,67,93911,2018-11-19 23:57:09,of your evil looks. 
36,68,93912,2018-11-19 23:57:09,Litty 
37,70,93914,2018-11-19 23:57:05,he is GOD 
38,74,93918,2018-11-19 23:57:00,Pokemon: Let's Go arrived in the mail finally!  Let's get into this gig!
39,76,93920,2018-11-19 23:56:55,Bless 
40,77,93921,2018-11-19 23:56:54,My wife 
41,80,93924,2018-11-19 23:56:45,I'm fully smitten with the way my Krabby scuttles around next to me in 
44,87,93931,2018-11-19 23:56:17,Eevee's secret move is to KILL and walk away from the explosionI love my girl 
45,88,93932,2018-11-19 23:56:16,Finally 
46,89,93933,2018-11-19 23:56:16,"I noticed they're a pest, Game Freak, don't worry! "
49,94,93938,2018-11-19 23:56:07,"O Sweet Golden Child, tell me your secrets "
50,98,93942,2018-11-19 23:55:50,After 8 hours of hunting this beauty appeared! Ponyta was my target but I will gladly take a shiny Eevee 
52,101,93945,2018-11-19 23:55:48,What did I just do? 
53,102,93946,2018-11-19 23:55:42,aaaaaa look at her 
56,106,93950,2018-11-19 23:55:27,would a guy like you join Team Rocket!? 
58,112,93956,2018-11-19 23:55:08,gs remakes confirmed 
59,113,93957,2018-11-19 23:55:06,im cry too cute 
60,114,93958,2018-11-19 23:55:03,I feel legend...wait for it... dary! Legendary! 
61,115,93959,2018-11-19 23:55:01,Its go time! Lets get those Squad Goals! Gonna catch a Squirtle and lots and lots of Eevees! 
62,116,93960,2018-11-19 23:54:59,check out these BOYS 
64,122,93966,2018-11-19 23:54:42,UM HELLO??!?!? ITS BEEN LIKE A DECADE HES STILL AS COOL AS I REMEMBER 
65,124,93968,2018-11-19 23:54:33,oh no... 
67,128,93972,2018-11-19 23:54:26,"these painting of Bell Tower, Mt. Silver, Alola, and Spear Pillar? "
68,129,93973,2018-11-19 23:54:19,"Day 1, and I'm already laughing! This is going to be a good game! "
69,132,93976,2018-11-19 23:54:08,Nope. 
70,133,93977,2018-11-19 23:53:59,Has anyone caught a shiny in yet?'
73,142,93986,2018-11-19 23:53:41,My big precious fire pupper evolved! &lt;333 
74,145,93989,2018-11-19 23:53:28,"tonight!!!!!!! 10pm est, be there!!!! "
75,151,93995,2018-11-19 23:53:14,Current team! 
76,152,93996,2018-11-19 23:53:13,Gonna do a few shiny chains then continue the story!
79,156,94000,2018-11-19 23:53:02,First throw 
80,157,94001,2018-11-19 23:53:00,games are getting review-bombed on Metacritic 
81,158,94002,2018-11-19 23:52:59,Bruh why nidoran run after I gave it a razz berry.  Breaking my chain. 
83,166,94010,2018-11-19 23:52:44,Level of loneliness: playing with myself in Pokemon :'') 
84,168,94012,2018-11-19 23:52:40,Literally just doing this to transfer my screenshots 
85,169,94013,2018-11-19 23:52:37,Blue! 
88,172,94016,2018-11-19 23:52:24,ohhhh my godddddd i love pikachu 
90,175,94019,2018-11-19 23:52:19,Who wants to catch them all with me Tonight 8pm CST 
91,176,94020,2018-11-19 23:52:18,Helping me keep an eye out for shinnies 
93,181,94025,2018-11-19 23:52:02,Grinding in Pokmon tonight since Fallout 76 has a huge update I didnt know about. Come hang out! 
95,183,94027,2018-11-19 23:52:00,out there. 
97,185,94029,2018-11-19 23:51:58,"When your pokemon say ""Nah not today."" "
98,186,94030,2018-11-19 23:51:58,"This dapper gentleman wont share his diglet hat, but i guess i understand..  "
99,189,94033,2018-11-19 23:51:49,WHAT??? 
104,197,94041,2018-11-19 23:51:34,EXCUSE ME 
105,198,94042,2018-11-19 23:51:33,"Went to play then realized too late that I hadn't charged my for a while...so now I have to wait and charge it...*sobs*"""
106,199,94043,2018-11-19 23:51:32,"I was going to go with Gary, but he's not Gary... "
107,200,94044,2018-11-19 23:51:28,Going to start streaming is about 10 minutes over on my Twitch.'
108,201,94045,2018-11-19 23:51:27,how cute is this big noodle 
109,204,94048,2018-11-19 23:51:22,"first shiny in this game, which randomly showed up. probably the second one wild one i got in my entire life "
110,215,94059,2018-11-19 23:51:05,WHAT A CLUTCH 
112,217,94061,2018-11-19 23:51:00,Shiny hunting wasn't a mistake 
113,219,94063,2018-11-19 23:50:55,"After a long day, I am curled up with and an Rose. Thank goodness  "
115,222,94066,2018-11-19 23:50:34,"I'll be filming and finishing my Meltan Special Research tomorrow! No new video today, but I will be livestreaming Pokemon Lets Go Pikachu in a couple hours. See you then trianers!  "
116,224,94068,2018-11-19 23:50:24,I'm dying over here this game is too cute 
117,225,94069,2018-11-19 23:50:24,"Full disclosure:I wouldn't be able to play without the aim-assist. I love the it........Unless I'm throwing predict-throws at Grimer. Then the aim assist always launches my balls way too high.I caught a Pidgey while fighting a Grimer thanks to the aim-assist """
118,226,94070,2018-11-19 23:50:22,Give me my fucking shiny. 
119,230,94074,2018-11-19 23:50:16,I GOT MY FIRST SHINY  
120,231,94075,2018-11-19 23:50:16, I FINALLY GOT MY SHIPMENT &lt; &gt; 
121,237,94081,2018-11-19 23:49:57,Casually thinks about how cute I am 
122,239,94083,2018-11-19 23:49:52,How much Exp points i got ! 
124,244,94088,2018-11-19 23:49:33,"Despite the many issues with the game, at least it still knows how to melt your heart after all these years. "
126,246,94090,2018-11-19 23:49:27,Rough n Tumble ready to rough you up 
128,248,94092,2018-11-19 23:49:24,"detective pikachu? hah, try policeevee.///we look good lol "
130,252,94096,2018-11-19 23:49:17, 2h left... fuck off Chansey &gt;&lt;'  
131,253,94097,2018-11-19 23:49:17,Watching this beauty take off 
134,265,94109,2018-11-19 23:48:52,Shiny Starmie! 
135,268,94112,2018-11-19 23:48:50,got my first glitch 
137,271,94115,2018-11-19 23:48:40,Classic Team Rocket Trio! 
139,274,94118,2018-11-19 23:48:33,"I dont think people really have a grasp on how spoiled you are to have a game that looks, and feels as GREAT as is. Its amazing where the series has gone since Pokemon Yellow way way back. Go play that and then you will REALLY know the difference. "
141,279,94123,2018-11-19 23:48:24,I CAN FINALLY REST 
142,280,94124,2018-11-19 23:48:23,begins... 
143,281,94125,2018-11-19 23:48:22,no not really 
144,282,94126,2018-11-19 23:48:20,me after launching my fortnite-based twitch channel 
145,284,94128,2018-11-19 23:48:07,Shiny Raticate Hypeno freakout 
146,285,94129,2018-11-19 23:48:07,My investment has paid off!! 
147,286,94130,2018-11-19 23:48:06,when he calls you his girl ^_^;
148,288,94132,2018-11-19 23:48:02,Send help. 
150,293,94137,2018-11-19 23:47:54,It makes you a pathetic excuse of a human being! 
151,294,94138,2018-11-19 23:47:47,"Speaking of Vulpix, does anyone want an Alolan Vulpix? "
152,300,94144,2018-11-19 23:47:36,I maaay be enjoying this game &gt;.&gt; 
154,304,94148,2018-11-19 23:47:30,changes not tied to an Npc?HELL YEAH! 
155,307,94151,2018-11-19 23:47:19,"When you tell her about your 12"" horse schlong "
156,309,94153,2018-11-19 23:47:13,*Gross sobbing* 
157,310,94154,2018-11-19 23:47:12,Shiny Butterfree! 
158,313,94157,2018-11-19 23:47:10,"We're live with more with at come hangout!"""
159,314,94158,2018-11-19 23:47:07,but every time there's a critical hit says 
160,317,94161,2018-11-19 23:47:02,I got it :D 
161,319,94163,2018-11-19 23:47:00,if I have anything to say about it! 
162,320,94164,2018-11-19 23:46:55,Intimidating ninja men agressively closing in on you in 20fps 
163,321,94165,2018-11-19 23:46:55,Are You Enjoying ?'
164,324,94168,2018-11-19 23:46:40,Got it! :D 
167,332,94176,2018-11-19 23:46:18,it doesn't! It belongs to its citizens! 
168,334,94178,2018-11-19 23:46:15,My Shiny Dragonite I got while Pidgey chaining! 
169,336,94180,2018-11-19 23:46:13,AHHHHHHHHHHHHHHHHHHHHHHHHHHHHHHHHHHHHHHHHHHHHHHHH FULL ODDS 
171,339,94183,2018-11-19 23:46:11,Someone needs to tell Officer Jenny that ACAB. 
172,341,94185,2018-11-19 23:46:07,OHHHHHHHHHH BOY! FIRST LEGEND! 
173,342,94186,2018-11-19 23:46:05,They Know.  They fucking know. 
176,345,94189,2018-11-19 23:45:59,What should I next in '
177,347,94191,2018-11-19 23:45:56,Work is drainning me only bad thing about Christmas! live again though  
179,349,94193,2018-11-19 23:45:47,Who's going to win? 
181,353,94197,2018-11-19 23:45:37,"One thing i can't wait for is.. The holidays to be over, i just want get my hands on already. Torture seeing everyone playing theirs... I just want to cry. """
182,357,94201,2018-11-19 23:45:24,"would be great, but I'm here to help as well! "
183,361,94205,2018-11-19 23:45:19,No need to tell me what I already know. 
184,362,94206,2018-11-19 23:45:14,I did not see this coming 
186,365,94209,2018-11-19 23:45:11,i love that they add new scenes centered around your partner 
187,370,94214,2018-11-19 23:44:59,My champion team! 
188,372,94216,2018-11-19 23:44:57,Here we go 
189,377,94221,2018-11-19 23:44:50,the dialog changes are the most interesting 
190,380,94224,2018-11-19 23:44:40,Another win! 
193,386,94230,2018-11-19 23:44:24,I hate this game sometimes... 
194,389,94233,2018-11-19 23:44:23,Caught 
195,392,94236,2018-11-19 23:44:22,will do no such thing! 
197,397,94241,2018-11-19 23:44:16,GAME IS TOO HARD  
200,401,94245,2018-11-19 23:44:05,...so we meet again... 
201,403,94247,2018-11-19 23:43:55,Hi is this where I can sign up to join team rocket? 
202,407,94251,2018-11-19 23:43:52,...Please tell me you're joking.
203,409,94253,2018-11-19 23:43:50,flute might come in handy. 
204,411,94255,2018-11-19 23:43:43,may I please private message you ma'am  
205,421,94265,2018-11-19 23:43:22,Introducing our first Team Event! Choose your team wisely! Sign-up details can be found in our Announcement page! 
206,422,94266,2018-11-19 23:43:17,over? Then I better go help liberate Saffron City from Team Rocket! 
207,424,94268,2018-11-19 23:43:12,My son 
208,427,94271,2018-11-19 23:43:03,"tonight!!!!!!! 10pm est, be there!!!!'"
209,430,94274,2018-11-19 23:42:50,1st shiny other than zubats or golbats lets go! 
210,431,94275,2018-11-19 23:42:49,Caught this dude back on rt. 22. Boy oh boy do I know how to pick em
211,432,94276,2018-11-19 23:42:48,"Hello, old friend.  "
212,436,94280,2018-11-19 23:42:44,My first shiny 
213,437,94281,2018-11-19 23:42:38,Oh yeah. I named my rival after you. 
214,438,94282,2018-11-19 23:42:31,"Found a place for my posters, on either side of my blue screen. These are beautiful things, well worth the extra money to preorder the games a second time from GameStop.Speaking of, don't forget to enter the giveaway! Only a few hours left! Check my pinned Tweet. "
215,444,94288,2018-11-19 23:42:02,the Pokeball Plus controller is actually really amazing. it feels so natural and perfect to the game. its got a great sturdy feel and weight to it that feels just right. i havent even left Pallet Town and i'm loving this so far
216,448,94292,2018-11-19 23:41:58,Fuji was involved in some kind of research? 
217,452,94296,2018-11-19 23:41:46,Lt. Surge parla come i pro di Splatoon 
219,454,94298,2018-11-19 23:41:43,I fucking love this game 
220,455,94299,2018-11-19 23:41:36,Critical hit to the nostalgia 
221,459,94303,2018-11-19 23:41:30,"My just arrived! It took a little longer than it should have, but it was worth the wait to get the plush :D "
222,461,94305,2018-11-19 23:41:20,"Start a shiny hunt for a Charmander, get a first encounter Shiny Onix!!!via @YouTube'"
223,465,94309,2018-11-19 23:41:06,nintendo showing pokemon quest and let's go games in this 
224,467,94311,2018-11-19 23:41:03,"Cubone. Don't worry, we'll avenge your mother. "
225,471,94315,2018-11-19 23:40:55,This game is pretty fudgen cute 
226,473,94317,2018-11-19 23:40:46,Hi you amazing people!!! I've missed you guys!! To make up for falling asleep last night and not streaming I figure I will go live today!! Gonna do some heckin chat's with some tunes before more Pokemon Let's Go!!
227,474,94318,2018-11-19 23:40:38,Need someone to trade with in to evolve my Kadabra.'
228,475,94319,2018-11-19 23:40:37,gladi brought you over 
229,476,94320,2018-11-19 23:40:36,Shiny hunting begins...... NOW 
230,477,94321,2018-11-19 23:40:35,I AM LOVE. 
231,481,94325,2018-11-19 23:40:24,so cute 
232,482,94326,2018-11-19 23:40:23,Only took 250 catches in 7 hours to get this bad boy. FeelsGoodTired 
233,489,94333,2018-11-19 23:40:12,"I know with I can make a charm of Eevee now, but with that being said... Is there any other pokemon or franchise youd like charm sets for? Comment below! "
234,492,94336,2018-11-19 23:40:02,I'm expecting shinies everywhere 
235,494,94338,2018-11-19 23:39:59,Back tonight with stream of Eevee at 7pm EST on Part 3 will take me through rock tunnel to Lavender Town for some spooky ghost action! 
236,497,94341,2018-11-19 23:39:59,More Eevee tonight. We're on our way through Rock Tunnel into Lavender Town. Come relax with us. It'll be fun and you can laugh at my idiocy.
237,500,94344,2018-11-19 23:39:54,"big ghost is actually the spirit of Cubone's mother, Marowak! "
238,501,94345,2018-11-19 23:39:53,2 sec after turning the game on lol 
239,507,94351,2018-11-19 23:39:41,"dunno, if we go by GO logic they kinda were all over the place here "
241,512,94356,2018-11-19 23:39:32,Those were the memories to treasure! I remember transferring some of my to and seeing them in better graphics. It was spectacular. I think it's similar to what and do with 
242,515,94359,2018-11-19 23:39:30,I just had to do fan art of the new Pokemon game it's so dang cute!!!
244,522,94366,2018-11-19 23:39:18,"The first i caught on my adventure in has fully evolved, Vines my Victreebel.   "
245,525,94369,2018-11-19 23:39:08,i friggen hope not 
246,528,94372,2018-11-19 23:38:51,Cucked 
247,530,94374,2018-11-19 23:38:46,Send Help 
248,532,94376,2018-11-19 23:38:44,Yessss Ive never been so ready!! 
249,535,94379,2018-11-19 23:38:41,Shiny Rhyhorn After 9 hours at 1:36am!!!! 
250,537,94381,2018-11-19 23:38:34,"this Sliph Scope, I can reveal that the ghosts are actually just um... Ghost-Type Pokemon. "
251,538,94382,2018-11-19 23:38:33,Thanks? 
254,541,94385,2018-11-19 23:38:17,Going live right NOW!!!! Starting with some up in here  @thehellzarmy'
255,544,94388,2018-11-19 23:38:03,Shiny!! 
256,545,94389,2018-11-19 23:38:00,My first shiny ! (no chain) 
257,547,94391,2018-11-19 23:37:57,S.S. Anne 
260,550,94394,2018-11-19 23:37:47,"mostly looks good, but Ekans can't go two seconds without clipping through the ground. "
261,551,94395,2018-11-19 23:37:43,love 
262,554,94398,2018-11-19 23:37:40,dis you. 
263,555,94399,2018-11-19 23:37:40,I'm really enjoying I'm ready to Step Up as The Official Gym leader of Come Fight me Bro! 
264,557,94401,2018-11-19 23:37:33,online battles with my Mew 
265,559,94403,2018-11-19 23:37:27,"Ninja Gaiden first, then Pokmon.AKA, Something Salty, something Sweet. "
266,560,94404,2018-11-19 23:37:27,What it's like to cross paths with a fellow trainer in 
271,575,94419,2018-11-19 23:37:04,Okay time to take over the world. 
275,583,94427,2018-11-19 23:36:47,Someone mentioned the cinematography of the new game which was strange 
276,584,94428,2018-11-19 23:36:45,Tried looking for dragonite until I found this out in the open on route 2 awesomee 
278,588,94432,2018-11-19 23:36:35,she angry 
279,590,94434,2018-11-19 23:36:30,"Been playing Pokemon Lets Go all night, got to Fuschia and transferred about 40 Pokemon from Pokemon Go, at 101 on the Pokedex already! "
282,595,94439,2018-11-19 23:36:23,"So..... you wanna complete your dex, huh? "
284,600,94444,2018-11-19 23:36:12,Hello my shiny friend  
285,606,94450,2018-11-19 23:35:48,Setting Snorlax as the Pokemon following you  
288,615,94459,2018-11-19 23:35:29,"i have no idea, man "
289,617,94461,2018-11-19 23:35:27,My Meltan farm! 
291,630,94474,2018-11-19 23:35:04,Love this game! 
292,632,94476,2018-11-19 23:35:01,Looking to do my first official shiny hunting stream soon on Twitch for Who should I go for?'
293,641,94485,2018-11-19 23:34:43,"Yeah, I go to the gym. "
295,647,94491,2018-11-19 23:34:27,I can live with this 
297,651,94495,2018-11-19 23:34:23,"Ok guys this is like very important, which game should I get?! '"
298,652,94496,2018-11-19 23:34:23,SKSNCFJRNXKS I FINALLY GOT MY BLUE BABY BOY 
299,654,94498,2018-11-19 23:34:17,EXCUSE ME WHAT 
300,655,94499,2018-11-19 23:34:17,Really? You don't look too happy 
301,657,94501,2018-11-19 23:34:13,Aloha Geodude is such a bad look 
302,658,94502,2018-11-19 23:34:13,come at me bro 
304,660,94504,2018-11-19 23:34:10,The ONLY way to travel 
305,667,94511,2018-11-19 23:33:54,Let's gooo!!! 
307,671,94515,2018-11-19 23:33:33,Dating advice from James 
310,681,94525,2018-11-19 23:33:22,giggity 
311,684,94528,2018-11-19 23:33:16,Sabrina is my favorite Kanto gym leader. 
314,693,94537,2018-11-19 23:32:54,Casually getting hit while underground 
315,695,94539,2018-11-19 23:32:50,Pokmon: Let's Go is a constant delight. I didn't expect to like the format changes as much as I do. Now I actually hope the series moves away from random battles. My review for 
316,696,94540,2018-11-19 23:32:48,"Hi, yes, occasionally streaming is stressful and everything breaks, like, 2 minutes before you're supposed to go live. But here we are, because Eevee believes in us no matter what. Live with some "
317,697,94541,2018-11-19 23:32:46,this absolute mad lad 
319,703,94547,2018-11-19 23:32:26,On the machine tonight! 8 PM EST - Playing  - Come hang out! 
321,706,94550,2018-11-19 23:32:04,Cake anyone? 
322,707,94551,2018-11-19 23:31:59,She's so cute!!! Glad I've had a good shiny hunt! 
323,711,94555,2018-11-19 23:31:40,reclaim after having one run before. 
325,714,94558,2018-11-19 23:31:37,We cute af 
326,719,94563,2018-11-19 23:31:32,"players help me. For the Alolan trades, does the Pokemon you recieve have the same IVs as the one you trade?'"
327,720,94564,2018-11-19 23:31:31,After playing for about 40hours so far this weekend.. I think its about time to show a little bit of love again  '
328,724,94568,2018-11-19 23:31:27,Does Alolan Vulpix still evolve with an Ice Stone in ?'
329,727,94571,2018-11-19 23:31:23,Getting ready for the holidays. Playing some between queues in Leveling stuff up before we leave for vacation! 
330,728,94572,2018-11-19 23:31:23,"see, because it punches "
331,732,94576,2018-11-19 23:31:13,snorlax is my favorite pokemon protag 
332,739,94583,2018-11-19 23:30:57,MIKE AND MATT GOT THEIR COPIES OF 
333,741,94585,2018-11-19 23:30:51,I for one think Wartortle has the best Final Smash 
334,745,94589,2018-11-19 23:30:47,I've been playing for over 9 hours!! I can't put the game down lol 
335,748,94592,2018-11-19 23:30:37,Anyone want to be the Very Best? Like no one ever was? We now boiz! 
336,750,94594,2018-11-19 23:30:34,Only 90's kids would understand.
338,758,94602,2018-11-19 23:30:15,SHE'S BAAAAAALLLLDDDDDD    
340,760,94604,2018-11-19 23:30:12,Enjoying 
341,766,94610,2018-11-19 23:29:59,I named her Hanabi. I love her. 
342,784,94628,2018-11-19 23:29:16,CRACKED THE CODE!1/2 
343,785,94629,2018-11-19 23:29:13,this cant get any cutter ;; 
344,786,94630,2018-11-19 23:29:07,frae you sure you can drive this thing 
346,792,94636,2018-11-19 23:28:55,this is better 
347,796,94640,2018-11-19 23:28:47,Big Boy 
349,800,94644,2018-11-19 23:28:38,Really digging this game so far.  
351,805,94649,2018-11-19 23:28:31,My heart 
352,807,94651,2018-11-19 23:28:25,WHAT YOU SO CUTE FOR?! 
353,811,94655,2018-11-19 23:28:16,AAAAAAHHHHHH I'm so happy!!! 
354,814,94658,2018-11-19 23:28:09,"Look everyone, the game I was supposed to get 3 days ago came! Now I can finally play it and stop being really bitter at Amazon for the delay!!! "
356,822,94666,2018-11-19 23:27:52,Why yes you can ride on a ghost boy 
357,823,94667,2018-11-19 23:27:50,been hearing that all day 
358,827,94671,2018-11-19 23:27:43,I'm loving it!!! 
360,829,94673,2018-11-19 23:27:38,12 hours 2 days 
361,835,94679,2018-11-19 23:27:18,wait for it 
362,836,94680,2018-11-19 23:27:18,"""m-mom?"" "
363,841,94685,2018-11-19 23:27:06,trainers call bullcrap 
364,852,94696,2018-11-19 23:26:37,cue the mission impossible music were going undercover 
365,855,94699,2018-11-19 23:26:36,achoo 
366,859,94703,2018-11-19 23:26:21,Final push to finish Let's Gp. Eevee!  Come watch 
367,861,94705,2018-11-19 23:26:19,full odds shiny raticate! 
368,862,94706,2018-11-19 23:26:14,nintendo are cowards who won't let me rename this alola dugtrio 'mmmbop' 
369,868,94712,2018-11-19 23:26:00,Shine it on me 
375,889,94733,2018-11-19 23:25:26,Hail Giovanni! the great Pokemon villain ever 
376,891,94735,2018-11-19 23:25:24,Wait I actually really wanna get now where tf is my wallet'
377,892,94736,2018-11-19 23:25:22,Why is mom Alolan? 
378,893,94737,2018-11-19 23:25:18,"Well... I was 100 deep into a chain for Pikachu, but this is the same colours at least? "
379,895,94739,2018-11-19 23:25:14,add my friend code 
380,897,94741,2018-11-19 23:25:11,"8 hours of shiny hunting, and it finally spawned! Get in! "
381,898,94742,2018-11-19 23:25:04,Has anyone done this yet 
385,906,94750,2018-11-19 23:24:50,stream in t minus 10ish minutes
386,908,94752,2018-11-19 23:24:48,thanks. 
387,912,94756,2018-11-19 23:24:34,"Hoping to make it to GO Park today in Can't wait to transfer Pokemon from to clear up storage space =P"""
390,920,94764,2018-11-19 23:24:25,It flap. It looks so happy! 
391,921,94765,2018-11-19 23:24:24,PLEASE tell me if you stream this I want to watch  
392,923,94767,2018-11-19 23:24:17,i still love him 
393,924,94768,2018-11-19 23:24:10,Watch kevinkrust on Twitch throwing his pokeballs playing 
394,926,94770,2018-11-19 23:24:02,second wild shiny today 
395,928,94772,2018-11-19 23:24:01,"Hello, cute new friend! "
397,935,94779,2018-11-19 23:23:47,"Yeah, I could barely read that. Could you? "
398,938,94782,2018-11-19 23:23:34,Attempting to complete the pokedex tonight. 
399,941,94785,2018-11-19 23:23:33,Caught an Abra while farming Vulpix for my Pikachu pals  
400,943,94787,2018-11-19 23:23:31,Erstes Shiny! 
401,948,94792,2018-11-19 23:23:23,This Charmander is so stubborn i had to use a greatball 
402,953,94797,2018-11-19 23:23:09,Which game should get for 
403,959,94803,2018-11-19 23:22:55,oooooooooo one of da bbs 
404,964,94808,2018-11-19 23:22:50,Fat fucks 
406,976,94820,2018-11-19 23:22:12,that guy! 
407,978,94822,2018-11-19 23:22:10,How cute is this?! :-) 
408,980,94824,2018-11-19 23:22:05,"Felt cute, Might delete later"
409,982,94826,2018-11-19 23:22:03,Gonna be the in in 5 minutes on the Facebook page. Come and hang! 
411,987,94831,2018-11-19 23:21:54,Even Pikachu likes high fives 
413,994,94838,2018-11-19 23:21:34,Dem throws be hard. Somehow one didn't register...lol 
414,995,94839,2018-11-19 23:21:32,"what the heck, eevee's savage "
417,1003,94847,2018-11-19 23:21:16,Gotta catch em all! 
418,1005,94849,2018-11-19 23:21:10,The furry community 
420,1009,94853,2018-11-19 23:21:02,val saves the day! 
423,1017,94861,2018-11-19 23:20:44,ignore that first throw lol. this is catch no. 116 
424,1018,94862,2018-11-19 23:20:39,Is there any other way to travel? I didn't think so 
425,1020,94864,2018-11-19 23:20:31,who want Eevee?  
426,1021,94865,2018-11-19 23:20:28,Just hit odds. Kill me. 
427,1022,94866,2018-11-19 23:20:24,Got a girl Eevee right away!  
428,1028,94872,2018-11-19 23:20:19,of course it did 
430,1034,94878,2018-11-19 23:20:10,"Secret Techniques are the perfect replacement for HM's, even better than Poke Rides.Stick with that for the next game, please. "
431,1036,94880,2018-11-19 23:20:07,"""Livee ate a leaf that floated by."" "
432,1037,94881,2018-11-19 23:20:07,I took these pictures for a potential pfp 
433,1040,94884,2018-11-19 23:19:58,i can't wait either let's go!!!
434,1042,94886,2018-11-19 23:19:52,Bravo Gamefreak 
436,1045,94889,2018-11-19 23:19:43,memories from home 
437,1046,94890,2018-11-19 23:19:42,My goal is complete &lt;3 
438,1048,94892,2018-11-19 23:19:40,"I'm also intending to play more and during this time frame, fwiw. But obviously need to get my MMO fix in."""
439,1049,94893,2018-11-19 23:19:40,Welcome to the team Squirtle 
440,1050,94894,2018-11-19 23:19:32,Bugged dialog doesn't pause 
441,1051,94895,2018-11-19 23:19:31,And now we travel in style! 
