,Unnamed: 0,Unnamed: 0.1,date,text
6476,18493,87219,2018-11-20 04:56:16,Yes my rival's name is Trash andd see that poster on the wall? Thats a nostalgic hit to my soouuulll. Season 1 ep. 1 Pokmon 
6477,18494,87220,2018-11-20 04:56:16,Its GO Time!! Pokmon Style! Going Live  
6478,18496,87222,2018-11-20 04:56:15,Arceus bless this game. 
6479,18499,87225,2018-11-20 04:56:01,EXCUSE ME 
6480,18506,87232,2018-11-20 04:55:42,"Um, okay... "
6482,18510,87236,2018-11-20 04:55:35,Nice full odds. 
6483,18512,87238,2018-11-20 04:55:33,On that shiny grind :') 
6484,18516,87242,2018-11-20 04:55:20,Thanks. 
6485,18523,87249,2018-11-20 04:55:08,100 magikarp and yet no shiny:( 
6486,18528,87254,2018-11-20 04:54:57,Another Gym down! 
6487,18530,87256,2018-11-20 04:54:49,She's gorgeous &lt;3 I don't even mind the subpar nature 
6488,18536,87262,2018-11-20 04:54:27,My favorite version of Ace Trainers 
6489,18537,87263,2018-11-20 04:54:21,"Unpopular opinion, Shiny pokemon should be something you find naturally that make a pokemon memorable and special.Not something you should farm or min/max, spend hours trying to get."
6490,18544,87270,2018-11-20 04:54:09,this feels like a good reaction image 
6491,18548,87274,2018-11-20 04:53:51,I love the new stat screens 
6492,18549,87275,2018-11-20 04:53:37,lol ONLY CAUGHT TWO WHAAAAT 
6493,18551,87277,2018-11-20 04:53:33,HELP
6494,18554,87280,2018-11-20 04:53:15,Why must you treat me like this? 
6495,18558,87284,2018-11-20 04:53:00,Into it tbh. 
6496,18560,87286,2018-11-20 04:52:53,jeeeeeesus dude this game really holds your hand huh 
6497,18562,87288,2018-11-20 04:52:47,Bless this shiny Indiana Jones boulder monster. 
6498,18563,87289,2018-11-20 04:52:46, To anyone that actual follows me sorry fr pokrmon spam 
6499,18568,87294,2018-11-20 04:52:37,"i knew this lady looked familiar, she's the fairy gym leader in sun and moon!! "
6500,18569,87295,2018-11-20 04:52:36,currently sobbing 
6501,18571,87297,2018-11-20 04:52:33,Master 
6502,18572,87298,2018-11-20 04:52:31,I have the biggest fucking smile on my face. 
6503,18580,87306,2018-11-20 04:52:15,"The rival is cool, you guys are just mean "
6505,18582,87308,2018-11-20 04:52:13,Still needs more 
6507,18584,87310,2018-11-20 04:52:04,I got my first pokemon and immediately abandoned my boy. 
6509,18589,87315,2018-11-20 04:51:43,Slay 
6510,18590,87316,2018-11-20 04:51:36,IM CRYIN 
6512,18595,87321,2018-11-20 04:51:26,oh same 
6513,18597,87323,2018-11-20 04:51:23,Pokemon war mounts are all this series reallyto needed 
6514,18599,87325,2018-11-20 04:51:20,Just got 19 levels from doing a quick walk yesterday... Glad I decided to stop using Eevee in game. 
6515,18601,87327,2018-11-20 04:51:16,100 tries at the optimal level and nada 
6516,18606,87332,2018-11-20 04:51:07,"one of THEM!"" "
6517,18607,87333,2018-11-20 04:51:04,Time to catch more of them! Come hang out as I multi stream with we are trying out the multi chat overlay in OBS. Lets see how this goes!  :D
6518,18609,87335,2018-11-20 04:51:01,It is monday and we're going to be continuing Pokemon Lets Go. We will venture through the rock cave and move on to the next gym Feel free to join and chill as we journey kanto again.    
6520,18614,87340,2018-11-20 04:50:49,Stylin' 
6521,18620,87346,2018-11-20 04:50:28,SHINY CHARMANDER APPEARED!?oh yeah.. WE'RE LIVE ON TWITCH! 
6522,18622,87348,2018-11-20 04:50:22,get this fuking pidgey after 115 chainand still get no shiny pidgeyi wonder if the shiny pidgey IV will good as this one 
6523,18626,87352,2018-11-20 04:50:06,Misty!!! 
6524,18627,87353,2018-11-20 04:50:01,Uhhh... I think I got the wrong room. 
6525,18628,87354,2018-11-20 04:49:58,This is the best thing about these games I swear omg 
6526,18629,87355,2018-11-20 04:49:56,"Thinking about it, are there any trading/battling groups on discord/telegram etc for Let's Go currently? I can't really sink time and money into GO to complete my pokdex! "
6527,18631,87357,2018-11-20 04:49:55,yas bitch 
6528,18633,87359,2018-11-20 04:49:54,my babiesssss !!! !! 
6529,18634,87360,2018-11-20 04:49:54,Loving !  
6530,18635,87361,2018-11-20 04:49:54,"Wild-caught Porygon, one of my all-time favorite Pokemon. "
6531,18636,87362,2018-11-20 04:49:53,Are you sure that's how this works...? 
6532,18637,87363,2018-11-20 04:49:53,The level difference... 
6534,18639,87365,2018-11-20 04:49:42,First shiny on Let's Go!! 
6535,18641,87367,2018-11-20 04:49:41,Team 
6536,18642,87368,2018-11-20 04:49:40,"Anyone else notice this in trainer battles? When the rival trainer uses a potion it says ""You used a potion."" "
6537,18646,87372,2018-11-20 04:49:32,is so much fun!!!! I just had a great battle with Come and hangout 
6538,18647,87373,2018-11-20 04:49:30,PLEASE PLEASE PLEASE add Cloud Save Data Backup to I dont want to lose my shiny Pokmon!! PokPlease!! 
6540,18652,87378,2018-11-20 04:49:16,"""Catch me human ...syke, u thought"" "
6541,18656,87382,2018-11-20 04:49:09,I cant stop playing  Im only half way through the game rn so Ill give my full review when Im finished but Im really enjoying it so much  That is all.'
6542,18657,87383,2018-11-20 04:49:04,Real Talk: This old dude looking a little too happy to see you. 
6544,18671,87397,2018-11-20 04:48:31,i'm gonna kidnap a bird 
6546,18676,87402,2018-11-20 04:48:24,if only i could actually read the letter asfgfdtgds 
6547,18678,87404,2018-11-20 04:48:21,Eevee is fucking bae!!!!!!!! 
6551,18689,87415,2018-11-20 04:47:39,Pikachu's little look he gives after ko'ing opponents is killing me 
6552,18690,87416,2018-11-20 04:47:32,How's it goin fellas 
6553,18694,87420,2018-11-20 04:47:17,1st shiny pidgey after a couple hour grind 
6554,18695,87421,2018-11-20 04:47:16,Just a bloke and his Mew. Schedule now live on Twitch. See you guys then 
6555,18696,87422,2018-11-20 04:47:14,"Ever since I got it's pretty much all I do. If I'm gaming, it's Pokmon. I just love that it's Pokmon Red with a twist! And Eevee! Omg, Eevee.  "
6556,18711,87437,2018-11-20 04:46:21,vs. TangelaThe rest of the plant gym went like this... 
6557,18712,87438,2018-11-20 04:46:15,I really wanted to join tho... 
6558,18718,87444,2018-11-20 04:46:02,i love them so much
6559,18719,87445,2018-11-20 04:46:00,Live! More Pokemon! 
6560,18720,87446,2018-11-20 04:46:00,not even three minutes in and i'm crying 
6564,18725,87451,2018-11-20 04:45:39,the ring around 
6565,18727,87453,2018-11-20 04:45:32,Deceeenttt 
6566,18729,87455,2018-11-20 04:45:28,Squad. 
6569,18736,87462,2018-11-20 04:44:38,Just sent a group text to my family members that I wanted a Switch and Pikachu Let's Go for Christmas. Yes Im married with a 2yo and i still need it. 
6571,18740,87466,2018-11-20 04:44:25,"a minute... YOURE NOT MY GRANDSON? YOURE OAK\'S ""MY GRANDSON"" "
6572,18741,87467,2018-11-20 04:44:24,primer shiny 
6573,18742,87468,2018-11-20 04:44:22,"whelp, I can stop playing now "
6574,18743,87469,2018-11-20 04:44:18,"More catchin' em all in - is briefly ahead, but he may or may not have played ahead this weekend. "
6575,18744,87470,2018-11-20 04:44:18,What yall like more 
6576,18749,87475,2018-11-20 04:44:12,this feels like a frickin chase scene  
6577,18753,87479,2018-11-20 04:43:57,"Love Playing with Your Pokball+ but want to mute the screams lol, Holding down the A button and clicking the B Button mutes your Pokball Plus! "
6578,18758,87484,2018-11-20 04:43:23,"Making a snack and then I'll be streaming some Switch games, starting with "
6580,18762,87488,2018-11-20 04:43:15,When you're upset but your friends are so dang good  
6581,18764,87490,2018-11-20 04:42:56,Cutie 
6582,18765,87491,2018-11-20 04:42:55,So this is actually the best. 
6583,18766,87492,2018-11-20 04:42:50,Not bad. 
6584,18770,87496,2018-11-20 04:42:33,My boy Gyarados be destroying these Ghastly with BITE!!! 
6585,18771,87497,2018-11-20 04:42:21,- 11/19/18 - Continuing 6 Gyms Down. 
6586,18772,87498,2018-11-20 04:42:21,thank you for my life pokemon 
6587,18774,87500,2018-11-20 04:42:10,Does anyone have a Pinsir and or Kangaskan in I wanna register them for my Pokdex'
6588,18776,87502,2018-11-20 04:41:59,I think I may have transferred one too many Articuno.Articunii?
6589,18781,87507,2018-11-20 04:41:51,this dude omg 
6590,18784,87510,2018-11-20 04:41:37,"Only in can I use 3 Silver Razz Berries, 3 Ultra Balls, get 3 ""Excellent"" throws, have the pokball shake 3 times, and still fail the catch.*deep breaths*WHY.WHO THE HELL DESIGNED THIS?! "
6591,18785,87511,2018-11-20 04:41:35," Get started on Pikachu Name rival Larry, cousin of Garry. Catch a bunch of pokemons Run through some forest Stomp every trainer in my way Beat Brock and get my gym badge Run through some cave Fail to catch big Clefable Arrive in the city'"
6592,18786,87512,2018-11-20 04:41:31,vs. Weepinbell 
6593,18787,87513,2018-11-20 04:41:30,Current party. Alolan Marowak is my choice ghost type for Sabrina. Plus it was one of my most anticipated to see following me. Also I named my Bellsprout Shibata from the start due to his wicked headbutts. :p 
6594,18788,87514,2018-11-20 04:41:23,Got em ouo 
6595,18792,87518,2018-11-20 04:41:05,Second batch of shiny Pokmon caught in for the Literally only finding green ones LOL. 
6596,18796,87522,2018-11-20 04:40:57,Legendary Number 2: Moltres HERE WE GOOOOOOOO!!!!!!!!!!!! 
6597,18798,87524,2018-11-20 04:40:56,im sad it doest roll like ground type sandsash but its so cute!!! LOOK AT HER WADDLE 
6598,18800,87526,2018-11-20 04:40:55,OOOMMMGGGGgggg help this is too cutee 
6599,18802,87528,2018-11-20 04:40:47,"Update on Nuggets, not the brightest but still awesome "
6600,18803,87529,2018-11-20 04:40:44,"I heard a million voices cry out ""step on me please,"" and so did she.  "
6602,18805,87531,2018-11-20 04:40:30,"Zippy zapper, looking fuckin' dapper "
6603,18807,87533,2018-11-20 04:40:22,Cascade Badge get! 
6604,18808,87534,2018-11-20 04:40:22,oh damn thats a nice detail 
6605,18809,87535,2018-11-20 04:40:21,im so in love with this game 
6607,18819,87545,2018-11-20 04:39:30,"Besides the new braces hurting like crazy tonight during stream... I absolutely adore Thanks for a chill stream &amp; all the sub love tonight! Long streams tomorrow &amp; Wednesday too since I'll be on holiday :D"""
6608,18820,87546,2018-11-20 04:39:28,Finally~ Mine has reached! 
6609,18823,87549,2018-11-20 04:39:24,This game is amazing! 
6610,18828,87554,2018-11-20 04:39:10,A contradiction in terms if I ever saw one. 
6611,18829,87555,2018-11-20 04:39:09,we match!!!!!! 
6612,18836,87562,2018-11-20 04:38:52,thE CHAD 
6613,18839,87565,2018-11-20 04:38:34,Live now! More Let's Go Eevee!
6614,18840,87566,2018-11-20 04:38:33,So proud of my beautiful son
6615,18842,87568,2018-11-20 04:38:30,moonblast is the best attack because it's the prettiest attack  
6616,18851,87577,2018-11-20 04:37:55,Is this super lucky or do they always give good Snorlaxes?
6619,18855,87581,2018-11-20 04:37:41,"Cool, but nothing will beat Zippy Zap! "
6620,18857,87583,2018-11-20 04:37:37,NON-RANDOM ENCOUNTERS WERE A MISTAKE 
6621,18859,87585,2018-11-20 04:37:25,the legend of oh worm? continues 
6622,18861,87587,2018-11-20 04:37:19,...Ok buddy 
6623,18863,87589,2018-11-20 04:37:18,I love this game!!! 
6624,18864,87590,2018-11-20 04:37:18,"what is it, boy? "
6625,18865,87591,2018-11-20 04:37:17,I'll never let go! 
6626,18866,87592,2018-11-20 04:37:09,Someone please stop me... 
6627,18867,87593,2018-11-20 04:37:08,Pretty much a big deal. Easily one of my favorite games. 
6628,18872,87598,2018-11-20 04:36:54,have you been watching a lot of Sponngebob lately? xD 
6630,18875,87601,2018-11-20 04:36:45,"We have the buzz about and Lets Go Eevee, including the Poke Ball Plus for both creators. "
6631,18883,87609,2018-11-20 04:36:23,I got him some acessories and now I look like I'm his agent.  
6632,18884,87610,2018-11-20 04:36:23,This is what heaven looks like. 
6633,18890,87616,2018-11-20 04:36:14,more gpoy  
6634,18892,87618,2018-11-20 04:36:08,Look mum I did it! 
6636,18894,87620,2018-11-20 04:36:06,"So yeah, LetsGO has been exciting for a lot of people but Niantic lets not put PokemonGO on the back burner here... where is our announcement for December community day? We need to plan our trips! "
6638,18899,87625,2018-11-20 04:35:38,Oh look... It's a ball of... mud. 
6639,18900,87626,2018-11-20 04:35:38,Can't unsee this as some UK Pokemon evolution chain. 
6640,18901,87627,2018-11-20 04:35:36,everything about is perfect !! 10/10 if u have a switch and dont own the game yet: what r u waiting for'
6641,18903,87629,2018-11-20 04:35:24,I'd like you all to meet my Pikachu 
6642,18909,87635,2018-11-20 04:35:08,gpoy really though 
6643,18910,87636,2018-11-20 04:35:07,MY FIRE BREATHING SCALY BOI 
6644,18914,87640,2018-11-20 04:34:55,Life goals &lt;3 
6646,18918,87644,2018-11-20 04:34:47,"{Fef} Before I go to bed, holy hay the experience from catching this Ponyta. Sadly my chain broke right after "
6647,18919,87645,2018-11-20 04:34:42,THE POSTER I'LL CRY 
6648,18920,87646,2018-11-20 04:34:41,Love 
6649,18921,87647,2018-11-20 04:34:40,"Finally playing a bit of and I really feel like this is a game for Nintendo to test the waters. Limited Pokdex for example. After Gen 8 hits, I can see sequels coming out based on Crystal but having all 900 and whatever Pokmon in it. "
6650,18929,87655,2018-11-20 04:34:28,"Headed to the gym after this MNF game, and then we are shiny hunting on LIVE on stream! "
6651,18932,87658,2018-11-20 04:34:22,My Pikachu is a big nerd. 
6652,18933,87659,2018-11-20 04:34:20,Meltan's Kanto Pokedex number is Does this shift every other Pokemon by one? (ie. Chikorita) 
6653,18937,87663,2018-11-20 04:34:11,Im dying from cute. 
6655,18944,87670,2018-11-20 04:33:50,"Congratulations, Eevee, you played yourself.  Thanks to SurlyIndeed for clipping this one! "
6656,18949,87675,2018-11-20 04:33:35,He aint even bothered. 
6657,18950,87676,2018-11-20 04:33:32,Shiny Nidoran Male got some good IVs. 
6658,18951,87677,2018-11-20 04:33:28,progress atm 
6659,18954,87680,2018-11-20 04:33:19,I just want a shiny Nidoking! 
6660,18957,87683,2018-11-20 04:33:14,Excitement of a 10 year old with his first evolution! 
6661,18959,87685,2018-11-20 04:33:06,"since you can pick your rival's name, i think you should be able to pick their gender, too "
6662,18963,87689,2018-11-20 04:32:56,Surrender now or prepare to fight. 
6663,18965,87691,2018-11-20 04:32:53,full odds 
6664,18966,87692,2018-11-20 04:32:51,The current pokemon art style is nice and all. But it doesnt scream Nintendo/Gamefreak. I hope the next mainline game coming to the switch next year has a bit an update to the art style. Itit just screams to me any old 3D mobile game on the market.
6665,18970,87696,2018-11-20 04:32:33,"So far my team consists of Raichu (my favorite), Venusaur (favorite is Bulbasaur), and Ninetails (For my grandma who passed away last year. Her maiden name was Fox. ) I still need three more!What is everyones team to challenge the "
6666,18972,87698,2018-11-20 04:32:20,After more than 1 hour of catching. Gotta! My first shiny pokemon. 
6667,18976,87702,2018-11-20 04:32:09,omg first shiny  
6668,18977,87703,2018-11-20 04:32:08,How to make a pokfan cry: 
6669,18979,87705,2018-11-20 04:31:54,If you have a small birb it will fly ahead of you! 
6671,18982,87708,2018-11-20 04:31:41,there's always that one horse kid...... 
6672,18985,87711,2018-11-20 04:31:28,I dont blame you Clefairy... you were supposed to be the mascot originally! 
6673,18986,87712,2018-11-20 04:31:26,Today was a great day
6674,18991,87717,2018-11-20 04:31:21,"You get a Mystery Box after connecting to Pokemon GO. This box allows for you to spawn Meltan, which only you can catch. Meltan can only evolve in Pokemon GO, which require 400 Meltan candies. "
6675,18994,87720,2018-11-20 04:31:14,me pet my shiny baby too! 
6676,18995,87721,2018-11-20 04:31:06,I unboxed the bundle! But I'm going to wait until the long weekend to play all weekend. Day 323. 
6677,19002,87728,2018-11-20 04:30:55,I'm loving this game. 
6678,19008,87734,2018-11-20 04:30:47,This software does not support the Save Data Cloud service. you are so bizarre. 
6679,19009,87735,2018-11-20 04:30:38,Last stream before leaving for vacation for 10 days so lets make it count! Come hang out and lets become pokemon masters together!Click the link below and say whats up!
6680,19012,87738,2018-11-20 04:30:36,This game is so much fun! 
6681,19013,87739,2018-11-20 04:30:34,ok now what 
6682,19017,87743,2018-11-20 04:30:16,feeling cute will probably delete later 
6684,19022,87748,2018-11-20 04:30:04,"Broke a rhyhorn chain when one fled, only for onix to sparkle. "
6685,19023,87749,2018-11-20 04:30:02,This sorta makes up for no shiny yet in Such a relief when I caught it 
6686,19025,87751,2018-11-20 04:29:59,weird 
6687,19029,87755,2018-11-20 04:29:48,i am to vulpix as Ash is to tauros 
6688,19031,87757,2018-11-20 04:29:47,A fucking Rattata did this to me  
6689,19032,87758,2018-11-20 04:29:46,"""Do not molest me!"" "
6690,19038,87764,2018-11-20 04:29:30,i never miss a good ship  
6691,19039,87765,2018-11-20 04:29:18,Pure content 
6692,19040,87766,2018-11-20 04:29:18,Part 2 of my heart cannot handle the cuteness of  eevee. 
6694,19046,87772,2018-11-20 04:29:02,*insert sponge bob I NEEEED IT gif* 
6696,19051,87777,2018-11-20 04:28:43,meowth is so cute... 
6697,19054,87780,2018-11-20 04:28:29,Quality rival name from my fianc 
6698,19058,87784,2018-11-20 04:28:22,"My favorite part about so far is when Julia Roberts, as her Pretty Woman character, stops you in a grocery store to debate nature vs. nurture. "
6699,19060,87786,2018-11-20 04:28:18,please reply to this tweet with any pokemon and i will give them the sexiest legs ever in heels
6700,19061,87787,2018-11-20 04:28:18,The cuteness is too much. I love him so much!!   
6701,19065,87791,2018-11-20 04:28:05,brb gunna join team rocket just to get closer to this baddie 
6703,19068,87794,2018-11-20 04:28:00,Kalia doesn't look impressed. 
6704,19071,87797,2018-11-20 04:27:54,Help! He's too cute &lt;3 
6706,19076,87802,2018-11-20 04:27:25,2 chain restart. 147 streak. 200+ ghastly later. finally.  
6707,19078,87804,2018-11-20 04:27:17,We love cross pollination of games  
6708,19091,87817,2018-11-20 04:26:47,Go park &lt;3 
6709,19092,87818,2018-11-20 04:26:47,i thought espeon was gen 1. . im stuck with 3 wack eevee evolutions. 
6710,19099,87825,2018-11-20 04:26:17,joined the dark side 
6711,19101,87827,2018-11-20 04:26:05,"look who I found while chaining for a shiny vulpix! even if they did break my chain, they're worth it! "
6712,19102,87828,2018-11-20 04:26:01,I got me a Persian! Traded 5 Growlithes for it but worth it!!! 
6713,19103,87829,2018-11-20 04:25:56,who said you can't have the best of both worlds...  
6714,19104,87830,2018-11-20 04:25:51,oh my god lmao 
6715,19105,87831,2018-11-20 04:25:46,Been chaining a diglett... and this appears.... 
6716,19106,87832,2018-11-20 04:25:44,My son is beautiful 
6717,19108,87834,2018-11-20 04:25:38,This has to be some sort of world record... 
6718,19110,87836,2018-11-20 04:25:27,I wasnt even paying attention lmaoo. 
6719,19111,87837,2018-11-20 04:25:27,gurl u lookin fab 
6720,19112,87838,2018-11-20 04:25:25,why did this camera pan to focus on the sign? 
6721,19113,87839,2018-11-20 04:25:23,Ask and you shall receive 
6723,19119,87845,2018-11-20 04:25:03,my favorite Pokemon! 
6724,19120,87846,2018-11-20 04:24:57,my pokemon from 
6725,19121,87847,2018-11-20 04:24:55,but..... i didnt use it..... 
6728,19127,87853,2018-11-20 04:24:38,I did it! 
6729,19130,87856,2018-11-20 04:24:32,Got all the 4 Gym Badges so far. 
6730,19131,87857,2018-11-20 04:24:27,Can't stress how cute and perfect this little play  mode is!! 
6732,19135,87861,2018-11-20 04:24:10,they really went and made it sadder.................. 
6733,19136,87862,2018-11-20 04:24:10,woot 
6734,19137,87863,2018-11-20 04:24:07,"I am loving the adventure with my adorable Eevee, Cinnamon! "
6735,19139,87865,2018-11-20 04:24:00,THUNDER CHICKEN 
6736,19144,87870,2018-11-20 04:23:38,This is my squad so far. 
6737,19145,87871,2018-11-20 04:23:37,First diploma Ive ever gotten in my life. 
6738,19146,87872,2018-11-20 04:23:36,"If anyone playing Pokemon Let's Go Eevee has a Koffing they can trade, I really need one  "
6739,19147,87873,2018-11-20 04:23:35,"Let\'s get that bread!! (""bread"" is meme talk for shiny Growlithe) We\'re on catch combo 118! Tonight\'s gonna be the night, I can feel it. Chill vibes and good times, come join my stream~~ "
6740,19151,87877,2018-11-20 04:23:28,What shiny should we hunt next?.After a chain of 38 Growlithes we found a shiny!!! .Make sure to checkout the stream so you don't miss the next 
6741,19154,87880,2018-11-20 04:23:21,Going live with some Lets relive our childhood.  
6742,19156,87882,2018-11-20 04:22:58,When did the third Poke Ball disappear and what was in it?! 
6744,19159,87885,2018-11-20 04:22:50,"I only need 2 more to complete the pokedex all I need is ekans and kabuto so hmu and I will trade anyone for them, Pokmon lets go trades "
6746,19161,87887,2018-11-20 04:22:48,Mount Moon is easy no--OMG ONIX WHERE DID YOU COME FROM 
6747,19162,87888,2018-11-20 04:22:46,vs. Bellsprout! 
6748,19164,87890,2018-11-20 04:22:36,"Diglett Cave and beyond! Lets see if we can get our 4th badge tonight. Im also a streamer that loves to chat, road to 200 followers  "
6749,19165,87891,2018-11-20 04:22:36,oh no she's CUTE 
6750,19166,87892,2018-11-20 04:22:28,Just flying around on my How is your adventure going?!  
6751,19167,87893,2018-11-20 04:22:27,So now I have two Dave &amp; Buster's 
6752,19169,87895,2018-11-20 04:22:21,"The big thing is that scratches a different itch. Reliving the first gen, and revisiting a Kanto Region that's different... but not different is not the same as a mainline game with new Pokmon &amp; new features that push the franchise forward. It doesn't need to be!"""
6753,19170,87896,2018-11-20 04:22:21,"I just caught fucking ARTICUNO, WTF "
6754,19174,87900,2018-11-20 04:22:12,you helped me win that badge! 
6755,19175,87901,2018-11-20 04:22:12,The tables have turned 
6758,19185,87911,2018-11-20 04:21:43,so they created Mewtwo with this 
6760,19195,87921,2018-11-20 04:21:28,This gym reminded me of some kind of trial in Alola. 
6761,19196,87922,2018-11-20 04:21:28,i wont let anything hurt you  
6762,19197,87923,2018-11-20 04:21:26,oh my god 
6763,19199,87925,2018-11-20 04:21:16, WE ARE LIVE ON TWITCH!Finally got my shiny now I can actually play Come thru! 
6764,19202,87928,2018-11-20 04:20:58,The Cerulean City Theme is one of my favorites and they really nailed it.
6765,19203,87929,2018-11-20 04:20:58,So I was looking for a Dratini and instead found this handsome fellow 
6766,19210,87936,2018-11-20 04:20:41,"My stomach is still killing me. So no stream tonight. Im hosting tho and she is God Tier, especially at Pokemon! Chill and Enjoy Snowshadows - you will not be disappointed. ^.^"
6767,19211,87937,2018-11-20 04:20:40,He smol 
6768,19213,87939,2018-11-20 04:20:36,I rlly just caught a shiny not even past brock 
6769,19215,87941,2018-11-20 04:20:28,*I* used a full restore?? No I did not?? 
6770,19217,87943,2018-11-20 04:20:27,I don't think That's how water works Magikarp XD 
6771,19219,87945,2018-11-20 04:20:23,me if i was a pokemon trainer 
6773,19222,87948,2018-11-20 04:20:13,Blastoise's follow is creepy 
6774,19224,87950,2018-11-20 04:20:11,"Flameo, hotman, your quiz was too easy! "
6775,19225,87951,2018-11-20 04:20:09,Shiny number 2! 
6777,19230,87956,2018-11-20 04:19:53,Managed to get the fauxhawk on Eevee after a few tries. And caught the paw tap!  
6778,19231,87957,2018-11-20 04:19:51,Finally lol 
6779,19235,87961,2018-11-20 04:19:42,Rude ass virgin... 
6781,19238,87964,2018-11-20 04:19:39,I guess. 
6782,19241,87967,2018-11-20 04:19:34,Spiffechu 
6783,19242,87968,2018-11-20 04:19:31,Mission Accomplished!!!!! 
6784,19247,87973,2018-11-20 04:19:07,I got legit spooked 
6785,19249,87975,2018-11-20 04:19:03,I think I forgot someone. Oops 
6786,19252,87978,2018-11-20 04:18:57,Why are y'all running--ECH!
6787,19253,87979,2018-11-20 04:18:55,"Happy belated birthday, Mewtwo! "
6789,19259,87985,2018-11-20 04:18:41,"I have a feeling we are going to get more games in between any brand new Pokmon games. They can literally remake every generation under the Let's Go moniker during off years of the mainline series. would somehow make even more money than they are now"""
6790,19262,87988,2018-11-20 04:18:33,This... Is... Fantastic! 
6791,19264,87990,2018-11-20 04:18:24,I knew Eevee looked a little lighter than usual! 
6792,19272,87998,2018-11-20 04:18:06,You can just fly over routes WHAT 
6793,19273,87999,2018-11-20 04:18:00,Check out our ultimate Pokmon Let's Go guide if you want to be the very best 
6794,19280,88006,2018-11-20 04:17:50,I'm dead inside 
6795,19281,88007,2018-11-20 04:17:49,me after the edible 
6796,19284,88010,2018-11-20 04:17:45,THE CHARM WORKS 
6797,19292,88018,2018-11-20 04:17:18,My son! My boy! 
6799,19296,88022,2018-11-20 04:17:12,LIVE! Shiny and/or 6IV Hunting! 152/153 Dex Pikachu!URL soon?)'
6800,19297,88023,2018-11-20 04:17:11,When you torrent for the first time 
6801,19298,88024,2018-11-20 04:17:09,The Tomboyish Mermaid 
6802,19303,88029,2018-11-20 04:16:58,But... you're a fish... 
6804,19312,88038,2018-11-20 04:16:23,Talk about a glow up  
6806,19316,88042,2018-11-20 04:16:18,Neat that they added dex entries for the starter mega evolutions 
6807,19317,88043,2018-11-20 04:16:16,"During at least 3 hours trying to catch it and it's here!!! We never give up, right "
6808,19318,88044,2018-11-20 04:16:13,Curling stones or curling sons? 
