,Unnamed: 0,Unnamed: 0.1,date,text
1,1,68727,2018-11-20 23:59:57,The big lad... 
2,2,68728,2018-11-20 23:59:52,WHAT THE FUCK SECOND RANDOM SHINY 
5,5,68731,2018-11-20 23:59:30,Doin the video game thing! then 
6,6,68732,2018-11-20 23:59:18,So spent 9 hours finding a shiny Ekans for me &amp; fed it 200 candies. Water Jet from Seel 18lvs higher did this 
8,10,68736,2018-11-20 23:59:11, Ahhhhh target aquired  
9,11,68737,2018-11-20 23:59:00,Finally have time to tweet about this game. I love my Eevee so much. 
11,13,68739,2018-11-20 23:58:51,a bit over halfway there 
12,14,68740,2018-11-20 23:58:50,"GAMERS, AFTER A LONG GRIND... I GOT HIM "
13,15,68741,2018-11-20 23:58:45,I chose Who will you choose for your adventure on 
17,22,68748,2018-11-20 23:58:06,First ever shiny that I caught in my whole life and its a gastly! 
19,27,68753,2018-11-20 23:57:45,Maccies and streaming!  
21,31,68757,2018-11-20 23:57:26,"No shinies caught today but I'm not giving up the grind. Back at it tomorrow. Still happy with my shiny Weedle, Pikachu &amp; Bulbasaur. "
22,32,68758,2018-11-20 23:57:26,lmao welp 
23,33,68759,2018-11-20 23:57:23,Nope. See ya 
26,37,68763,2018-11-20 23:57:09,Of course I did 
28,43,68769,2018-11-20 23:56:52,My eevee is adorable D: I want more acessories! 
30,46,68772,2018-11-20 23:56:42,I'm part of Team Rocket now 
33,51,68777,2018-11-20 23:56:28,Random encounter shiny Nidorino! He's not great but I love him. 
35,56,68782,2018-11-20 23:56:17,"It's Black Fridiay Week! So far, the best deal has definitely been a Nintendo Switch bundled with Pokemon:Let's Go and the latest Just Dance for 299, which sold out over the weekend. "
36,57,68783,2018-11-20 23:56:16,grind............ 
38,59,68785,2018-11-20 23:56:11,"Had to give a break, been playing it since 2pm "
40,63,68789,2018-11-20 23:55:55,Meeeeowth that's right! 
42,69,68795,2018-11-20 23:55:25,Route 3! 
43,70,68796,2018-11-20 23:55:23,When your kid refuses to accept they've outgrown their kiddie pool. 
44,72,68798,2018-11-20 23:55:03,How many hours did it take you to finish the main adventure in 
46,74,68800,2018-11-20 23:54:56,So close... 
47,78,68804,2018-11-20 23:54:49,Help be me the best trainer I can be!stream! I choose u!____________________code--------------------------------- 
49,82,68808,2018-11-20 23:54:40,Doing a public service and helping some random person evolve their Pokemon over trade. Just want a fucking Koffing guys.
50,85,68811,2018-11-20 23:54:21,"When I get I'm teaching Eevee Baddy Bad and there's nothing you can do to stop me from screaming the move whenever I use it"""
51,86,68812,2018-11-20 23:54:21,"got to wake him up, but he's too cute!  "
52,88,68814,2018-11-20 23:54:17,the exp you can get from chaining is crazy 
53,89,68815,2018-11-20 23:54:15,Snorlax mistook you for food and attacked Never related to someone so hard in my life 
55,91,68817,2018-11-20 23:54:07,Going live with Part 3 of my playthrough right now! We're about to drive Team Rocket out of Silph Co. and earn the last three gym badges!   
57,94,68820,2018-11-20 23:53:54,"So far from what I've played of Pikachu I love it. For the next main entry I want the catching mini game to stay with it's benefits after battle wild Pokemon. I also want every Pokemon being able to follow you to stay and the no more random encounters."""
58,96,68822,2018-11-20 23:53:44,Vanille is channeling Janelle Monae and I'm here for it
59,98,68824,2018-11-20 23:53:42,Pikachu ain't having none of team rocket's BS after 20+ years. 
61,101,68827,2018-11-20 23:53:34,OH HELL YEAH 
63,103,68829,2018-11-20 23:53:33,GOD mood 
64,104,68830,2018-11-20 23:53:32,"Will pay money for a Melmetal on Only need it for the dex entry, don't need to keep it..."""
66,107,68833,2018-11-20 23:53:24,THANK YOU 
68,111,68837,2018-11-20 23:53:11,Tentacruel was my very first shiny aside from the Gyarados in GSC. I made a point to chain one in this game
70,115,68841,2018-11-20 23:53:07,Why are you angry eevee? 
71,117,68843,2018-11-20 23:52:52,"Welp, it begins "
72,119,68845,2018-11-20 23:52:49," LIVE! out how to use this today! 5 badges, can we get at least 1 more tonight?! "
73,120,68846,2018-11-20 23:52:43,My child 
74,121,68847,2018-11-20 23:52:42,Great first attack -_- 
77,125,68851,2018-11-20 23:52:33,We live right now! Playing through Fuchsia City &amp; Saffron City.Lets go!
78,127,68853,2018-11-20 23:52:29,"Seriously, its like playing the anime "
79,128,68854,2018-11-20 23:52:28,LIVE STREAM  Building the ultimate team is LIVE on 
81,132,68858,2018-11-20 23:52:07,So this just happened 
82,133,68859,2018-11-20 23:52:02,4 new shinies in todays stream completely INSANE! thank you to everyone who joined the stream!!  
84,142,68868,2018-11-20 23:51:20,Bless you eevee 
86,149,68875,2018-11-20 23:50:56,I caught a wild Squirtle in the Seafoam Islands so thats pretty cool '
88,152,68878,2018-11-20 23:50:48, And... Done ! Now let's finish the Pokedex and ShinyHunt the legendaries!  
90,154,68880,2018-11-20 23:50:44,What do you mean wild Pokmon can run away whenever they feel like it? 
91,155,68881,2018-11-20 23:50:43,Team is really rounding into shape   
92,159,68885,2018-11-20 23:50:35,Mon premier shiny dans 
93,160,68886,2018-11-20 23:50:23,When you're looking for a specific pokemon and another type runs into you 
94,161,68887,2018-11-20 23:50:22,Done! 
95,162,68888,2018-11-20 23:50:19,La dream team 
97,166,68892,2018-11-20 23:50:04,"Bit cramped, don't you think onix? "
98,168,68894,2018-11-20 23:50:01,"Gary gives you a reward these days?? The fuck, only thing he used to do to me was kick me while I was down"
100,173,68899,2018-11-20 23:49:52,Finally  
101,174,68900,2018-11-20 23:49:51,save&amp;\\(*^*)/gn! 
103,178,68904,2018-11-20 23:49:46,Haven't had AI this good in while 
104,179,68905,2018-11-20 23:49:37,brand new whip got no keys
106,181,68907,2018-11-20 23:49:23,Pokemon Let's Go Episode 4: 2nd Gym Battle! via 
107,184,68910,2018-11-20 23:49:17,this is a power move 
109,186,68912,2018-11-20 23:48:58,Hey guys we are live with babbys first pokemon edition!!
110,187,68913,2018-11-20 23:48:57,Please tell me i'm not the only one who thought this looked like undyne? 
111,188,68914,2018-11-20 23:48:57,"Oh shes streaming again? Youre darn right I am! More - hoping to get through the Pokmon League tonight!! Lots to do, play, and explore! Come hang out "
112,189,68915,2018-11-20 23:48:56,Epic!!! 
114,194,68920,2018-11-20 23:48:45,+ tonight with Squeakers. And don't forget I have a going on until the end of the month! Check out my Twitch channel for rules. 
116,200,68926,2018-11-20 23:48:13,WHY IS THIS GAME SO CUTE?! 
117,201,68927,2018-11-20 23:48:12,"God, it's so weird to be in a completely 3D rendered version of Pallet Town. The nostalgia... ;_; "
118,202,68928,2018-11-20 23:48:12,first encounter 
119,204,68930,2018-11-20 23:48:05,"Someone named Alibasher over at reddit made this, so who wants to trade so we can get that 100% completed Pokedex "
120,206,68932,2018-11-20 23:47:58,"Let\'s play ""Geno"" "
122,208,68934,2018-11-20 23:47:53,How many times do you need to jump??? 
123,211,68937,2018-11-20 23:47:45,I love her.... 
124,213,68939,2018-11-20 23:47:36,Yo I'm gonna be catching a bunch of dank weeds (AKA Bulbasaur) in Pokemon Let's Go Pikachu on stream.  come watch! Hopefully I'll find a shiny!  
125,215,68941,2018-11-20 23:47:33,Going live early!! GOTTA CATCH EM ALL! 
126,217,68943,2018-11-20 23:47:24,Too elegant I tell ya. 
128,222,68948,2018-11-20 23:46:57,"Fuck you, Nintendo. Who ok'd this trauma?! "
129,224,68950,2018-11-20 23:46:49,me: what is it??you finally sensed a shiny?me: trips over one 
131,227,68953,2018-11-20 23:46:43,Entire face is different including the ears and eyes. How strange lol. 
133,229,68955,2018-11-20 23:46:34,Little kid Christian would be losing his mind about riding a Charizard. 
134,230,68956,2018-11-20 23:46:32,HER DRESS IS SO CLASSY !!! &lt;3 
135,231,68957,2018-11-20 23:46:31,"Remember, those playing :After you finish beating the E4, theres a lot of tiny things that open up around Kanto that add upRebattling leaders/important characters for outfitsRebattling E4 10 times get your a prizeMaster trainersMega stones'"
136,233,68959,2018-11-20 23:46:27,So many clefairy 
137,236,68962,2018-11-20 23:46:20,A fun little stream to end the night :) We didn't find Shiny Staryu but we did find a Shiny Tentacruel?! WHAT?! 
139,239,68965,2018-11-20 23:46:05,Haunter is rideable?! 
140,240,68966,2018-11-20 23:46:04,epic 
141,241,68967,2018-11-20 23:45:59,Amelia looks so darn cute!! I love the little bow and suit! 
142,244,68970,2018-11-20 23:45:43,"Welcome, buddy. "
143,246,68972,2018-11-20 23:45:41,Finally got the game it's so much funim at lavender town now my is super op any way until next time stand out and be the best you u can be 
144,248,68974,2018-11-20 23:45:36,Yeah okay old man. 
145,249,68975,2018-11-20 23:45:36,I finally have a Raichu following me. All is good. 
147,252,68978,2018-11-20 23:45:25,Pikachu I swear to Mew if you don't stop running in front of me like that you're going back in your Pokball 
149,259,68985,2018-11-20 23:45:10,why is finding a shiny vulpix so hard???'
150,260,68986,2018-11-20 23:45:09,Reason No. 573 of why Eevee is cute. 
151,266,68992,2018-11-20 23:44:36,Finished the Dex and got the shiny charm! 
155,274,69000,2018-11-20 23:44:01,I'LL PET YA OMG 
156,278,69004,2018-11-20 23:43:54,3rd shiny I've seen today! 
157,281,69007,2018-11-20 23:43:51,I'm thinking about updating my Bulbasaur cosplay.. maybe it's time for Ivysaur? :) 
159,284,69010,2018-11-20 23:43:44,Just starting! This is too cute. 
161,292,69018,2018-11-20 23:43:21,I wanted to show off my dapper boy but Primeape....... 
162,294,69020,2018-11-20 23:43:19,I finally can ride Arcanine !  My childhood dream come true
163,295,69021,2018-11-20 23:43:15,If these kids aren't me 
164,296,69022,2018-11-20 23:43:14,Mirai learned my way of life. 
165,298,69024,2018-11-20 23:43:08,hippity hoppity 
166,299,69025,2018-11-20 23:42:58,Whaaaaaat??? 
167,302,69028,2018-11-20 23:42:40,unforgivable 
168,303,69029,2018-11-20 23:42:39,Bless Timid Nature Gengar and Best Girl Erika. She's So Precious. 
169,305,69031,2018-11-20 23:42:29,Oh? I didn't know this mechanic was in the game 
170,307,69033,2018-11-20 23:42:13,"Not sure if the Eevee/Pikachu is supposed to be perfect, but mine is LOL "
171,308,69034,2018-11-20 23:42:09,40 hours &amp; 100% completeto 
172,311,69037,2018-11-20 23:41:52,While and I were away for the weekend at Anime NYC... these guys came in! I've been green with envy all weekend watching my friends play and catch shinies.
173,314,69040,2018-11-20 23:41:40,In we trust! 
174,316,69042,2018-11-20 23:41:30,WHAT 
176,318,69044,2018-11-20 23:41:27,The posters for the OG Japanese RBGY makes me stupidly happy 
177,322,69048,2018-11-20 23:41:12,"rip female shiny chain got this instead. not too bad ivs, could be better though. "
178,328,69054,2018-11-20 23:41:03,My first Premiere Youtube Video! Catching a Shiny Machop in Pokemon Lets go!Join me in watching!Click here 
180,335,69061,2018-11-20 23:40:20,Streaming Eevee some more. Last night we stopped just entering the Rocket Gang Hideout. Yay spinning tile puzzle! Go relax with us. Stream Starts at 7PM EST!!
183,340,69066,2018-11-20 23:40:07,Tried a different style today after watching some classes on Skillshare for Procreate. Been playing the crap out of Pokmon Lets Go so heres 
184,341,69067,2018-11-20 23:40:06,This Saturday I will be attempting to proceed with the weekly HORDE OFF alongside the let's go shiny hunts! It will be a giggle I'm sure 
185,345,69071,2018-11-20 23:39:43,Too much testosterona!  
186,348,69074,2018-11-20 23:39:37,Man I didn't think I'd want this badly.... 
187,351,69077,2018-11-20 23:39:27,Ready to fight the Elite Four 
188,352,69078,2018-11-20 23:39:26,Only 8 hours invested... 
189,354,69080,2018-11-20 23:39:06,They're just gonna watch me beat Brock's ass huh 
190,355,69081,2018-11-20 23:38:59,First full odds shiny boys!! 
191,356,69082,2018-11-20 23:38:49,"Okay Nintendo. I was really not that interested in until a friend increased my interest on it being the same as Yellow.Now I'm disinterested again since I heard that you will have to use some sort of motion control in order to play it. No thanks."""
192,357,69083,2018-11-20 23:38:48,Yikes 
193,363,69089,2018-11-20 23:38:27,My Nidoran evolved at the same time 
194,364,69090,2018-11-20 23:38:26,When you catch a  Rides in the  POUCH!Whaaaaaaaaat!!!!! Bravo You keep surprising me with this game and its wonderful. 
195,365,69091,2018-11-20 23:38:21,New idea: Anybody wanna trade me their Pinsir for my Articuno? 
196,370,69096,2018-11-20 23:38:11,Just from catching one Chancey 
198,376,69102,2018-11-20 23:38:02,"Since I unlocked the GO Park, Surf and Fly I've been filling up my PokeDex in 120+ atm"""
199,377,69103,2018-11-20 23:38:00,I want my steel Eeveelution @Pokemon'
201,380,69106,2018-11-20 23:37:50,LET'S GO! Shoutout to the main man for the hook up on this one. 
203,385,69111,2018-11-20 23:37:35,I must get the new Pokemon game on Hanukkah. 
204,387,69113,2018-11-20 23:37:30,D O I T F O R H E R 
206,393,69119,2018-11-20 23:37:10,Aspicot hasard ! 
207,395,69121,2018-11-20 23:37:07,There are good people in the world!! 
208,396,69122,2018-11-20 23:37:06,We are live everyone! More HYPE!! 
210,405,69131,2018-11-20 23:36:44,Holy shit I got finally got it. 
211,407,69133,2018-11-20 23:36:37,Can you believe some assholes actually have a Nintendo switch? 
212,408,69134,2018-11-20 23:36:37,Pokemon Let's Go Pikachu | The Adventure Begins!WATCH : 
213,410,69136,2018-11-20 23:36:29,Finally got to spend some time playing and I love it. 
214,412,69138,2018-11-20 23:36:24,Pokemon talking to each other is pure 
215,413,69139,2018-11-20 23:36:22,"Excuse me, Nintendo wut "
216,414,69140,2018-11-20 23:36:21,Eevee found an Undertale save point. 
217,418,69144,2018-11-20 23:36:06,Full odds!!! Life is Good!!!!!! 
221,422,69148,2018-11-20 23:35:50,Shiny Drowzee!! 
223,425,69151,2018-11-20 23:35:44,Big mood 
224,429,69155,2018-11-20 23:35:30,Happy Tuesday everyone! Today we start our journey with a new fluffy buddy in Join me as I trek through Kanto for the millionth time. I'm Live Now!       
226,431,69157,2018-11-20 23:35:23,aaaaaaahhhhhh nothing beats this!!!!!!!!! 
227,433,69159,2018-11-20 23:35:21,"My math professor is never late, so I am really hoping that he isn't here so I can go home and keep playing Nevermind.... Tweeted too soon """
229,436,69162,2018-11-20 23:35:09,Evolve 2 anorith reward. This is it? I was expecting an evolved fossil Pokmon or something. Does it have something to do with the special research tasks. 
230,437,69163,2018-11-20 23:35:08,My little boy is all grown up ;__;
231,438,69164,2018-11-20 23:35:06,"got a boy with real good IVs from a 30 chain... but it broke after, so i'll have to get a shiny later "
233,444,69170,2018-11-20 23:34:42,"Sry to fans, no stream tonight due to having to render all the older stuff. Next stream will be on sunday night!'"
234,445,69171,2018-11-20 23:34:42,This is the face she was making after eating a leaf. 
235,446,69172,2018-11-20 23:34:39,Him big 
237,450,69176,2018-11-20 23:34:22,Koga is down! Time to save Silph Co from Team Rocket. 
239,453,69179,2018-11-20 23:34:01,Let's continue the adventure with Pokemon Let's Go Pikachu! Right now!!! 
240,456,69182,2018-11-20 23:33:41,"Listening to the soundtrack with and it's simply amazing. It sounds both haunting and tragic in one score. The soundtrack generally is pretty amazing since it's focus is mainly on orchestra!"""
242,459,69185,2018-11-20 23:33:37,For the 1000th time.... YES!!!!! 
244,461,69187,2018-11-20 23:33:35,momentoss 
246,465,69191,2018-11-20 23:33:13,team. Best bros 
247,466,69192,2018-11-20 23:33:11,"...Okay, this is actually a pretty neat gameplay segment. "
249,469,69195,2018-11-20 23:33:03,Who the hell has their TV right in the middle of the room like that? There isn't even a sofa or chair in front of it 
250,470,69196,2018-11-20 23:33:02,I WILL PROTECT YOU WITH MY LIFE 
253,474,69200,2018-11-20 23:32:49,I demand to be carried. 
254,475,69201,2018-11-20 23:32:45,OMG Sandsrew is hilarious at following! 
258,487,69213,2018-11-20 23:32:01,Venusaur's run looks so ridiculous. 
260,495,69221,2018-11-20 23:31:29,YO WTF are you joking 
261,500,69226,2018-11-20 23:31:13,Please... does anyone.... have a Meowth or Pinsir in or theyd be willing to trade me'
262,501,69227,2018-11-20 23:31:11,assistant cutie 
263,502,69228,2018-11-20 23:31:10,3 hours trying to catch a shiny Nidoran comes to an end thanks to it fleeing &amp; breaking the chain  
264,503,69229,2018-11-20 23:31:06,done! Bless these three lads for sticking with me the whole way. 
267,511,69237,2018-11-20 23:30:39,ULRIC JUST OBLITERATED THIS DIGLETT 
268,513,69239,2018-11-20 23:30:30,Time for my least favorite part of gen 1... 
270,522,69248,2018-11-20 23:29:38,literally every throw gives me anxiety. i want that shiny so bad 
271,524,69250,2018-11-20 23:29:11,look at this idiot 
272,527,69253,2018-11-20 23:29:03,"Aaaaah, I'm dying. My Pikachu is the sweetest! "
273,528,69254,2018-11-20 23:28:59,i love these two  
274,529,69255,2018-11-20 23:28:53,OH SHIT WADDUP(Hopefully) finishing our run and getting our shiny charm. Hunting will ensue after that.Live now! 
276,532,69258,2018-11-20 23:28:48,Finally 
277,536,69262,2018-11-20 23:28:37,Catching a shiny Bulbasaur! 
278,537,69263,2018-11-20 23:28:35,look who's back 
279,540,69266,2018-11-20 23:28:23,This is the cutest shit ever!!! 
280,541,69267,2018-11-20 23:28:22,a one hour walk did this 
281,543,69269,2018-11-20 23:28:16,So I was chaining for a Vulpix when I saw this big girl flying overhead..
282,546,69272,2018-11-20 23:28:03,Team update 
283,547,69273,2018-11-20 23:28:02,Red. Help me reach 100 followers before november ends ^ ^
284,548,69274,2018-11-20 23:28:02,This hurts my soul 
285,550,69276,2018-11-20 23:27:55,when is in this cave. 
286,552,69278,2018-11-20 23:27:49,Classic Blue! 
287,554,69280,2018-11-20 23:27:40,someone help him 
288,560,69286,2018-11-20 23:27:15,Not bad for the first time taking someonen on a stroll. 
289,564,69290,2018-11-20 23:26:55,Look who it is! 
290,565,69291,2018-11-20 23:26:47,"I'd ask where she got the bucket, but I'm too busy saying AWW! "
291,567,69293,2018-11-20 23:26:40,Greedy Bulbasaur 
293,573,69299,2018-11-20 23:26:15,In-Game representation of me messing with my cats. 
294,576,69302,2018-11-20 23:26:04,thicc Boi 
295,579,69305,2018-11-20 23:25:46,Loving the new victory animation Nintendo. 
296,581,69307,2018-11-20 23:25:34,I am playing the Pokemans 
297,585,69311,2018-11-20 23:25:20,Pikachu is happy I threw away money... 
298,587,69313,2018-11-20 23:25:03,I LOVE HIM 
299,589,69315,2018-11-20 23:24:56,ohmygod look at how he runsssss 
302,596,69322,2018-11-20 23:24:38,Lets Go  
303,597,69323,2018-11-20 23:24:36,A new challenger appears! 
304,598,69324,2018-11-20 23:24:25,"BEHOLD, TINA!!  HARBINGER OF THE END TIMES!!! "
305,599,69325,2018-11-20 23:24:22,My first lets go shiny! yay! 
306,600,69326,2018-11-20 23:24:19,Thank you so much Eddie! So far today has been fantastic!! Ending the night with some and cannot wait!! Hope all is well with you!! :D
309,610,69336,2018-11-20 23:23:59,A new profile pic! 
310,611,69337,2018-11-20 23:23:57,"For the kids, I swear :) "
311,612,69338,2018-11-20 23:23:50,LIVE NOW!shiny Mr. Mime! Come say PepePls.  
312,613,69339,2018-11-20 23:23:48,....there's no way there wasnt a meeting about this.But thanks!  
313,614,69340,2018-11-20 23:23:47,mrstealyogirl 
315,617,69343,2018-11-20 23:23:43,"[LIVE!] Lets catch all the things, okay? "
316,619,69345,2018-11-20 23:23:36,Never knew I would like geek Pika this much. 
317,620,69346,2018-11-20 23:23:36,she's so precious 
319,624,69350,2018-11-20 23:23:25,Alpha male fight at Bill's lab - selling tickets on Nugget Bridge 
320,629,69355,2018-11-20 23:23:15,I just gave my only Gold Razz Berry to a rhyhorn... and it ran...
323,638,69364,2018-11-20 23:22:37,On tonight at 8 PM EST - playing some more - Come hang out! 
324,641,69367,2018-11-20 23:22:30,W O W RUDE 
325,642,69368,2018-11-20 23:22:26,shiny team is coming along. :^) 
326,644,69370,2018-11-20 23:22:20,Here is my party team in pretty happy with it never taking Eevee off he is too badass 
327,649,69375,2018-11-20 23:21:56,FINALLYFirst successful hunt
328,650,69376,2018-11-20 23:21:55,"dude, that's gay "
329,654,69380,2018-11-20 23:21:47,PLEASE LOOK AT VENUSAUR RUN IM LOSING MY MIND 
330,656,69382,2018-11-20 23:21:41,"3/150! Ponyta! Much more to come, stay tuned! "
331,657,69383,2018-11-20 23:21:41,Would anyone trade me a Scyther for a Pinsir on Pokemon: Let's Go? 
332,660,69386,2018-11-20 23:21:29,Graphics on point 
333,665,69391,2018-11-20 23:21:08,This WOULD happen when I have a Magikarp combo going...  
334,669,69395,2018-11-20 23:20:56,2nd shiny with only a 2x Nidoqueen catch combo!!! 
335,670,69396,2018-11-20 23:20:51,for GOTY 
336,672,69398,2018-11-20 23:20:50,My first shiny competitive mon in 
337,674,69400,2018-11-20 23:20:37,Little sailor boi 
338,675,69401,2018-11-20 23:20:37,Finally finshed the pokedex on amazing game so far. Cannot wait to get every shiny now too 
339,676,69402,2018-11-20 23:20:36,Shiny Salazzle bois. 
340,677,69403,2018-11-20 23:20:33,"ARE YOU SERIOUS, GAME "
342,681,69407,2018-11-20 23:20:19,Awww this is adorable! We are LOVING Hope you are having a blast with it too!!@NintendoAmerica'
343,683,69409,2018-11-20 23:20:12,My partners in crime 
344,686,69412,2018-11-20 23:20:03,Safron city \\(^0^)/ exemption 
345,688,69414,2018-11-20 23:19:53,"Broke my streak, just gonna go with this one :'( "
346,689,69415,2018-11-20 23:19:46,Took Vinnie to university and came back swole 
347,692,69418,2018-11-20 23:19:39,OOOOOH MYYYY GAAAAAAAD!!!!! 
348,694,69420,2018-11-20 23:19:35,Just setting myself up to wait for shinies and boom. 
349,696,69422,2018-11-20 23:19:28,E4 beaten! 
350,697,69423,2018-11-20 23:19:27,2nd shiny with only a 2x Nidoqueen combo! 
351,700,69426,2018-11-20 23:19:01,Haven't bought a single Repel yet. It's so fucking easy to just run around visible Pokmon in the overworld. It's so rad. 
352,704,69430,2018-11-20 23:18:47,When you get naked for the first time with them. 
353,705,69431,2018-11-20 23:18:44,is a game i dont have but i really want.'
354,708,69434,2018-11-20 23:18:31,Oh wtf ?! 
355,709,69435,2018-11-20 23:18:31,"is cute in a way that reaches towards being a treatment for depression. You just can't be sad if you're petting your Eevee. Science can't explain this phenomenon."""
357,718,69444,2018-11-20 23:18:08,Oh yes you did 
358,719,69445,2018-11-20 23:18:03,Kinda bummed with the things that have changed for the I miss the battles. Real battles. Like you HAD to battle like all the time so you can make it through the game. I dont wanna explore! I WANNA BE THE VERY BEST! TO TRAIN THEM IS MY CAUSE!!!!'
360,728,69454,2018-11-20 23:17:40,three bird 
361,730,69456,2018-11-20 23:17:29,"Pokmon Red was my first RPG and the first game I picked out for myself. I remember going to Toys R Us in the summer of 2000, and the sheer joy of experiencing Kanto and the world of Pokmon for the first time!"
362,731,69457,2018-11-20 23:17:28,Found this driving to Georgia! 
363,732,69458,2018-11-20 23:17:27,I'm sorry Angela! D'x 
364,734,69460,2018-11-20 23:17:22,Lil' Homie is rocking new shades and a new haircut after becoming a champion lol 
365,736,69462,2018-11-20 23:17:14,Shiny Exeggutor. Wow. Guess shiny hunting works then 
366,741,69467,2018-11-20 23:16:57,"Booting up the stream in about 10 minutes! looks like we are playing more Come hang out and keep me company  while I get nostalgic, and irritable! "
367,745,69471,2018-11-20 23:16:33,shake it 
368,746,69472,2018-11-20 23:16:31,I chose Who will you choose for your adventure on Eevee'
370,748,69474,2018-11-20 23:16:20,Ow yea 
371,751,69477,2018-11-20 23:16:06,Trying to grind up a shiny Snoot Snoot. 
373,753,69479,2018-11-20 23:15:56,"so this little thing just popped out and I choked, didnt have any combos either lol "
374,754,69480,2018-11-20 23:15:55,Someone trade me pikachu exclusives ^_^ 
376,756,69482,2018-11-20 23:15:51,Tsun old lady? 
377,757,69483,2018-11-20 23:15:50,Echo saying bye to the SS Anne. 
378,761,69487,2018-11-20 23:15:41,Defeats the meaning of a rival.... 
379,762,69488,2018-11-20 23:15:41,MASTER BALL! 
380,764,69490,2018-11-20 23:15:30,ok but wheres my shiny &gt;:(  
381,765,69491,2018-11-20 23:15:28,Just so cute!!! 
383,767,69493,2018-11-20 23:15:27,Shiny Koffing in only an hour of hunting! 
384,768,69494,2018-11-20 23:15:27,everyone PLEASE LOOK AT MY BABY BOY 
385,769,69495,2018-11-20 23:15:27,We did it  
386,772,69498,2018-11-20 23:15:15,I Finally finished the Pokdex. Shiny Hunting Time! 
387,776,69502,2018-11-20 23:15:01,First come first serve on this Legendary code! Snag this Kyogre and Groudon code for your game! 
389,778,69504,2018-11-20 23:14:58,New DLC and catching Shinies in tonight! 
390,779,69505,2018-11-20 23:14:58,"Let's go, Ritchie! "
391,781,69507,2018-11-20 23:14:55,Can you ever have too much tech? 
392,783,69509,2018-11-20 23:14:49,Draw me like one of your french girls 
393,784,69510,2018-11-20 23:14:48,My favorite Pokemon. I need to exchange to get Alakazam 
394,785,69511,2018-11-20 23:14:46,"This ain't my first time taking you guys down- can't fool me, pal! "
395,790,69516,2018-11-20 23:14:17,I played Pokmon Let's Go: Pikachu for 4hrs straight today and now I want it more than I want oxygen 
396,794,69520,2018-11-20 23:14:10,"Team, unite up! "
398,799,69525,2018-11-20 23:13:53,SHINY VULPIX BAYBEEEEEEEE!!! 
