,Unnamed: 0,Unnamed: 0.1,date,text
4245,9984,103828,2018-11-19 14:58:24,Currently shiny hunting my Dream Team. I need some nickname ideas! 
4246,9989,103833,2018-11-19 14:57:22,We livin' dex 
4248,9996,103840,2018-11-19 14:56:53,"In case you missed it, Pokemon Lets Go Pikachu/Eevee are now working in Yuzu, The Nintendo Switch Emulator "
4250,10012,103856,2018-11-19 14:55:35,"Would people prefer it if I worked on my cosplay now, then streamed later, or stream now and work on my cosplay later?I'll be streaming "
4251,10014,103858,2018-11-19 14:55:27,Loving the waves 
4252,10018,103862,2018-11-19 14:54:58,Mission accomplished 
4253,10019,103863,2018-11-19 14:54:58,"OK, I take a couple of days off of Twitter, and I come back to a timeline loaded with Does anyone play on anymore?'"
4255,10026,103870,2018-11-19 14:54:42, So happy first Poke of the day and it was a shiny. Needs a name tho. :) 
4257,10030,103874,2018-11-19 14:54:19,Yo!! We need 5 more likes for episode four to be uploaded!! I know we got this!! (Retweets are highly appreciated!!) 
4258,10031,103875,2018-11-19 14:54:19,Getting a ponyta chain (was on 20-something combo) and this shows up LOL 
4259,10033,103877,2018-11-19 14:53:54,somebody teach me how to high five my baby pikachu please 
4260,10037,103881,2018-11-19 14:53:32,1 Hour Left to use our epic 40% off code!Choose your starter:aDrive40 / PattyTrills40 / 8bitbro40Choose your flavors:it happen! A 40% off code is rarer than a Shiny!
4261,10039,103883,2018-11-19 14:53:12,We're in disguise 
4262,10043,103887,2018-11-19 14:52:55,fury 
4263,10046,103890,2018-11-19 14:52:45,Makin my way downtown. walking fast. faces pass and I'm homebound. 
4264,10047,103891,2018-11-19 14:52:44,omg Safron gym 
4266,10055,103899,2018-11-19 14:52:12,I'm watching play live on Twitch right now. Join us! 
4268,10065,103909,2018-11-19 14:51:42,I just got another 1 !!! Back to back pokemon !! I in shock... 
4269,10068,103912,2018-11-19 14:51:31,I love her!!
4271,10074,103918,2018-11-19 14:50:46,I CAN RIDE AROUND ON SPICY BOY! 
4272,10075,103919,2018-11-19 14:50:44,Pokemon Lets Go Pikachu &amp; Eevee What to Do With Bottle Caps 
4273,10076,103920,2018-11-19 14:50:43,Eevee and I have a new friend! 
4274,10077,103921,2018-11-19 14:50:39,rude  
4277,10084,103928,2018-11-19 14:50:02,This is a reason I've not been online. 
4278,10085,103929,2018-11-19 14:50:00,"Thank you for the Golden Medal, and for sending/opening gifts on a daily basis! "
4279,10086,103930,2018-11-19 14:49:50,A possibly short AM hangout stream with         
4280,10088,103932,2018-11-19 14:49:45,That month of T5 raids grind was clearly worth it! 
4282,10096,103940,2018-11-19 14:49:01,when tf do i get a moon stone 
4283,10097,103941,2018-11-19 14:48:56,shiny Caterpie! 
4284,10100,103944,2018-11-19 14:48:50,"I just played all weekend and only left the couch for thanksgiving grocery shopping, haha'"
4285,10102,103946,2018-11-19 14:48:46,"Crime days are over, we cops now "
4286,10106,103950,2018-11-19 14:48:30,Spicy Boy is now a Charizard and I'm so proud. 
4288,10112,103956,2018-11-19 14:48:06,She evolved! :) 
4289,10115,103959,2018-11-19 14:47:56,Annnnnnnd 48GB update for guess Im playing tonight up side to having two games out in one week cant play one play the other'
4290,10118,103962,2018-11-19 14:47:46,I'm not so sure if the game is supposed to look like this. 
4291,10121,103965,2018-11-19 14:47:38,"Really have been enjoying and really wasn't expecting it X3 Will have to draw my team soon! And also, while looking for Jiggs, found this lad and turned him into a gentlemen. "
4294,10127,103971,2018-11-19 14:47:11,guess who found the accessory shop 
4295,10135,103979,2018-11-19 14:46:31,"Changed his hair, he's so cute now "
4296,10136,103980,2018-11-19 14:46:30,"Gentle reminder: Spearow are idiots. They only fly clockwise, into walls, and sometimes get stuck outside of grass patches and cannot despawn.If you see a Spearow in trouble, help it out. It's only wasting a spawn slot.  "
4297,10139,103983,2018-11-19 14:46:15,"when pikachu wiggle its tail, press A "
4299,10143,103987,2018-11-19 14:45:51,I wonder what this marble will be used for....  
4301,10148,103992,2018-11-19 14:45:37,Underground Path has come a longgggg way 
4302,10149,103993,2018-11-19 14:45:36,Been hunting for a shiny Growlithe for roughly 10 hours now and still nothing.  
4303,10150,103994,2018-11-19 14:45:35,only Charmander left to complete Ashs original party  
4305,10156,104000,2018-11-19 14:45:14,So Lets Go decided to freak out on me a little last night. 
4306,10157,104001,2018-11-19 14:45:13,"Im going to be doing a Shiny Hunting Subathon today! We will be shiny hunting all day, up to 12 hours, in Every sub adds time to how long we hunt! After the subathon ends, we will be switching to Starting in about an hour. Who will be there!?'"
4308,10167,104011,2018-11-19 14:44:18,The Evolution scene is so beautiful in this game 
4309,10168,104012,2018-11-19 14:44:10,Here I goooooo
4310,10169,104013,2018-11-19 14:44:09,After hrs and hrs I finally got 1
4313,10179,104023,2018-11-19 14:43:10,EARLY BLACK FRIDAY DEAL!! Pokemon Black Limited Edition Nintendo DSi Console &amp; Game + Case+ FREE UK SHIPPING! 
4314,10181,104025,2018-11-19 14:43:01,Anyone for a pint with a Pikachu? 
4315,10183,104027,2018-11-19 14:42:55,"I am amazed how much details are in this game, Misty soon "
4317,10192,104036,2018-11-19 14:42:21,"Nov. 19-25: We're gonna have so much fun this week! Monday we're checking out Eevee, Tuesday we continue the DLC for with Turf War, and Wednesday, Friday and Saturday, Kris takes over and plays Don't miss it! "
4318,10201,104045,2018-11-19 14:41:36,This week on the we talk esports and with Chris Overholt of shares her first impressions of and we discuss announcement of skipping E3 2019! 
4319,10202,104046,2018-11-19 14:41:12,transfiriendo pokemon de GO a let's GO ;) nice 
4320,10203,104047,2018-11-19 14:41:10,"Can anyone help a guy out? If anyone has Pokmon lets go I need to evo trade my kadabra, a simple trade then right back ;; a ;;"
4321,10206,104050,2018-11-19 14:40:58,Would Game Freak design an HD Render of Spear Pillar just for an easter egg in Lets Go?  Or have they already begun development? 
4322,10212,104056,2018-11-19 14:40:35,Nintendo made a proper scene for this... I cri 
4323,10217,104061,2018-11-19 14:40:28,did we just......... 
4324,10221,104065,2018-11-19 14:40:12,concern 
4325,10223,104067,2018-11-19 14:40:01,The changes in and are more good than bad 
4326,10229,104073,2018-11-19 14:39:20,sooo can you please do a nuzlocke run of Lets Go Pikachu/Eevee? Thats what I need in my life. 
4327,10237,104081,2018-11-19 14:38:26,"Going to be streaming Pokemon Let's Go Eevee at 5:30 , Turn notifications on so you don't miss out , will be starting fresh so we can start the journey together , , "
4328,10247,104091,2018-11-19 14:37:48,Update!! AlthoughI may still change some of the names 
4329,10248,104092,2018-11-19 14:37:47,Need a trade partner for 
4330,10249,104093,2018-11-19 14:37:46,"dilemma, which evolution will you be? "
4332,10254,104098,2018-11-19 14:37:26,I must say as a male how disappointed that you decided to acknowledge international women's day with an event and then just ignore !!! 
4333,10255,104099,2018-11-19 14:37:17,Cant wait for my copy of Pikachu to get here!'
4334,10259,104103,2018-11-19 14:37:03,This guy keeps telling me this but I -have- caught more than that. What am I missing? 
4335,10271,104115,2018-11-19 14:36:23,Back to work today so it's back to schedule we going live with more Pokemon. So come get your kid on.
4336,10273,104117,2018-11-19 14:36:12,Draw me like one of your Kalosian girls 
4338,10275,104119,2018-11-19 14:36:00,and I'm the champion :-D  
4339,10280,104124,2018-11-19 14:35:51,weepinbell got that mean 
4341,10283,104127,2018-11-19 14:35:35,Alolan Vulpix! Do you think I can get a shiny if I trade enough times? :P 
4343,10286,104130,2018-11-19 14:35:32,"Found a portrait of Spear Pillar from Sinnoh, teasing that GenIV remakes are still on the way."
4344,10288,104132,2018-11-19 14:35:00,Alolan Vulpix is sooooo gorgeous! 
4345,10292,104136,2018-11-19 14:34:49,WHY IS IT SO HARD TO BATTLE TRAINERS 
4346,10295,104139,2018-11-19 14:34:39,Yay! Its here. 
4347,10297,104141,2018-11-19 14:34:37,Wasted 6 and a half hours looking for a shiny Staryu today and nothing... I guess thats just my luck  
4348,10312,104156,2018-11-19 14:33:47,Woke up and caught the Snorlax blocking the road! 
4349,10314,104158,2018-11-19 14:33:33,"Still hunting Growlithe, I took the picture and ran to keep the combo "
4350,10317,104161,2018-11-19 14:33:14,Dona Flor &lt;3 
4351,10318,104162,2018-11-19 14:33:11,Thanks for noticing! ;) 
4353,10320,104164,2018-11-19 14:33:03,Check out our new video! Lets go eevee first impressions!                 
4354,10328,104172,2018-11-19 14:32:52,oh lordy  
4355,10333,104177,2018-11-19 14:32:27,3 days since the release of How many Pokemon have you captured?'
4356,10337,104181,2018-11-19 14:32:02,Erika always was my favourite gen 1 gym leader 
4358,10340,104184,2018-11-19 14:31:58,I'm having so much fun with the game and I've only done 3 gyms so far! Looking forward to continuing the game later today! 
4359,10343,104187,2018-11-19 14:31:41,elite four... done :-D  
4361,10345,104189,2018-11-19 14:31:35,Whoever thought of this should get a raise at GameFreak 
4363,10351,104195,2018-11-19 14:31:18,Live on Pikachu today from 6pm        
4364,10356,104200,2018-11-19 14:30:55,My first shiny!! plus riding gyrados on the water like that is so awesometo 
4366,10359,104203,2018-11-19 14:30:41,Just wanted to show my current team 
4367,10360,104204,2018-11-19 14:30:40,"Ok after nearly 3hrs of playing this morning, I'm gonna go back to sleep now lol. Love this game. is so cute \x9"
4371,10378,104222,2018-11-19 14:30:00,"If you need the Kyogre and Groudon code, here's one for your game! First come first serve on this Legendary code! "
4373,10384,104228,2018-11-19 14:29:46,"Is anyone elses pokeball plus not catching Pokmon? Mine is only spinning pokestops, and I have space in my Pokemon box  "
4374,10388,104232,2018-11-19 14:29:37,biggest lie 2018 
4375,10389,104233,2018-11-19 14:29:36,me looking for more follower on this account 
4377,10397,104241,2018-11-19 14:29:15,1st shiny in !Took me more than 2000 encouters in . This time only catch combo 21!
4380,10409,104253,2018-11-19 14:28:27,e v e r y o n e i s h e r e 
4381,10411,104255,2018-11-19 14:28:26,Listening to while playing on Lavender Town is the highest level of Kinda Creepy Kinda Cool'
4382,10413,104257,2018-11-19 14:28:13,At last! 
4383,10415,104259,2018-11-19 14:27:57,NOOOOOOOO PLEASE DONT BE SAAAD :( 
4384,10417,104261,2018-11-19 14:27:49,I decided to give Pikachu the Mohawk look. Don't think she is happy with it though. 
4385,10426,104270,2018-11-19 14:27:18,Omg I gotta say this game is so addictive  
4386,10433,104277,2018-11-19 14:26:42,"Officer Pikachu, Detective Pikachu's lawful &amp; handsome cousin. "
4388,10438,104282,2018-11-19 14:26:29,Bold dog 
4389,10440,104284,2018-11-19 14:26:18,"I wish I had a Nintendo Switch, that looks so damn fun.'"
4390,10441,104285,2018-11-19 14:26:18,Lmaoooooo this is me playing trying to avoid all the fights from the people on the roads  
4391,10442,104286,2018-11-19 14:26:15,Cutest game ever!!! 
4392,10450,104294,2018-11-19 14:25:52,is gonna take forever... 
4393,10452,104296,2018-11-19 14:25:35,"Ohh boy!!! you get the popcorn, Ill get the candy?   "
4394,10456,104300,2018-11-19 14:25:17,This game always finds ways to charm me. 
4396,10473,104317,2018-11-19 14:24:14,Hanging with my pal Meltan. 
4397,10476,104320,2018-11-19 14:24:11,I swear I video clipped the encounter but it's just gone so have these instead 
4398,10484,104328,2018-11-19 14:23:47,"watching people play just makes me miss Pokmon Colosseum/XD :/ had same visual direction but w/ darker tone in the narrative, different region, all of that on a gamecube. 1st game ever I truly grinded  "
4399,10488,104332,2018-11-19 14:23:35,true friendship is inviting your girlfriend and best friend to shiny hunt (1/4096 chance) something that has a one percent spawn rate 
4402,10503,104347,2018-11-19 14:22:51,A moment of silence for this Ponyta I didn't get cause I wanted that Eevee :') 
4407,10517,104361,2018-11-19 14:22:31,"According to GEO (major Japanese retailer), Pokemon Lets Go Pikachu &amp; Eevee debut sales are strong. Pikachu outsold Eevee to a ratio of 55:45 and the Poke Ball Plus Bundle sold better than the standard version."
4408,10521,104365,2018-11-19 14:22:28,"I just learned that if you play in handheld mode with the JoyCons on the console then it is way easier to aim pokeballs when catching pokemon because you use motion controls to aim. WHY CAN'T WE DO THAT IN DOCKED MODE WITH THE FUCKING PRO CONTROLLER?!"""
4412,10542,104386,2018-11-19 14:21:35,I don't think I'm suppose to be this high up..  
4413,10544,104388,2018-11-19 14:21:23,"""Pokemon Let\'s Go will flop."""
4416,10557,104401,2018-11-19 14:20:54,"Chain 300, still no shiny "
4418,10564,104408,2018-11-19 14:20:33,My. Gosh. 
4419,10565,104409,2018-11-19 14:20:23,10 in-game hours later!  
4420,10567,104411,2018-11-19 14:20:20,This is my St'Eevee - wouldja look at that 
4421,10575,104419,2018-11-19 14:19:55,Time to teach Team rocket not to mess with Silph Co.
4423,10581,104425,2018-11-19 14:19:38,It's like finding a shiny magikarp when all you want is a shiny poliwag after 46 catches. Isnt it ironic. 
4424,10582,104426,2018-11-19 14:19:36,Best break ever!!2 hours of walking around until I finally got BulbasaurI think I really need help ^^something is wrong with me in how I spend my free time  
4425,10584,104428,2018-11-19 14:19:31,Add me on pokemon go! 
4426,10588,104432,2018-11-19 14:19:23,This is happiness! 
4428,10591,104435,2018-11-19 14:19:20,The capture didn't get me chasing it in the overworld. lol 
4429,10595,104439,2018-11-19 14:18:53,review is now live! Check it out here: sure to comment and like.'
4430,10597,104441,2018-11-19 14:18:50,"""Called out to Tyler"" WTF! "
4431,10601,104445,2018-11-19 14:18:38,Mew get!!! 
4432,10606,104450,2018-11-19 14:18:35,making Mew a one time only download from the poke ball is really poor. Restart game? Gone forever. Two kids sharing a console? Only one Mew... 
4433,10613,104457,2018-11-19 14:18:00,Meet Lucky ~ 
4434,10616,104460,2018-11-19 14:17:53,DEAR NINTENDO. I HAVE CAUGHT SEVEN HUNDRED VULPIX AND STILL NO SHINY. SEND HELP. 
4436,10623,104467,2018-11-19 14:17:32,Just kicked a$$ ... 
4437,10624,104468,2018-11-19 14:17:30,Hello my Lovelies! Guess what time it is? that's Right! we are going live! with some ! come join me! 
4438,10634,104478,2018-11-19 14:16:45,Anyone else notice this reference to the 1980s movie Stand By Me? 
4440,10645,104489,2018-11-19 14:16:11,"Shouldn't be surprised that the pokemon I was using to grind to 31 would be shiny, full odds combo 27 "
4442,10669,104513,2018-11-19 14:15:10,Im singing it out loud way too much. 
4443,10671,104515,2018-11-19 14:15:02," Marathon Giveaway To celebrate 152HR Pokemon Let's Go x Marathon Stream, we've launched this fantastic giveaway! Just follow the steps to enter! Like + "
4444,10674,104518,2018-11-19 14:14:44,hello there 
4445,10677,104521,2018-11-19 14:14:34,Why am I crying in the club rn 
4446,10679,104523,2018-11-19 14:14:22,hes the best boy 
4448,10682,104526,2018-11-19 14:14:00,"Guess who got pikachu of course! I mean, technically Troy got it but I'm playing it! Tomorrow 12GMT! "
4449,10686,104530,2018-11-19 14:13:38,Caught my first shiny in :3 
4450,10688,104532,2018-11-19 14:13:34,what the fuc 
4451,10697,104541,2018-11-19 14:12:36,Shiny Chansey! And this time I caught it~! 
4453,10700,104544,2018-11-19 14:12:26,My body is ready 
4454,10702,104546,2018-11-19 14:12:17,Anyone playing know how to choose which Pokemon follows the support character?'
4455,10703,104547,2018-11-19 14:12:17,If they do gen2 games I bet they will be and  
4458,10710,104554,2018-11-19 14:11:32,Doesn't need Rock Polish to shine 
4460,10714,104558,2018-11-19 14:11:05,"Bruh, Ive caught TWO Clefables, back to back, in Mt. Moon. This shit is crazy! "
4461,10715,104559,2018-11-19 14:11:04,Already continuing the Shiny Hunt. Already 100+! Everyone lend me your energy so I might be lucky enough to find a shiny!  
4462,10723,104567,2018-11-19 14:10:22,"Pokemon Lets Go Pikachu &amp; Eevee had a strong debut in the UK selling over 116,000 units (not counting digital sales). It also helped boost the sales of Nintendo Switch hardware and other Switch titles as well."
4464,10728,104572,2018-11-19 14:10:08,so close to 31 chain for pidgey!!! 
4465,10729,104573,2018-11-19 14:10:04,Okay. 
4467,10734,104578,2018-11-19 14:09:24,MY FLUFFY BABY BOYEEEEE 
4468,10742,104586,2018-11-19 14:08:17,"Euhm, why is he giving me a picture of me? "
4469,10743,104587,2018-11-19 14:08:15,my favourite game to play with Kelly! 
4470,10744,104588,2018-11-19 14:08:12,"My save file, played around with go park so times a little inflated, but still awesoe to me "
4471,10745,104589,2018-11-19 14:08:03,I just found 2 Clefables and couldnt  catch either of them!!! 
4473,10756,104600,2018-11-19 14:06:23,Wait what??? 
4474,10757,104601,2018-11-19 14:06:20,whaaat!!! 
4476,10759,104603,2018-11-19 14:06:17,i would kill for you
4478,10770,104614,2018-11-19 14:05:37,wth xD 
4479,10771,104615,2018-11-19 14:05:27,Can't believe this game encouraging kids to stand on spinny chairs. Total lack of regard for health &amp; safety 
4480,10772,104616,2018-11-19 14:05:25,I'll take that as a compliment! 
4481,10775,104619,2018-11-19 14:05:06,When you get passed up for the mascot position twice.
4484,10778,104622,2018-11-19 14:04:59,"Someone pls trade me a Pinsir, it's the one version exclusive I don't have "
4485,10779,104623,2018-11-19 14:04:59,"I have SIX Growlithes to trade to friendly mutual folks who went for Eevee. Version exclusives/Pokes I'm looking for (not necessary but appreciated): VictreebellMeowthPersianKoffingPinserWeezingEeveeMachampGengarAnything 'Alola' except Alolan Rattata"""
4486,10780,104624,2018-11-19 14:04:52,Nothing is a waste of time if you use the experience wisely gamers!  Discover a world of stunning gaming news at today!!! 
4487,10782,104626,2018-11-19 14:04:47,Nostalgieflash 
4488,10784,104628,2018-11-19 14:04:42,We played and absolutely LOVED IT!!!Check out this weeks episode of The Hopefully Awesome Show
4489,10785,104629,2018-11-19 14:04:38,Nummer 3 
4490,10787,104631,2018-11-19 14:04:15, THERE ARE SPECIAL POKMON COACHES IN THIS GAME?! POKMON LET'S GO PIKACHU &amp; EEVEE! - Gameplay Walkthrough Part 3 TUNE IN: 
4491,10789,104633,2018-11-19 14:04:06,"Beat the Elite 4 first try, pikachu was the best in every battle. Time for the master trainers!!! "
4493,10791,104635,2018-11-19 14:04:02,"Also clocked in at 9 hours in last night. Im loving this game! It is so chill and relaxing. Man between this, and its been nothing but chill and jolly vibes in gaming!'"
4494,10793,104637,2018-11-19 14:03:50,Officially Game of the Year 
4495,10794,104638,2018-11-19 14:03:47,A levear 
4496,10797,104641,2018-11-19 14:03:33,"MY own little featuring my name, because that's how I roll. "
4497,10801,104645,2018-11-19 14:03:18,not my target but its cool 
4498,10803,104647,2018-11-19 14:03:02,beauty 
4499,10805,104649,2018-11-19 14:02:53,THIS IS AMAZING 
4501,10815,104659,2018-11-19 14:02:10,Reposting was on the fence about this game at first but I had a change of heart. I wonder if this will bring back that old feeling of me playing on the gameboy color/advance.  
4503,10817,104661,2018-11-19 14:01:56,The Indigo Plateau looks so good in this game. :D 
4504,10818,104662,2018-11-19 14:01:53,So humm... Does eevee have a Southern accent?
4505,10820,104664,2018-11-19 14:01:47,is back bringing you more randomiser nuzlocke. Check it out here! 
4506,10821,104665,2018-11-19 14:01:47,"Speaking of pikachus, how cute is my girl?? This whole game is good vibes &lt;3 "
4507,10822,104666,2018-11-19 14:01:36,is a game that reminds me why I love the series'
4508,10824,104668,2018-11-19 14:01:20,NEW VIDEO!! 
4509,10825,104669,2018-11-19 14:01:01,"With Pokmon Lets Go, the catching instead of wild battles is a double edged sword. On one hand its more fun to catch Pokmon this way. On the other hand it can be annoying to grind XP by catching Pokmon because they sometimes dont stay in the damn ball. "
4511,10830,104674,2018-11-19 14:00:16,Its so beautiful  We can wait to fill up our parks with Magnemite and Clefairy  
4512,10831,104675,2018-11-19 14:00:12,"Aaaarrrrgh sorry guyzzz couldn't get my first video out on time today so Imma save that one for tomorrow. School assignments gettin to meeeeee aaaaaaaahhhhhh. Gonna start from tomorrow with 2 Let's Go Pikachu vids on Mon and Tues each (at least I hope... )"""
4513,10835,104679,2018-11-19 13:59:51,"1st try, 1st ball. "
4514,10839,104683,2018-11-19 13:59:11,Yknow....i would love to rename my rival 
4515,10842,104686,2018-11-19 13:59:08,"Just realized the Charmander, Squirtle, and Bulbasaur you can receive in have the same backstory as the one Ash got in the anime "
4517,10856,104700,2018-11-19 13:58:03,"I stopped playing Pokmon Go like over a year ago, came back today and I'm really confused about many things.What's a raid? What's a research? Do I really want to play this for perks?"""
4518,10861,104705,2018-11-19 13:57:20,Heading live right now to catch them all.  Come and join in! Sprinkle the luck in chat for those tasty shiny Pokemons! 
4519,10863,104707,2018-11-19 13:57:12,I have been playing so much of this the past few days So look at how cute he is!  
4521,10868,104712,2018-11-19 13:56:47,MY FIRST SHINY AHHHHHHHHHH 
4522,10876,104720,2018-11-19 13:56:08,"Sorry for the lack of polls.  Just started a 10 day vacation!Here's today's semi :Pokemon: Let's go...@SGH_RTs"""
4523,10880,104724,2018-11-19 13:55:55,Good morning! Ready for some ?! I sure am. It is a great way to kick off a With some 100% !on from 9am - 3pm EST. 
4524,10882,104726,2018-11-19 13:55:54,By far my most favorite game I've ever played! Me and my partner Star did it the whole way through! &lt;3 
4526,10884,104728,2018-11-19 13:55:47,It was at this moment I realized that guy outside all the gyms is a referee and not just some kind of creepy stalker following a ten y/o kid around the country omg 
4528,10892,104736,2018-11-19 13:54:47,Monday mood is like... 
4529,10893,104737,2018-11-19 13:54:46,"""OUTRAGEOUS"" MY ASS. MAGIKARP IS A TREASURE. I WOULD HAVE PAID THREE TIMES THAT. "
4530,10896,104740,2018-11-19 13:54:39,I'M READY 
4531,10900,104744,2018-11-19 13:54:15,I JUST BEAT TEAM ROCKET!! 
4532,10913,104757,2018-11-19 13:53:10,Hi I chose Who will you choose for your adventure on 
4534,10916,104760,2018-11-19 13:52:27,killing me with your smileee 
4535,10917,104761,2018-11-19 13:52:26,Forte from Galaxy Angel is that you? 
4536,10919,104763,2018-11-19 13:52:18,Finally got the shiny after 5 hours 
4538,10922,104766,2018-11-19 13:51:34,Going live around 4 pm norwaytime at :D Today we gonna play the shit out of :D hope to see u in the chat!  
4539,10923,104767,2018-11-19 13:51:31,my main babes 
4540,10925,104769,2018-11-19 13:51:24,Does anyone know if you can high five in 
4541,10930,104774,2018-11-19 13:51:10,Cuteeeeeee 
4542,10931,104775,2018-11-19 13:51:08,"Here kid, stare at my slow pokes butt for a while in exchange for $4k "
4543,10932,104776,2018-11-19 13:51:03,This is awesome 
4544,10938,104782,2018-11-19 13:50:28,"I've watched a ton of videos on and I'm officially down for the get down. Only thing I don't like is not having to go to a Poke Center to get your pokemon. Lowers the difficulty significantly. @KenBorter"""
4546,10943,104787,2018-11-19 13:50:06,it's time to try this 
4547,10946,104790,2018-11-19 13:49:52,Hitmonlee it is. 
4548,10950,104794,2018-11-19 13:49:30,i can just see it  
4549,10952,104796,2018-11-19 13:49:10,Mom paralyzed an oddish and trapped it in a living nightmare to the sake of her decor and you can't change my mind 
4552,10958,104802,2018-11-19 13:48:43,Ngl this game is perfect 
4553,10961,104805,2018-11-19 13:48:17,I'm upset I failed catching this shinyGame just give me my shiny growlithe so I can go do my assessment in peace 
4555,10964,104808,2018-11-19 13:47:50,So yeah I may have done things out of order but I really wanted my Articuno 
4556,10966,104810,2018-11-19 13:47:36,No bitch you're supposed to give me stuff. 
4558,10971,104815,2018-11-19 13:47:01,Anyone that dislikes has clearly not played it.'
4559,10974,104818,2018-11-19 13:46:36,Pokemon Let's Go How to Fast Travel - Sky Dash Secret Technique 
4560,10979,104823,2018-11-19 13:45:48,Oh Heck! This is cute! 
4561,10983,104827,2018-11-19 13:45:38,Stream today  
4562,10985,104829,2018-11-19 13:45:36,WEIRD COMPLIMENT TO PUT IN A CHILDREN'S VIDEO GAME (yes i know everybody has made this joke already) 
4563,10989,104833,2018-11-19 13:45:05,Kind of digging the blast off set! 
4564,10994,104838,2018-11-19 13:44:08,Nintendo Titanic wants their iconic scene back 
4567,10998,104842,2018-11-19 13:43:51,"He said ""Will you catch \'em all with me?"" I said yes!!!  11.18.18"
4568,10999,104843,2018-11-19 13:43:49,Victreebell is so large its actually scary. Where did my trainer go?? 
4570,11010,104854,2018-11-19 13:43:02,Let's Go! by PhiphiAuThon
4571,11012,104856,2018-11-19 13:42:48,"I love this game, and I'm sad that many people won't be able to play it because of the control scheme.  "
4572,11013,104857,2018-11-19 13:42:48,Erstes Shiny in 
4573,11014,104858,2018-11-19 13:42:30,why would you encourage this
4574,11022,104866,2018-11-19 13:41:45,"Whats Good, "
