,Unnamed: 0,Unnamed: 0.1,date,text
2301,5569,74295,2018-11-20 19:31:46,Entering the group chat 
2303,5571,74297,2018-11-20 19:31:46,if youve been enjoying be sure to check out our episode giving our first impressions on the game! plus light detective pikachu banter! 
2306,5582,74308,2018-11-20 19:31:15,"look at that spawns dude, with a max-lure "
2307,5583,74309,2018-11-20 19:31:15,That game is so cute &lt;3 
2308,5584,74310,2018-11-20 19:31:14,Cutscenes in this game are AMAZING! You've done it again Pokmon!  
2309,5586,74312,2018-11-20 19:31:10,Just battled a trainer on named harjit. I fucking love this game.'
2310,5590,74316,2018-11-20 19:30:50,"Hey guys some silver pinap berries on route 8, just in case you didnt already know lol  "
2311,5594,74320,2018-11-20 19:30:31,Yeah I guess this is fine 
2312,5595,74321,2018-11-20 19:30:27,...Also my bag kinda looks like this now XD;;; 
2313,5599,74325,2018-11-20 19:30:18,im feeling lucky 
2315,5604,74330,2018-11-20 19:30:09,I'm loving the shiny hunting in this game 
2316,5605,74331,2018-11-20 19:30:08,I'VE DONE IT! 
2317,5606,74332,2018-11-20 19:30:07,I become Kanto Champion! 
2318,5607,74333,2018-11-20 19:30:05,omg you're in the game 
2319,5608,74334,2018-11-20 19:30:04,Anyone wanna trade in Lets Go ? I Need exklusivs from eevee Hit me up if u wanna help me out 
2320,5610,74336,2018-11-20 19:29:56,WE DID IT  
2321,5611,74337,2018-11-20 19:29:42,I am now LIVE! Come check out Pokemon Let's Go Pikachu and Let's Go Eevee! THE FINALE!!! Retweets appreciated c: here to watch  
2322,5612,74338,2018-11-20 19:29:42,"Ah yes, the recognition is very appreciated "
2325,5622,74348,2018-11-20 19:29:15,THIS TIME on wait... you can find THAT in Viridian Forest?!Video: 
2326,5623,74349,2018-11-20 19:29:14,Huhu! Live mit  ! :) 
2327,5625,74351,2018-11-20 19:29:06,Watch Twiggy and his sis play Watch them catch them all! 
2328,5628,74354,2018-11-20 19:28:58,THEM 
2329,5629,74355,2018-11-20 19:28:58,game of the year material 
2330,5632,74358,2018-11-20 19:28:40,AWWWWW HELL YEAH!!! 
2331,5633,74359,2018-11-20 19:28:38,"Yo, if anyone wants to help me with the last 3 mons I need for my pokedex in that'd be amazing lol. I need 2 bellsprout and to evolve my haunter, and id be willing to trade any Lets go Pikachu exclusives to anyone who can help, like these Scyther "
2332,5634,74360,2018-11-20 19:28:37,This game is so cute!! 
2333,5635,74361,2018-11-20 19:28:32,"Just finished with Erika last night, continuing our journey for the next couple of hours! Join up and chill with me :DAlmost at our follower goal, come in a celebrate!!!"
2336,5640,74366,2018-11-20 19:28:21,DESTRUUUUUCTIOOOOOOON !! 
2338,5644,74370,2018-11-20 19:28:04,First LGE shiny. Found it while looking for Pinsir... 
2339,5645,74371,2018-11-20 19:28:03,"I wanna be the very best, that no one ever wasssss! Lets Play some "
2340,5648,74374,2018-11-20 19:27:52,wasnt looking for this but nice 
2341,5651,74377,2018-11-20 19:27:47,imagine being such a terrible fan of a series that you purposely leave bad reviews on a good game just because it's differentyou must be a really shitty pokemon fan if you do that
2342,5653,74379,2018-11-20 19:27:37,IT HAPPENED!!! 
2343,5654,74380,2018-11-20 19:27:34,"Getting on a bus to go to VA in 3 hours, do I buy right now?!'"
2344,5656,74382,2018-11-20 19:27:30,She's so cute!!!!!! 
2345,5657,74383,2018-11-20 19:27:28,Sykes isnt approving of my rivals name 
2346,5659,74385,2018-11-20 19:27:22,RIGHT AFTER SHINY DITTO 
2348,5665,74391,2018-11-20 19:27:11,First legendary bird caught in wild! Articuno!!! 
2349,5668,74394,2018-11-20 19:27:02,this is a cute main menu tbh... 
2350,5671,74397,2018-11-20 19:26:56,"FYI: I just nearly destroyed my joy con because there apparently is a tiny ""lock"" on the joy con straps that I had accidentally pressed. There were no instructions about this function anywhere in the Switch bundle.'"
2352,5679,74405,2018-11-20 19:26:33,"Alright, time to collect some more badges! "
2354,5683,74409,2018-11-20 19:26:22,Why the fk is Pokemon $60!? 
2355,5684,74410,2018-11-20 19:26:18,a good girl 
2356,5686,74412,2018-11-20 19:26:00,Well it only took 2 days but it happened  
2357,5687,74413,2018-11-20 19:25:59,Going live shortly on some with my sis tonight! Keeping it chilled as has a 48GB update... wasn't expecting that one... see you in a little while! 
2358,5688,74414,2018-11-20 19:25:58,manque juste mew 
2359,5689,74415,2018-11-20 19:25:58,this is honestly one of the saddest jobs rip onion guy 
2360,5690,74416,2018-11-20 19:25:58,this place is illegal from now on 
2361,5691,74417,2018-11-20 19:25:57,"So I tested Catch Streaks this afternoon. Got to 74, and the majority of catches started looking like this! "
2362,5694,74420,2018-11-20 19:25:52,episode 6 is live! Taking on Misty! 
2363,5698,74424,2018-11-20 19:25:42,35 days until ChristmasCheck out my store for gifts:
2366,5702,74428,2018-11-20 19:25:35,I named him SONION.  ; w ; 
2367,5709,74435,2018-11-20 19:25:14,I broke my 32+ combo 4 u Lapras ;-; 
2368,5715,74441,2018-11-20 19:25:02,Squad 
2369,5720,74446,2018-11-20 19:24:51,Caught a Chansey way earlier than I thought 
2370,5721,74447,2018-11-20 19:24:47,"I\'ve made quick transparent ""It\'s Huge!"" and ""It\'s Tiny!"" logos based off of Please use responsibly! "
2371,5724,74450,2018-11-20 19:24:26,"When using a lure in every pokmon of a species is the same level. So if we had a CP chart couldn't we easily seek out a perfect iv? Where are the cp charts?!"""
2372,5726,74452,2018-11-20 19:24:21,child 
2373,5728,74454,2018-11-20 19:24:15,YEAAAAAAHH BOIIIIIIIIIIIIIIIII 
2375,5734,74460,2018-11-20 19:23:58,"About to get my Sinnoh Stone, what do you think I should evolve into? (Also the Shiny Dusknoir is almost maxed)'"
2376,5736,74462,2018-11-20 19:23:55,shiny Pika!!! 
2377,5738,74464,2018-11-20 19:23:53,Look at him just chilling 
2379,5741,74467,2018-11-20 19:23:47,Blaine what kind of drugs are you on 
2380,5744,74470,2018-11-20 19:23:38,HEWWOOOOOOOOOOOOOOOOOOOOOOOOOOOOOOOOOOOO 
2381,5748,74474,2018-11-20 19:23:35,Finally! This took very long but I finally got him! 
2382,5752,74478,2018-11-20 19:23:24,u h . . . you wanna move along pal?? 
2384,5756,74482,2018-11-20 19:23:07,spins 
2385,5757,74483,2018-11-20 19:23:05,Took about 2 hours. 
2386,5759,74485,2018-11-20 19:22:59,he even draws bruh the parallels 
2387,5760,74486,2018-11-20 19:22:54,prepare for trouble 
2388,5761,74487,2018-11-20 19:22:51," Decided a chill stream is in order today to prep for the Hoiliday season, so we are live right now with some Come drop by for a chill day!"
2390,5765,74491,2018-11-20 19:22:36,Daenerys needs to be protected at all costs. 
2391,5766,74492,2018-11-20 19:22:29,"Let us re-order the moves, pleaseeeeeeeeeeee!'"
2393,5768,74494,2018-11-20 19:22:28,That was easy haha xD 
2394,5769,74495,2018-11-20 19:22:26,Saw this while Snorlax combo catching! 
2395,5771,74497,2018-11-20 19:22:16,"that just say ""YOU used a full restore""...? "
2398,5775,74501,2018-11-20 19:22:04,dat ass 
2402,5795,74521,2018-11-20 19:20:47,Thx Team :3 
2403,5796,74522,2018-11-20 19:20:42,help 
2404,5801,74527,2018-11-20 19:20:26,Lets Go Lets Go 
2406,5804,74530,2018-11-20 19:20:22,Looking for Zapdos? Find out how to get to the Power Plant in in our latest guide! 
2407,5806,74532,2018-11-20 19:20:14,Boop 
2408,5808,74534,2018-11-20 19:20:06,BEST ;_; 
2409,5821,74547,2018-11-20 19:19:43,TFW when you notice that your homie bought Let's Go Pikachu instead 
2410,5827,74553,2018-11-20 19:19:26,The gyms look fucking epic! 
2412,5830,74556,2018-11-20 19:19:19,Playing some 
2413,5833,74559,2018-11-20 19:19:13,wh...wha...how...? 
2414,5834,74560,2018-11-20 19:19:12,Hunting a shiny vulpix came across this instead!!! 
2415,5837,74563,2018-11-20 19:19:03,forget arcanine why is no one talking about this 
2416,5838,74564,2018-11-20 19:19:01,Timeline Liebe an meine Switch Familie! 
2418,5844,74570,2018-11-20 19:18:29,Full Odds Shiny Psyduck!!! 
2419,5849,74575,2018-11-20 19:17:58,I own Eevee now. See you in a couple of months.'
2421,5852,74578,2018-11-20 19:17:48,"Sorry everyone, the holiday has been killer, haven't been able to do much, but we got some streams planned out for Thursday night and Friday!!Pokemon lets go, finishing the game and some shiny hunts and pokemon insurgence part 3!!!!"
2422,5853,74579,2018-11-20 19:17:47,LOOK AT THIS BEAUTIFUL BOYO!! 
2424,5856,74582,2018-11-20 19:17:43,Enjoying the S.S. Anne btw the inside of the ship is amazing. 
2427,5862,74588,2018-11-20 19:17:17,Catching Moltres 
2428,5864,74590,2018-11-20 19:17:09,I completed the pokedex! 
2429,5865,74591,2018-11-20 19:17:07,"""I turned myself into a Pokemon trainer Morty! I\'M BUG CATCHER RICK!"" (idc how many people did this already) "
2430,5868,74594,2018-11-20 19:17:03,All right guys Episode 14 of Ruby Randomizer Nuzlocke is now public after me accidentally uploading Episode 15. 
2431,5869,74595,2018-11-20 19:17:00,How do I get passed the ghost? Also I need help on finding Pokflute. I'M NOT BATTLING 6 LVL 100 METAPODS! 
2432,5870,74596,2018-11-20 19:16:55,"forget detective pikachu, secret agent eevee is way better!! "
2434,5876,74602,2018-11-20 19:16:36,I finally found my true outfit. 
2436,5882,74608,2018-11-20 19:16:06,Hay unboxing del  
2437,5885,74611,2018-11-20 19:15:48,Why everyone on this ship so thristy? 
2438,5886,74612,2018-11-20 19:15:46,"Things have been busy recently, so here is a highlight of this months top releases. All are now available!"
2439,5888,74614,2018-11-20 19:15:40,"Uhh, thanks? Weird complement from kids. "
2440,5889,74615,2018-11-20 19:15:38,Holy shit these trainers are wearing the EXACT hoodie I drew on my chibi like a year ago 
2441,5891,74617,2018-11-20 19:15:34,Going live with more 
2442,5892,74618,2018-11-20 19:15:21,I completed my Pokedex!
2443,5893,74619,2018-11-20 19:15:14,N E O N 
2444,5894,74620,2018-11-20 19:15:10,"Alright, opinions on don't like how Wild Pokmon battles were executed. Catching seems too easy, and if there's no difficulty, there's no sense of reward when you succeed. I also don't like how you can't battle Wild Pokmon. Other than that, it's okay."""
2447,5898,74624,2018-11-20 19:14:54,I think I have a couple Meltan spare if you want one or two 
2448,5900,74626,2018-11-20 19:14:50,I WOULD DIE FOR YOU ;u; 
2449,5901,74627,2018-11-20 19:14:47,I combo'd a bunch of these for a shiny so i boosted its stats with all the candy lmao 
2450,5904,74630,2018-11-20 19:14:42,This is fine 
2451,5905,74631,2018-11-20 19:14:40,Just caught this bad boy while shiny hunting for Ponita  wtf! 
2453,5913,74639,2018-11-20 19:14:24,May I help you sir 
2454,5916,74642,2018-11-20 19:14:18,Me urge su outfit 
2455,5917,74643,2018-11-20 19:14:17,Who's that Pokemon? 
2456,5926,74652,2018-11-20 19:13:44,...this man hitting on me or...? 
2457,5927,74653,2018-11-20 19:13:32,my onix has feet 
2458,5928,74654,2018-11-20 19:13:28,"Watching latest vid on ... my sides hurt, literally can't breathe!! When he went to play with... watch the damn video! Totally different, I hope this is a new direction you're going with presenting content. Awesome!"""
2459,5929,74655,2018-11-20 19:13:21,he knows all 
2460,5930,74656,2018-11-20 19:13:17,"One of my gripes with is that the Team Rocket logo lasts too long before you fight a Grunt. It's making me already dread the part where to have to take them down in Celadon City."""
2461,5933,74659,2018-11-20 19:13:10,"Live Right Now!Playing Last night we got our 4th League Badge, lets see what tonight brings!"
2462,5941,74667,2018-11-20 19:12:35,My first random shiny Pokemon on this game :D 
2463,5944,74670,2018-11-20 19:12:27,Taking down Erica's gym in and then coming for you Come say hi in the chat. 
2464,5946,74672,2018-11-20 19:12:21,rude 
2465,5947,74673,2018-11-20 19:12:15,3rd shiny 
2466,5948,74674,2018-11-20 19:12:14,MY GIRL MISTY 
2467,5950,74676,2018-11-20 19:12:00,Keeping me company between work tasks. 
2468,5955,74681,2018-11-20 19:11:49,took over my life'
2469,5957,74683,2018-11-20 19:11:43,Stay the fek away from me... 
2470,5962,74688,2018-11-20 19:11:26,of what? That derpy facial expression would be a legit reasonable excuse tbh... XD 
2471,5963,74689,2018-11-20 19:11:23,Wow.....I can't believe it...I'm in Pallet Town! This is so cool. I'm Gonna look around. 
2473,5972,74698,2018-11-20 19:10:48,Alolan Persian's head keeps getting stuck in doorways. 
2475,5976,74702,2018-11-20 19:10:30,Not what I was looking for but I am glad that I caught it since it broke out 2 times 
2476,5978,74704,2018-11-20 19:10:29,SHINY BIRD 
2478,5982,74708,2018-11-20 19:10:05,While I have zero interest in playing I'm enjoying all the various flip out videos of people finding shiny Pokemon and either capturing them or accidentally encountering a different Pokemon spawn. 
2479,5983,74709,2018-11-20 19:10:04,OH MY GOD ITS HAPPENING 
2480,5984,74710,2018-11-20 19:10:00,Squad looking clean! 
2481,5985,74711,2018-11-20 19:09:53,THERE'S THE BOY! 
2482,5986,74712,2018-11-20 19:09:52,graduated today 
2483,5987,74713,2018-11-20 19:09:48,"i chained for a long ass time to try and get shiny gastly, but i guess chansey will suffice "
2484,5989,74715,2018-11-20 19:09:45,my little nerd 
2485,5995,74721,2018-11-20 19:09:31,Fantastic day today! Thank you everyone! Loving alot! I get my new TV tonight pictures will follow! also I'll be off till Friday now everyone! BUT i'll be back Friday 2pm GMT 
2486,5996,74722,2018-11-20 19:09:29,"sense Rule 34 art and maybe animations towards the HOT Lorelei being made, Pokmon fanbase, do your worst "
2487,5998,74724,2018-11-20 19:09:26,My shinies from today if only pikachu didn't despawn 
2488,6000,74726,2018-11-20 19:09:13,oh my god. first encounter holy shit 
2489,6001,74727,2018-11-20 19:09:10,Playing on the come join me on my adventure to catch them all. Tell me in chat which is your favorite Pokemon? 
2490,6002,74728,2018-11-20 19:09:06,Cant unsee. r/niceguychu
2491,6004,74730,2018-11-20 19:08:53,now its getting stupid 
2492,6005,74731,2018-11-20 19:08:52,What a cutie  
2493,6014,74740,2018-11-20 19:08:30,shiny Weedle 
2494,6015,74741,2018-11-20 19:08:27,Gotem 
2495,6016,74742,2018-11-20 19:08:25,I wonder why Pikachu is so worried.... Oh. 
2496,6020,74746,2018-11-20 19:08:18,Fuck it up!!! 
2497,6022,74748,2018-11-20 19:08:10,Time for some pokemon! 
2499,6026,74752,2018-11-20 19:08:04,disrespect 
2500,6028,74754,2018-11-20 19:08:01,Going live with in 5 minutes! Finally catching the SHINY ZUBAT! come chill and have fun 
2501,6033,74759,2018-11-20 19:07:50,"Really? Guess people don\'t like wild pokemon surprising them anymore, now. Too quick to 100%, but this game is more of a ""play with your Pikachu / Eevee"" type of game than a challenge of old. "
2502,6043,74769,2018-11-20 19:07:19,Riding . . .  Haunter? 
2503,6045,74771,2018-11-20 19:07:10,i absolutely ADORE her jacket 
2504,6048,74774,2018-11-20 19:07:03,I love my badass little son so much 
2505,6050,74776,2018-11-20 19:06:55,"After 2 unsuccessful attempts at Ponyta chains due to fleeing pokmon, this lil dude popped up! "
2506,6055,74781,2018-11-20 19:06:38,watching made me want a clefable on my team and I found this tiny gal 
2507,6062,74788,2018-11-20 19:06:17,in bed with my electric blanket on what more could I ask for?  
2508,6064,74790,2018-11-20 19:06:07,"help, anyone? "
2509,6065,74791,2018-11-20 19:06:07,be honest if I were a Pikachu in the Pokmon Anime I'd look like my Pikachu but with a blue bow tie! 
2510,6073,74799,2018-11-20 19:05:38,This Soundtrack give me chills 
2511,6074,74800,2018-11-20 19:05:35,We fuckin got em!!!! Shiny Nidoran is mine!!! 
2512,6077,74803,2018-11-20 19:05:30,Wanted a Bulbasaur but thisll do! 
2513,6078,74804,2018-11-20 19:05:30,Happy day!! 
2514,6081,74807,2018-11-20 19:05:18,its so pretty 
2515,6085,74811,2018-11-20 19:05:04,This happened while chaining bulbasaur RIP pikachu 
2516,6089,74815,2018-11-20 19:04:51,.....Charmander almost died 
2517,6090,74816,2018-11-20 19:04:41,"See ya, Bud. "
2521,6096,74822,2018-11-20 19:04:23,chilling with my new friends 
2523,6099,74825,2018-11-20 19:04:10,N64 and Sega Dreamcast definitely up there in my Top list. But gotta give it to the game that started the addiction. The Christmas that my brother and I got a GameBoy Color with Pokemon Red and Blue ...and many years later 
2524,6100,74826,2018-11-20 19:04:10,who's bad 
2525,6102,74828,2018-11-20 19:04:03,LIVEDay 2 of !! Trying out the Pokeball plus! 
2526,6105,74831,2018-11-20 19:03:46,"I was hunting for Dratini, but found this instead! So cool! "
2528,6110,74836,2018-11-20 19:03:32,Finished eevee the main bit anyway. It was so fun alot better then expected i recomend everyone try it who was douting it. Its also really CUTE! my cat gets jealouse when i pet Eevee  i can get bk to do my Misty cross stitch now 
2529,6111,74837,2018-11-20 19:03:22,of the day
2530,6112,74838,2018-11-20 19:03:22,Errrrrrr....Should I Tell him? 
2532,6123,74849,2018-11-20 19:02:38,EXCUSE ME?!?! 
2533,6124,74850,2018-11-20 19:02:38,We ride at dawn... to war! 
2534,6126,74852,2018-11-20 19:02:29,If it ain't me 
2535,6127,74853,2018-11-20 19:02:24,Rapidash Master with Substitute + Drill Run 
2538,6139,74865,2018-11-20 19:01:38,What Big Day? 
2539,6140,74866,2018-11-20 19:01:36,Double yakuza dragons 
2540,6142,74868,2018-11-20 19:01:17,wow a wild squirtle 
2541,6146,74872,2018-11-20 19:01:08,sure makes being at work with my fellow trainers a lot more fun! 
2543,6148,74874,2018-11-20 19:00:57,Look how tiny Cubone is! 
2544,6149,74875,2018-11-20 19:00:55,This is all I've ever wanted in a Pokmon game :D 
2545,6154,74880,2018-11-20 19:00:43,Shiny hunting Ghastly! Playing PIKACHU!                                                                    @TheRaidTrain'
2546,6155,74881,2018-11-20 19:00:41,And He says I'm inpatient...... 
2547,6158,74884,2018-11-20 19:00:39,Shippando 
2548,6161,74887,2018-11-20 19:00:32,For today Host Post We got again trying to catch them all in over at talking it up at these ladys up and say hi. Im sure you will not be disappointed'
2549,6162,74888,2018-11-20 19:00:31,Absolute unit 
2551,6165,74891,2018-11-20 19:00:17,It's 2018 and the theme is still creeping me out. 
2552,6168,74894,2018-11-20 18:59:53,oooh shiny 
2553,6169,74895,2018-11-20 18:59:51,sad this all I clipped but its awesome  
2554,6174,74900,2018-11-20 18:59:31,Time to gear up for the E4 
2555,6175,74901,2018-11-20 18:59:25,1st shiny from this morning 
2556,6176,74902,2018-11-20 18:59:19,Omg lol 
2557,6177,74903,2018-11-20 18:59:19,This made me cry a little on the insideout 
2558,6178,74904,2018-11-20 18:59:16,With Birth By Sleep finished I can focus on Pokemon! kingdomhearts  pokemon 
2559,6179,74905,2018-11-20 18:59:13,live mit songbot und 
2560,6182,74908,2018-11-20 18:58:58,Erika appreciation post 
2561,6183,74909,2018-11-20 18:58:54,FIRST SHINY AFTER A 10 HOUR WAIT 
2562,6184,74910,2018-11-20 18:58:52,Her clothing is almost finished; I need to make her necklace and backpack  
2564,6186,74912,2018-11-20 18:58:51,LIVE with Pokemon Lets go EveeCatching every single Pokemans
2565,6191,74917,2018-11-20 18:58:20,Last shiny of last nights hunt! 
2566,6198,74924,2018-11-20 18:57:53,Primer shiny!!! 
2567,6199,74925,2018-11-20 18:57:50,ca va joystick 
2568,6203,74929,2018-11-20 18:57:27,why does god hate me 
2569,6204,74930,2018-11-20 18:57:25,The best part of having kids is getting them to love things you love. ......
2570,6206,74932,2018-11-20 18:57:15,another long day but i'm happy to be streaming some more let's fight my urge to shiny hunt and get through the story! 
2572,6212,74938,2018-11-20 18:57:01,I love Blaine 
2573,6213,74939,2018-11-20 18:56:51,I'm gonna cry ;w; 
2574,6218,74944,2018-11-20 18:56:40,I love this feature! &lt;3 
2575,6219,74945,2018-11-20 18:56:40,Shiny Pika!!! Streaming a shiny hunt would be fun!! Would you watch? 
2576,6220,74946,2018-11-20 18:56:39,"I'm so happy, after hunting for my favorite Pokemon I finally got it! "
2577,6221,74947,2018-11-20 18:56:36,Being a hair stylist is fun 
2578,6225,74951,2018-11-20 18:56:26,Been playing a ton of so i was inspired to draw this?? 
2579,6226,74952,2018-11-20 18:56:17,aaaaaaaaaand we ALREADY FOUND A SHINY!!!
2580,6230,74956,2018-11-20 18:55:58,"Uh, Yeah......I'm Not Gonna Say anything. "
2581,6232,74958,2018-11-20 18:55:44,"The next part of our Side by Side Let's Play of Let's GO Pikachu and Yellow Version! Check it out, Like, Share, Subscribe!  "
2582,6233,74959,2018-11-20 18:55:43,Queen. 
2583,6238,74964,2018-11-20 18:55:11,WHOS A GOOD EVIL GIRLYOU ARE  
2584,6240,74966,2018-11-20 18:55:03,"ow, my childhood "
2585,6243,74969,2018-11-20 18:54:57,kkk top d+ 
2586,6244,74970,2018-11-20 18:54:57,Never want to see a Magikarp again! 
2587,6247,74973,2018-11-20 18:54:41,Abra Family shiny fan made?! 
2588,6248,74974,2018-11-20 18:54:41,Super excited that I just caught my first Chansey in ! 
2589,6250,74976,2018-11-20 18:54:34,"Oh ffs, this is getting ridiculous. Also it broke the combo -_- "
2590,6251,74977,2018-11-20 18:54:26,Morning! 
2591,6254,74980,2018-11-20 18:54:14,"No one's reporting on thisWhen the PokBall plus detects a Pokmon, you can catch it by clicking the button at the top"
2592,6257,74983,2018-11-20 18:54:06,My boys &lt;3 
2593,6258,74984,2018-11-20 18:54:05,remind me of my childhood. 
2594,6260,74986,2018-11-20 18:54:03,"This is not okay, fix this. "
2595,6262,74988,2018-11-20 18:53:51,2nd shine!  
2596,6263,74989,2018-11-20 18:53:47,his name is prince 
2598,6266,74992,2018-11-20 18:53:36,"But really, can you somehow box/release your partner in lets go? Like, google is absolutely not helpful. Like at all. "
2599,6267,74993,2018-11-20 18:53:29,30 chain in and the 31st flees 
2601,6269,74995,2018-11-20 18:53:25,Meltan in a gym. 
2602,6270,74996,2018-11-20 18:53:24,just caught my first shiny 
2603,6273,74999,2018-11-20 18:53:14,| Live Playthrough | Cool Music + Chat (no mic) ... via @JoystickJamJay'
2604,6274,75000,2018-11-20 18:53:10,I have THE best boyfriend  
2605,6276,75002,2018-11-20 18:53:05,Finally found a Magikarp!! I'm so excited!! 
2607,6281,75007,2018-11-20 18:52:49,Well that happened... 
2608,6282,75008,2018-11-20 18:52:44,My home region is Lord Helix territory
2609,6287,75013,2018-11-20 18:52:28,we evil now 
2610,6292,75018,2018-11-20 18:52:18,Time to finish the adventure! Doing a long stream today until we beat Be part of the finale and chill with our awesome community! 
2613,6302,75028,2018-11-20 18:51:45,Love my Dragonite 
2614,6304,75030,2018-11-20 18:51:38,WHY DID I SPIN LIKE THAT 
2615,6306,75032,2018-11-20 18:51:28,HIGH FIVE 
2617,6316,75042,2018-11-20 18:50:57,I am not nervous... your are...Going live to raise money for Play Live! starting off with some Eevee and we will hop over to doing some Creative Perlers later on the Frontpage! 
2618,6318,75044,2018-11-20 18:50:43,"When you work in a restaurant and you see the regular customers that never tip come sit at your table, but you still have to ""Be professional."" "
2619,6320,75046,2018-11-20 18:50:35,This is way too cute for me 
2620,6322,75048,2018-11-20 18:50:24,this is my favorite thing 
2621,6323,75049,2018-11-20 18:50:24,Rude. 
2622,6324,75050,2018-11-20 18:50:22,Just look at him omg 
2623,6329,75055,2018-11-20 18:49:56,The crew. 
2624,6332,75058,2018-11-20 18:49:24,My Team 
2625,6333,75059,2018-11-20 18:49:21,THROWING POKEBALLS BOIIII LIVE WITH RIGHT NOW! PEEP IT! 
2627,6342,75068,2018-11-20 18:48:34,Can't believe Im already here 
2628,6343,75069,2018-11-20 18:48:28,why are there chansey here 
2629,6345,75071,2018-11-20 18:48:15,the saffron gym looks nice like this 
2630,6347,75073,2018-11-20 18:48:10,"Hello, gorgeous. Now I need a second so I can have a shiny Rapidash, as well! "
2633,6350,75076,2018-11-20 18:48:05,that was quick 
2635,6355,75081,2018-11-20 18:47:52,BOAT ACQUIRED 
2636,6360,75086,2018-11-20 18:47:11,Evoli is in the House 
2638,6364,75090,2018-11-20 18:46:42,Elite 4 - Round 4: The Dragon Vs. The Phoenixan 
2639,6366,75092,2018-11-20 18:46:36,for the first time since R/S/E i have a completed dex 
2640,6368,75094,2018-11-20 18:46:27,it finally happend 
2641,6369,75095,2018-11-20 18:46:26,Even the language select screen is adorable 
2642,6374,75100,2018-11-20 18:46:11,Giving her only the best 
2643,6379,75105,2018-11-20 18:46:00,"My Pokejourney Part 2:PS:  First red ""hair"" stream :)'"
2644,6388,75114,2018-11-20 18:45:28,Live in 15 with our Pokventure Day 2! I love what they've done with so far! It's been a blast revisiting Kanto &lt;3
2645,6389,75115,2018-11-20 18:45:21,First shiny!!! We love!!! 
2646,6390,75116,2018-11-20 18:45:19,Streaming  on ! Team Rocket Animu pin up!   ..Rt for me thanks!. 
2647,6393,75119,2018-11-20 18:45:04,Cerulean Cave has random drops that respawn?!??!? 
2648,6397,75123,2018-11-20 18:44:47,I love my lil buddy. 
2649,6398,75124,2018-11-20 18:44:46,Almost perfect gastly 
2650,6399,75125,2018-11-20 18:44:41,"there's 150 or more to see, to be a Pokemon Master is my destiny!! "
2651,6400,75126,2018-11-20 18:44:40,"I like how everyone has a Switch on their desk, for fun, programming, or otherwise "
2652,6402,75128,2018-11-20 18:44:38,YOOO Another polygonal boi 
2654,6405,75131,2018-11-20 18:44:27,"*3A.M.*ohh, youuuu, got me good dammit. :3"
2655,6408,75134,2018-11-20 18:44:13,"The Epicness of this fail....out this clip! ItsJustDTrain streaming Pokemon: Let's Go, Pikachu!/Eevee!!  "
2656,6409,75135,2018-11-20 18:44:13,Both appeared within minutes of each other! 
2657,6411,75137,2018-11-20 18:43:57,"me, to everything, everyday"
