,Unnamed: 0,Unnamed: 0.1,date,text
2278,4126,4685,2018-11-26 15:06:13,Nintendo Switch Pokemon Limited Edition Console + Lets Go Eevee + Pokeball Plus 329.99 
2279,4132,4691,2018-11-26 15:05:26,Nintendo Switch Pokemon Limited Edition Console + Lets Go Pikachu + Pokeball Plus 329.99 
2280,4136,4695,2018-11-26 15:05:06, LIVE NOW with a FUN ANNOUNCEMENT + more 
2281,4139,4698,2018-11-26 15:04:37,Worth to try 
2282,4142,4701,2018-11-26 15:04:14,"""Who are you?""""I\'m you but better."" "
2283,4143,4702,2018-11-26 15:04:08,Just In! Trainers are having a great time in What are some of your favorite moments in the game so far?
2284,4147,4706,2018-11-26 15:03:25,i just took spearow out for two days  he gain so much 
2285,4148,4707,2018-11-26 15:03:12,OH MY GOOOOOOD I GOT IT ITS THE GRILL  
2286,4149,4708,2018-11-26 15:03:09,in Finally &lt;3 
2287,4152,4711,2018-11-26 15:02:57,"""There is your crush. Act as usual"" "
2288,4158,4717,2018-11-26 15:02:37,"I JUST BOUGHT AND I WANNA STREAM IT! So come check it out if you haven't taken a look yet, love a bit of pokemon ngl.Also got an announcement that will be out this stream, gonna be mad"
2290,4163,4722,2018-11-26 15:02:29,My favorite moment in the game is riding on a charizard 
2293,4167,4726,2018-11-26 15:02:18,STREAMER used SAVE THE CHILDREN! It's super effective!Tomorrow is I'll be raising money for together w/ Diving into Every Pokmon I catch will be named after the most recent donator. Gotta ca--- save 'em all! 
2294,4170,4729,2018-11-26 15:01:59,Trainers are having a great time in What are some of your favorite moments in the game so far?
2295,4171,4730,2018-11-26 15:01:44,Full odds shiny 
2298,4176,4735,2018-11-26 15:01:27,find the hidden............... 
2299,4179,4738,2018-11-26 15:01:18,The more you know  
2300,4180,4739,2018-11-26 15:01:14,I love everything about this game 
2301,4183,4742,2018-11-26 15:00:55,Lavender Town is lovely 
2302,4185,4744,2018-11-26 15:00:49,5th shiny in 4 hours but Zapdos wont shine 
2303,4192,4751,2018-11-26 15:00:16,Yo I'm alive and back from American Thanksgiving :O Playing some and then delving into the new No salt of course 
2307,4200,4759,2018-11-26 14:59:58,Shiny Full Odds Psyduck!
2308,4202,4761,2018-11-26 14:59:39,Our announcement will take place this afternoon around 2:30pm EST! 
2309,4205,4764,2018-11-26 14:59:21,Yep Milo is still cute 
2310,4206,4765,2018-11-26 14:59:18,im desperate to get this game :)'
2311,4208,4767,2018-11-26 14:58:39,How is this not goty 
2312,4209,4768,2018-11-26 14:58:38,Someone thought the candies system was a good idea. 
2316,4216,4775,2018-11-26 14:56:27,my little cutey Faye &lt;3 &lt;3 
2318,4218,4777,2018-11-26 14:56:18,just an hourago ago i caught him in the power plant now i found another one 
2319,4219,4778,2018-11-26 14:56:12,"Nov. 26-Dec. 2: on Monday, and then \\_()_/ The plan is to finish and then switch to !variety. and possibly try out It's gonna be a fun week of me trying out some games! Stop by and say hello! "
2320,4222,4781,2018-11-26 14:55:29,"I've been shiny hunting for like 6 days now, and these are the only 2 I've found so far!  "
2321,4223,4782,2018-11-26 14:55:13,"I know most people will come in here saying ""speak with your wallet"", but the only way the series stays alive at this point is because we spend money on it.  I bought for several reasons, one being the (lame) integration with "
2322,4226,4785,2018-11-26 14:54:21,"Took a bit of a break for the holiday but something Im really thankful for is the Pokkn communityGot Eevee and its amazing so far, stayed relatively spoiler free and found Bulbasaur! Also spent the weekend game jamming a new prototype and its in a sick spot'"
2324,4229,4788,2018-11-26 14:54:09,i frigging love that design *__* 
2327,4232,4791,2018-11-26 14:53:37,omfg im dieing this is sooo cute x_x'' 
2328,4234,4793,2018-11-26 14:53:20,"Ok who's in there, noooooooope "
2329,4235,4794,2018-11-26 14:53:00,un look  
2332,4238,4797,2018-11-26 14:52:24,I dont want this part 4 
2333,4241,4800,2018-11-26 14:51:47,woah 
2337,4249,4808,2018-11-26 14:51:03,"If it's God's plan for this stream, there will be today and tomorrow! "
2338,4250,4809,2018-11-26 14:50:53,"Spent most of the day playing yesterday, but given how windy it is, and the potential of power loss, I think I'm going to try shiny hunting in here in a bit."""
2340,4252,4811,2018-11-26 14:50:47,Shiny Mewtwo under 200 resets! Nature though...not looking good. 
2341,4253,4812,2018-11-26 14:50:33,I think I created a monster... 
2342,4254,4813,2018-11-26 14:50:32,cutest credit end card. 
2344,4257,4816,2018-11-26 14:50:13,"I caught a shiny rattata in Lets go Eevee, her name is Starlet  "
2346,4262,4821,2018-11-26 14:49:10,Still one of my favorite mega evolutions 
2348,4265,4824,2018-11-26 14:48:49,Gotta catch em all! I will never grow up 
2349,4266,4825,2018-11-26 14:48:36,perving at some slowpoke bum 
2350,4268,4827,2018-11-26 14:48:16,I had no clue you could record video on the Switch xD expect lots of clips! 
2352,4274,4833,2018-11-26 14:47:32,I have created heaven 
2353,4275,4834,2018-11-26 14:47:11,Abo shiny 4/147 
2354,4276,4835,2018-11-26 14:46:44,Pokemon Let's Go Gengar - How to Get 
2355,4277,4836,2018-11-26 14:46:10,I'm actually getting mad 
2356,4279,4838,2018-11-26 14:45:26,My green child! 
2357,4281,4840,2018-11-26 14:44:42,You could win  To enter just FOLLOW US + 
2358,4282,4841,2018-11-26 14:44:37,First from the from are a fact. Up to 
2359,4284,4843,2018-11-26 14:44:26,2 min im Game und shiny Rettan lol
2360,4286,4845,2018-11-26 14:43:59,I feel like it was a missed opportunity to not include an Eevee balloon to celebrate but it was still cool seeing Pikachu! 
2361,4287,4846,2018-11-26 14:43:55,awesome stream tonight! SMASHED the elite four in and got utterly destroyed by Mewtwo. Caught some legenadarys and ran away from a shiny lmao. Sent the love over to legends on mixer and on twitch!'
2362,4289,4848,2018-11-26 14:43:44,If you havent gotten yet go read review it might give you motivation to buy it. 
2364,4291,4850,2018-11-26 14:43:24,"Not gonna lie, this right here is 80% of why I bought this game. "
2365,4294,4853,2018-11-26 14:42:55,I LOVE 
2366,4295,4854,2018-11-26 14:42:49,"After playing for a bit, it still rings true that needs to grow the series up substantially. For one, you HAVE to be able to read in order to play the damn game. So really, who is this for anymore?'"
2367,4302,4861,2018-11-26 14:41:38,The Bulbasaga continues 
2368,4303,4862,2018-11-26 14:41:08,HELL YEAH 
2369,4304,4863,2018-11-26 14:40:59,My review of is live! But be warned: I wasn't terribly thrilled by what I found. 
2370,4305,4864,2018-11-26 14:40:29,"When you got a 31 Bulbasaur catch combo, and the wrong man rolls up. "
2371,4306,4865,2018-11-26 14:40:24,Got My final gym badge! 
2372,4307,4866,2018-11-26 14:39:56,Chaining chansey is an amazing thing 
2373,4308,4867,2018-11-26 14:39:32,"The house belongs to you, the trainer. Why else is there only one bedroom in the house? "
2374,4309,4868,2018-11-26 14:39:20,Just give me a shiny. im not moving until I get a shiny &gt;:( 
2375,4312,4871,2018-11-26 14:38:36,"*Edited* This weeks stream schedule (Nov, 26-30)EST TimeZone Mon: 10am-1:30pm-Tues: 10am-1:30pm-Weds: No stream Thurs: 10am-1:30pm-Halo5 Fri: 10am-"
2376,4314,4873,2018-11-26 14:38:22,"My parents looking at on ebay.Father: ""What\'s a Eevee?""Me: ""A Pokmon..."" "
2377,4315,4874,2018-11-26 14:38:20,There she is!!!;_; 
2378,4316,4875,2018-11-26 14:38:12,progress 
2379,4317,4876,2018-11-26 14:37:38,Pokemon Let's Go: A Week in Review 
2380,4318,4877,2018-11-26 14:37:35,2 shinies 
2384,4325,4884,2018-11-26 14:35:37,Alolan Golem is so rad. 
2386,4329,4888,2018-11-26 14:34:51,"Omfg, finaly a shiny Charmander ;-;"
2388,4334,4893,2018-11-26 14:33:32,loser pose 
2389,4335,4894,2018-11-26 14:33:15,Well maybe because you came barging into my room!? 
2390,4337,4896,2018-11-26 14:32:35,First try!!! 
2391,4338,4897,2018-11-26 14:32:08,"Found these shinies on the road to Roanoke when it was Conner's turn to drive! Badge Quest members 5, 6, 7. "
2392,4339,4898,2018-11-26 14:31:59,officers clothes!!! 
2393,4341,4900,2018-11-26 14:31:41,Super informative video for anyone that owns the Poke ball Plus for Found a lot of hidden tricks that make this thing 100x better. 
2394,4342,4901,2018-11-26 14:31:37,GO Live shiny hunting
2395,4343,4902,2018-11-26 14:30:25,i hate him 
2396,4349,4908,2018-11-26 14:29:13,Discovered a new hairstyle!  
2397,4350,4909,2018-11-26 14:29:00,My social anxiety trying to approach someone 
2398,4353,4912,2018-11-26 14:28:06,This game is the right level of cute 
2399,4355,4914,2018-11-26 14:27:27,The legend himself!
2400,4356,4915,2018-11-26 14:27:21,He's Pissed 
2401,4357,4916,2018-11-26 14:27:09,Ladies and gentlemen... we got him 
2403,4363,4922,2018-11-26 14:26:08,Cuddles!  
2404,4365,4924,2018-11-26 14:25:46,Hey I love you     
2405,4369,4928,2018-11-26 14:25:05,"Tip: In a little over 24 hours, tasks will disappear from Don't forget to bank one of these, as it may be a while before you see one again! "
2406,4372,4931,2018-11-26 14:24:55,Oh what is it now 
2407,4373,4932,2018-11-26 14:24:49,Bus life 
2409,4376,4935,2018-11-26 14:24:45,"Found the gays. What's up, boys? ;) "
2411,4380,4939,2018-11-26 14:23:28,I PLAYED AS EEVEE 
2412,4381,4940,2018-11-26 14:23:21,"Just have to get to Viridian now to do the last gym. I've been working with my fossils. I have sneaking fondness for Omastar, and Aerodactyl is amazing too. My Eevee is now well over level 50 because... well... you can mostly solo the game with it. "
2413,4386,4945,2018-11-26 14:22:13,Caught this one immediately after my first shiny. Lucky. 
2414,4387,4946,2018-11-26 14:21:18,bruh... 
2415,4389,4948,2018-11-26 14:21:11,First shiny! 
2417,4396,4955,2018-11-26 14:19:25,First Shiny! 
2418,4399,4958,2018-11-26 14:18:29,"Slowpoke, you'rein the way! "
2419,4401,4960,2018-11-26 14:17:38,"This is 100% for you, "
2420,4403,4962,2018-11-26 14:16:37,Finally after 2 hours and 4 Pinsirs that ran away from me 
2421,4406,4965,2018-11-26 14:15:33, First stream is now LIVE! First Time Playthrough of chill! (Retweets appreciated) 
2424,4412,4971,2018-11-26 14:14:37,Omg it is finally Monday and we are going live in about 5 hours. The game on the menu today is on the !!! We will also be in so come join and chat with us  
2425,4414,4973,2018-11-26 14:14:24,Got this on a 4 charmander chain!! 
2426,4415,4974,2018-11-26 14:14:18,Can I just get a shiny please 
2429,4421,4980,2018-11-26 14:12:55,"Finally, a shiny magnemite in Shall I transfer it to "
2430,4423,4982,2018-11-26 14:12:28,"yeah ur boyfriend might be attractive, muscular, tall and financially well off, but let me show u wat he dont have "
2431,4425,4984,2018-11-26 14:12:13,old habits die hard 
2433,4427,4986,2018-11-26 14:11:51,"Just spending the afternoon combo-catching, dont really care about shiny Pokemon but I need the XP to get my party stronger but if I just happen to get one to appear then cool beans. "
2434,4428,4987,2018-11-26 14:11:33,The Green Hornet 
2436,4430,4989,2018-11-26 14:11:06,"Today's goal in stop screwing around and make it to Celadon so I can meet the fortune teller nature lady so I can start shiny hunting without it being a waste!...sometimes I think my knowledge of Pokmon game mechanics ruins all the fun for me """
2437,4432,4991,2018-11-26 14:10:19,THIS IS ADORABLE 
2439,4436,4995,2018-11-26 14:10:04,First legit shinyto and I completed my Pokedex 
2440,4437,4996,2018-11-26 14:10:00,the one time pokemon is allowed to be horny 
2441,4438,4997,2018-11-26 14:09:54,"Got all the Pokemon, beat Red...Am I done? Is there anything else to do? "
2443,4440,4999,2018-11-26 14:09:27,"So I put my shiny Eevee from GO as my follow, evolved it and went to interact w/ Vivi and she was jealous! XD "
2445,4442,5001,2018-11-26 14:09:21,"Anyone got Ekans, Meowth or Omastar that they could touch trade with me quick in Let's Go "
2447,4444,5003,2018-11-26 14:08:50,Is this Hannah???? 
2449,4448,5007,2018-11-26 14:08:22,i hate this redesign!!!!! 
2450,4449,5008,2018-11-26 14:08:15,You could win To enter just FOLLOW US + 
2451,4452,5011,2018-11-26 14:07:44,hoy en first dates 
2452,4455,5014,2018-11-26 14:07:01,"Now, onto finishing Eevee!'"
2453,4458,5017,2018-11-26 14:06:35,Fitness goals 
2454,4459,5018,2018-11-26 14:06:31,"My 3rd shiny geodude that\'s spawned in a row now when I\'ve been hunting something else, i let it despawn, so i can test this new ""RAM"" theory. "
2456,4464,5023,2018-11-26 14:06:00,"Watching Pokmon while playing - I'm 33 on Friday and this is how I'm spending my first day of my annual leave """
2457,4465,5024,2018-11-26 14:05:36,Flashy! 
2458,4470,5029,2018-11-26 14:05:05,FINALLYYYY 
2459,4471,5030,2018-11-26 14:04:55,I found the adorable bucket scene.  
2460,4473,5032,2018-11-26 14:04:32,A shiny turd appeared. 
2461,4474,5033,2018-11-26 14:04:16,Looking for koffing for trade 
2462,4475,5034,2018-11-26 14:04:03,24 New Nintendo Switch Games ANNOUNCED for the 4th Week of November 2018  Video  ----&gt; 
2463,4478,5037,2018-11-26 14:03:36,This game was a joy to complete 
2464,4479,5038,2018-11-26 14:03:18,Live. 
2466,4482,5041,2018-11-26 14:02:45,I did it 
2467,4483,5042,2018-11-26 14:01:52,Shiny hunt Geodude is on! 
2468,4485,5044,2018-11-26 14:01:05,I caught a shiny Ponyta 
2469,4487,5046,2018-11-26 14:00:38,"Bruh, im just trying to get a ponyta "
2470,4489,5048,2018-11-26 14:00:25,NEW VIDEO!! 
2471,4493,5052,2018-11-26 13:59:38,Snaps 3  
2472,4497,5056,2018-11-26 13:59:16,Evolving my first shiny after acquiring the Shiny Charm 
2473,4498,5057,2018-11-26 13:58:54,Going live right now! Sporting some new Swag! We are completing that Dex today! Shiny charm come at me! Get in ere! 
2474,4499,5058,2018-11-26 13:58:53,i found this while hunting for a shiny charmander... should i catch it? btw i already finished the game 
2475,4501,5060,2018-11-26 13:58:19,beast beast beast beast beast and baby 
2476,4502,5061,2018-11-26 13:58:18,"Green eyes, Greeen dreams =u=  "
2477,4505,5064,2018-11-26 13:57:37,"If anyone plays we will be happy to help you get a mystery box to get your meltans, just come to the special effect table, donate and we will get you sorted"
2480,4513,5072,2018-11-26 13:57:11,"Your blatant disrespect is ruining the mood, Eevee...! "
2481,4515,5074,2018-11-26 13:56:41,Looks like is the enemy of 
2482,4518,5077,2018-11-26 13:56:12,Sorry I can't send out any gifts! This is the only area I have access to (the view is like this all land around).. I live in the lands pokemon forgot. 
2483,4519,5078,2018-11-26 13:56:07,Awesome! Count me in please
2486,4522,5081,2018-11-26 13:56:00,Wow that was FAST Shiny 
2487,4526,5085,2018-11-26 13:55:44,Its finally here!!!!!! 
2488,4527,5086,2018-11-26 13:55:35,"Good morning, fam! I'm going to continue playing this morning. The plan is to work on filling up the Pokedex as well as complete the main story. Let's do this!"
2489,4529,5088,2018-11-26 13:55:27,Good morning everyone! Ready for another dose of cuteness via ? Let's go give some attention. Time to take on another gym or two :Don from 9am-3pm EST.
2491,4534,5093,2018-11-26 13:54:40,I can't believe I found one! 
2494,4541,5100,2018-11-26 13:52:30,Found this and had to reshare during this season! 
2495,4544,5103,2018-11-26 13:51:47,i also ran into this shiny on a 7 combo streak 
2496,4545,5104,2018-11-26 13:51:38,"The new cutest Pokchild is in the place \\('-' ) Let me adopt him along with Hau, Gladion &amp; Lilie...."
2497,4546,5105,2018-11-26 13:51:32,"Thoughts on so far: I feel like a kid again playing Pokmon for the first time. Nintendo, you glorious bastards.'"
2498,4549,5108,2018-11-26 13:51:04,Live on Pikachu today from 6pm WILL THE SHINY CHARMANDER BE MINE!        
2499,4551,5110,2018-11-26 13:50:12,Cursed image 
2500,4555,5114,2018-11-26 13:49:27,DADDY 
2501,4556,5115,2018-11-26 13:49:02,Shiny boi got stuck... and I didn't know that he jumped like a frog 
2503,4558,5117,2018-11-26 13:48:48,I WILL PROTECT YOU!!1!!1! 
2505,4560,5119,2018-11-26 13:48:44,Lorelei defeated! 
2508,4563,5122,2018-11-26 13:47:52,The squad 
2509,4566,5125,2018-11-26 13:47:14,"I have no idea if this is a popular opinion or not... If we get a remake, I hope I can just use my pro controller. I don't want to use motion controls (you hear me, Just give us the option to play with them or not."""
2510,4569,5128,2018-11-26 13:46:39,MY FURRY LIL' CHILD 
2511,4570,5129,2018-11-26 13:46:24,Here's the babe. 
2512,4572,5131,2018-11-26 13:45:59,I GOT A SHINY!!!! 
2513,4574,5133,2018-11-26 13:45:44,31 encounters with Pikachu and 4 days later for a shiny Caterpie. At least Caterpie cares about me. 
2514,4575,5134,2018-11-26 13:45:42,Remember him?!? 
2515,4576,5135,2018-11-26 13:45:40,We did it guys! 
2518,4580,5139,2018-11-26 13:44:53,my little break is over i feel relaxed and in good spirits it was well worth it. SO WE ARE BACK HERO CLASS IS IN SESSION !!! todays stream is  pokemon lets go and Final fantasy XIV  ill keep you guys updated on the time frame 
2519,4584,5143,2018-11-26 13:44:16,1 Gym won! 
2520,4585,5144,2018-11-26 13:44:02,After christmas i will hopefully have a capture card and a webcam so as of that tine i will be streaming pokemob lets go pikachu on twitch so follow my twitter/stream to be updated thank you 
2521,4588,5147,2018-11-26 13:43:09,Pikachu dressed as Raichu. One of the best things ever. 
2522,4589,5148,2018-11-26 13:43:07,First throw... 
2523,4590,5149,2018-11-26 13:42:41,Green!!! 
2524,4591,5150,2018-11-26 13:42:13,One of my favorite screenshots I made of this game 
2530,4608,5167,2018-11-26 13:38:38,Since released all my other games have been completely neglected  Went to see the movie and it was great!! Did anyone else go to see last weekend? 
2531,4612,5171,2018-11-26 13:38:09,who physically wrenched my heart out of my chest? cubone did 
2532,4614,5173,2018-11-26 13:37:50,Going LIVE for a little bit on fam. Going to be doing some on Xbox and maybe some shiny hunting. Sounds like a great morning you say? It sure does 
2533,4615,5174,2018-11-26 13:37:31,Majestic AF! 
2534,4617,5176,2018-11-26 13:36:32,"if someone could buy me the new game, that would be good.'"
2535,4620,5179,2018-11-26 13:36:19,Me meo 
2536,4621,5180,2018-11-26 13:36:17,Some stranger online traded with me on the fly so I could get Alakazam. Nice people still exist. :) 
2538,4624,5183,2018-11-26 13:35:55,Good old time..lavender town is great :D 
2539,4626,5185,2018-11-26 13:35:26,these cutscene are really worth not skipping 
2541,4629,5188,2018-11-26 13:34:43,He ran away... 
2542,4630,5189,2018-11-26 13:34:43,Forgot to post Flameybirb! And got no screenshot of the other bird 
2543,4631,5190,2018-11-26 13:34:19,My niece made this for me. Really cute &lt;3 
2544,4632,5191,2018-11-26 13:34:13,Its absolutely baffling to me that you can play the game in handheld with traditional button layout yet it doesnt support my 60 first-party Pro controller. Fucked it on that one Nintendo. 
2545,4633,5192,2018-11-26 13:33:57,AAAAHHH DOBLE SHINY!!! 
2546,4635,5194,2018-11-26 13:33:46,best bird end of discussion 
2548,4638,5197,2018-11-26 13:33:25,omgomgom this has been on my list of most wanted shinies for since before release and I got it full odds without even trying! 
2549,4639,5198,2018-11-26 13:33:19,Probability stinks. 
2551,4641,5200,2018-11-26 13:32:28,Zappybirb! 
2552,4642,5201,2018-11-26 13:31:44,i think i spent all weekend playing and now im at work and i cant get the jingley music out of my head hhhhhhh'
2553,4644,5203,2018-11-26 13:31:23,HOLY CRAP  
2554,4646,5205,2018-11-26 13:30:14,"Well, hello there big boy! Definitely wasn't expecting you! Check it out!! "
2555,4647,5206,2018-11-26 13:30:14,Hey guess who is back!  
2556,4652,5211,2018-11-26 13:28:02,I need to have Koffing and Ekans to complete my pokedex.. any one can help me and trade them with me ..?  '
2557,4653,5212,2018-11-26 13:27:54,Looking for 3 new friends in GO for my Meltal research. If interested in helping respond to this tweet. Thanks. 
2560,4658,5217,2018-11-26 13:26:17,First shiny 
2561,4663,5222,2018-11-26 13:24:28,Elite Four battle vs Lorelei! 
2562,4666,5225,2018-11-26 13:24:08,Shiny Mewtwo after 1681 resets ! 
2564,4668,5227,2018-11-26 13:23:47,Not so innocent it seems. 
2565,4669,5228,2018-11-26 13:23:39,Se vine pokemon al canal con  
2566,4670,5229,2018-11-26 13:23:33,I mean... 
2567,4672,5231,2018-11-26 13:22:38,seek) shinyJOLLYGrowlitheserve) shiny BRAVENinetales
2569,4679,5238,2018-11-26 13:20:11,My first let's go shiny! 
2570,4680,5239,2018-11-26 13:20:03,oh my god 
2571,4681,5240,2018-11-26 13:19:50,gonna use this as a wallpaper 
2572,4683,5242,2018-11-26 13:19:42,they grow up so fast ;~; 
2574,4685,5244,2018-11-26 13:18:53,The only title that matters. 
2575,4688,5247,2018-11-26 13:18:19,Pokemon Let's Go Dragonite Location - Where to find 
2576,4689,5248,2018-11-26 13:17:22,"some kid rolls up to the Pokmon League suckling on his Snorlaxs tiddies, wyd? "
2578,4693,5252,2018-11-26 13:16:46,OKAY OKAY OKAY OKAYSPEAR PILLAR + REVIVE = SINNOH REMAKE
2580,4695,5254,2018-11-26 13:16:22,Adventure has come to an end  
2581,4696,5255,2018-11-26 13:15:45,My first shiny!
2583,4701,5260,2018-11-26 13:14:04,Time to edit these clips lol 
2584,4702,5261,2018-11-26 13:13:23,docked 1080p 
2586,4707,5266,2018-11-26 13:11:21,MY BEAUTIFUL SHINY SON!! 
2587,4709,5268,2018-11-26 13:10:51,IT BEGINS 
2588,4714,5273,2018-11-26 13:10:05,"Get off the fucking bed, you're not a human, Wigglytuff.  "
2589,4716,5275,2018-11-26 13:09:54,UNITCHU JUST RIPPED OFF THE DAMN BARS 
2590,4718,5277,2018-11-26 13:07:58,I AM THE PIKACHU NOW 
2591,4720,5279,2018-11-26 13:07:05,Riding my favorite Pokemon... this game makes dreams come true
2592,4722,5281,2018-11-26 13:06:11,On an Eevee hunt and this shiny boi appeared!! 
2593,4725,5284,2018-11-26 13:05:00,Another shiny live reaction will be going up on Youtube later today so be on the lookout everyone ! 
2594,4726,5285,2018-11-26 13:04:58,Aaaahhh! Oh my god that's so cute! 
2595,4727,5286,2018-11-26 13:04:42,i would die for this bellsprout 
2596,4729,5288,2018-11-26 13:04:25,HAHAHA MY OLD NEMESIS: ASSHAT 
2599,4733,5292,2018-11-26 13:02:53,"And I'm back to hating 's catch mechanics.... been trying to catch zapdos for more than an hour.this is kinda getting to be a bit of a joke now. Game design much?"""
2600,4736,5295,2018-11-26 13:02:40,The most cutest precious little bean &lt;3 
2601,4740,5299,2018-11-26 13:01:51,Progression 
2602,4743,5302,2018-11-26 13:01:08,Stream Challenge! for each of these challenges.. i'm gonna shiny hunt for +6 hours this friday MAX 24 hours! 1. this tweet gets 100+ likes.2. this tweet gets 30+ retweets3. 100+ new followers on my twitch channel4. 50+ followers on twitter 
2603,4744,5303,2018-11-26 13:00:58,Living my best life 
2604,4745,5304,2018-11-26 13:00:48,Can't wait! 
2605,4746,5305,2018-11-26 13:00:44,DANG IT VICTOR I DONT WANNA FIGHT!!! 
2607,4750,5309,2018-11-26 12:59:51,This made me sad. :( 
2610,4754,5313,2018-11-26 12:58:36,I get it!!!
2611,4757,5316,2018-11-26 12:58:06,cool more sets 
2613,4759,5318,2018-11-26 12:57:51,d3wktop bqvkg4ound matrial 
2614,4760,5319,2018-11-26 12:57:45,Champion &lt;3 
2615,4761,5320,2018-11-26 12:57:36,Also... LOOK AT THIS DAMN GIGANTIC BOY AAAAAAAA 
2618,4766,5325,2018-11-26 12:56:47,Mega Evolution 
2619,4768,5327,2018-11-26 12:56:02,Somebody give me a like for all day shiny mewtwo hunting again today... 
2620,4770,5329,2018-11-26 12:55:36,It finally happened after 6 hours of shiny hunting and over 300 Gastly later!
2621,4771,5330,2018-11-26 12:55:28,This cutie! 
2622,4772,5331,2018-11-26 12:55:17,2nd shiny chansey! 
2623,4773,5332,2018-11-26 12:55:05,Cool animation on Master Balls. 
2624,4774,5333,2018-11-26 12:55:00,OMG!!! She's soooooo coooooool!!! 
2625,4775,5334,2018-11-26 12:54:54,"Oooh, yes please "
2626,4779,5338,2018-11-26 12:54:16,"Who is this imposter, where is the Meowth I know and love?! "
2628,4781,5340,2018-11-26 12:53:55,might be edging to my favorite so far. Its just so different while also hitting all the right nostalgia beats 
2629,4782,5341,2018-11-26 12:53:50,My team so far! 
2630,4783,5342,2018-11-26 12:53:13,"OMG, got a second shiny! :D Never been so excited to see a Pidgey~ &lt;3 "
2632,4787,5346,2018-11-26 12:51:25,"So guys, we did it "
2633,4788,5347,2018-11-26 12:51:06,eevee is the best 
2637,4793,5352,2018-11-26 12:50:39,shiny threeeeee...not what i was goin for but wooooooooooo 
2638,4796,5355,2018-11-26 12:50:06,meowth!!! 
2639,4799,5358,2018-11-26 12:48:22,they talked about food 
2644,4809,5368,2018-11-26 12:44:57,This bitch is FEARLESS 
2645,4811,5370,2018-11-26 12:43:56,a lil update on my adventure 
2646,4818,5377,2018-11-26 12:41:28,We are in a basement hideout. Where did you find this????? 
2647,4819,5378,2018-11-26 12:41:05,Phase 5 for Shiny Bulbasaur: Shiny Weedle no. 3 
2649,4822,5381,2018-11-26 12:40:31,well... 
2650,4823,5382,2018-11-26 12:40:16,Eevee is too cute 
2651,4825,5384,2018-11-26 12:40:11,This is really good news! 
2652,4826,5385,2018-11-26 12:39:35,LOOK 
2655,4829,5388,2018-11-26 12:38:54,Tfw when your watchmixer chat charges on  with 
2656,4830,5389,2018-11-26 12:38:46,i don't have a pet but you get silly videos anyway 
2657,4834,5393,2018-11-26 12:37:54,"""Instead of cursing the darkness, use Light Up."" Thanks Professor! "
2658,4836,5395,2018-11-26 12:37:31,Let's GO! 
2659,4838,5397,2018-11-26 12:37:10,"I literally just caught Zapdos on my first throw with an Ultra ball, what?? It took me like 56 Ultra balls to catch Articuno... "
2661,4843,5402,2018-11-26 12:36:22,This is terrifying 
