,Unnamed: 0,Unnamed: 0.1,date,text
1145,1876,2435,2018-11-26 20:02:34,"Whoever coded Muk to spam Minimize and Protect so you can never actually hit the stupid prick, thanks you have accomplished your task of making me want to headbutt my Switch into next doors garden. Cock "
1146,1878,2437,2018-11-26 20:02:32,holla at my p2w Mew topkek 
1147,1879,2438,2018-11-26 20:02:28,"Erika didn't know she was about to catch these hands, WAKE UP WOMAN Ep 15 is up! RT! "
1148,1880,2439,2018-11-26 20:02:16,*ungodly scream* 
1149,1881,2440,2018-11-26 20:02:16,shiny Weedle 
1150,1882,2441,2018-11-26 20:02:12,Finally brought all of my Jigglies to  
1151,1883,2442,2018-11-26 20:02:10,slowdown 
1152,1884,2443,2018-11-26 20:01:53,She is my princess and I will love her forever 
1153,1885,2444,2018-11-26 20:01:50,Thats not me 
1154,1886,2445,2018-11-26 20:01:39,I miss 
1156,1889,2448,2018-11-26 20:01:22,Brother has been wanting . Ta for the chance! '
1157,1892,2451,2018-11-26 20:01:12,Proper pissed 
1158,1893,2452,2018-11-26 20:01:06,cuuuuuuuuuute 
1160,1895,2454,2018-11-26 20:01:01,Excuse me while I cry happy tears. :-D 
1161,1899,2458,2018-11-26 20:00:24,More Pokemon cause I LOVE IT SM 
1162,1900,2459,2018-11-26 20:00:22,~*Flower Boy*~ 
1163,1901,2460,2018-11-26 20:00:18,It sure would be a shame if fire type Pokmon were available in the route right before your grass gym.  
1165,1903,2462,2018-11-26 20:00:11,Oh Brock 
1166,1904,2463,2018-11-26 20:00:09,Stream is live! Come hang out and enjoy some on this 
1167,1905,2464,2018-11-26 20:00:05,First shiny fail :[ 
1168,1907,2466,2018-11-26 19:59:54,Thanks homie 
1169,1909,2468,2018-11-26 19:59:23,I just caught a shiny Slowpoke!!But....whats so different about it? 
1170,1912,2471,2018-11-26 19:59:00,"Have started . What a treat it is to see everything look so beautiful on the big screen. Cheers, chums.'"
1171,1914,2473,2018-11-26 19:58:53,guess wut i got :^) 
1172,1915,2474,2018-11-26 19:58:47,al lio!! 
1173,1916,2475,2018-11-26 19:58:45,Shiny hunting and a random Zapdos popped up. 
1177,1923,2482,2018-11-26 19:58:13,Hunting for a shiny Charmander!! How long will it take??  
1178,1924,2483,2018-11-26 19:58:06,Eevee in Let's GO in a nutshell. 
1179,1926,2485,2018-11-26 19:57:52,my second random shiny encounter within 2 hourslol.... yay 
1180,1927,2486,2018-11-26 19:57:44,Golden sushi! 
1181,1928,2487,2018-11-26 19:57:35,"Damn, I look fly as hell!!  "
1182,1930,2489,2018-11-26 19:57:28,Oh my god. My life.  
1183,1931,2490,2018-11-26 19:57:28,I WOULD DIE FOR YOU 
1184,1936,2495,2018-11-26 19:56:43,"21h30, live  "
1186,1940,2499,2018-11-26 19:55:46,intothe\\(*^*)/ eighth Gym! 
1187,1941,2500,2018-11-26 19:55:14,Back on the hunt for shiny charmander... rngesus have mercy 
1188,1943,2502,2018-11-26 19:55:05,I cry  
1190,1946,2505,2018-11-26 19:54:40,POKEDEX COMPLETE!! 
1191,1947,2506,2018-11-26 19:54:37,I found a random Clefable in Mt. Moon! But it ran away after five failed throws!  
1192,1949,2508,2018-11-26 19:53:59,Got this diploma a few days back and I'm proud of myself  
1193,1950,2509,2018-11-26 19:53:52,He forever be rollin 
1194,1952,2511,2018-11-26 19:53:44,OF COURSE 
1195,1954,2513,2018-11-26 19:52:06,ouu yeahh 
1196,1955,2514,2018-11-26 19:52:06,wheeze 
1197,1956,2515,2018-11-26 19:52:00,Roucool shiny sur 
1198,1958,2517,2018-11-26 19:51:16,i secured my boy magikarp 
1199,1959,2518,2018-11-26 19:51:16,reverse hentai 
1201,1964,2523,2018-11-26 19:51:02,I got him in an ultra ball baby woooooo 
1203,1967,2526,2018-11-26 19:50:29,"I think I caught a shiny Pikachu. Was my 1st Pikachu caught, too. "
1206,1972,2531,2018-11-26 19:50:02,Giovanni and his queen. 
1207,1974,2533,2018-11-26 19:49:53,let's facking go loco 
1208,1975,2534,2018-11-26 19:49:53,Awesome stream last night! Dat Ashe got me guacin. balloonbeejulie and thanks for the hosts friendos  Stream tonight will be some more pokemans! 7PM MST! 
1209,1977,2536,2018-11-26 19:49:52,this man tried to SEDUCE ME 
1210,1978,2537,2018-11-26 19:49:42,OMG OMG 
1213,1982,2541,2018-11-26 19:49:28,thoughts ???  
1214,1983,2542,2018-11-26 19:49:23,Wha? He back too? 
1215,1984,2543,2018-11-26 19:49:23,"Ok Ekans hunt is cursed, i give up lol. We'llsave it for the stream xD "
1216,1985,2544,2018-11-26 19:49:23,shiny babies 
1220,1993,2552,2018-11-26 19:48:44,THIS FACE 
1221,1995,2554,2018-11-26 19:48:34,THE SADDEST EVER
1222,1998,2557,2018-11-26 19:48:02,"YES!!! I wanted a shiny Vulpix and finally I succeeded to obtain it!!  Welcome to my team, Kyra! "
1223,2000,2559,2018-11-26 19:47:53,Giving away this Pidgey at 50 followers. 
1224,2001,2560,2018-11-26 19:47:50,OH MY GOD IT'S HER!!!! 
1225,2002,2561,2018-11-26 19:47:39,the queen takes down the king 
1226,2003,2562,2018-11-26 19:47:27,"Day 3, 2 broken combos, i finally got it!!!! "
1229,2008,2567,2018-11-26 19:46:36,BRUHHH I FORGOT TO BUY REVIVES!!!! And Im only To my last two Pokmons!!! Idk if I can do this Lol Plus dont make fun of me of how I said elite four 
1231,2012,2571,2018-11-26 19:45:53,First shiny I catched on my own *-* 
1232,2013,2572,2018-11-26 19:45:48,Plz send help.  Only god knows what will be of me if a shiny Growlithe doesnt appear. 
1233,2015,2574,2018-11-26 19:45:18,"All I want to play is just now. Enjoying the more chilled out nostalgia tour, nice break from the deliberate pace of RDR2.'"
1234,2016,2575,2018-11-26 19:45:14,Nice 
1236,2018,2577,2018-11-26 19:44:55,Okay but this is like the cutest thing 
1238,2024,2583,2018-11-26 19:44:29,Yes I got Mewtwo!!!  
1239,2025,2584,2018-11-26 19:44:18,Tras una racha de 20 Slowpokes
1240,2028,2587,2018-11-26 19:44:03,Mt. Moon is finally fully realized 
1241,2030,2589,2018-11-26 19:43:49,all those trainer fights kinda annoy me .... 
1242,2031,2590,2018-11-26 19:43:43,today was a good day. 
1243,2032,2591,2018-11-26 19:43:29,I found an Alolan Sandshrew! 
1244,2034,2593,2018-11-26 19:43:10,"Really!?!?My first Let's Go hunt... it was supposed to be a nidoran, but I'll take this.  "
1246,2039,2598,2018-11-26 19:42:12,Ooooooooh boy 
1247,2041,2600,2018-11-26 19:42:09,Click the link ya 4Head &lt;3More Pokemon :D         
1248,2043,2602,2018-11-26 19:41:41,Shiny Bellsprout!!! Finally
1249,2044,2603,2018-11-26 19:41:40,Had to break my chain  coz this shiny popped up 
1250,2045,2604,2018-11-26 19:41:34,Shiny Tentacruel 
1252,2050,2609,2018-11-26 19:40:46,Chaining Nidoran (Day 2) while making some noodles. 
1253,2057,2616,2018-11-26 19:39:52,"can we talk about how in the ""familiar song"" video for they purposefully knocked out their team to get a 2 on 1 with Ekans and Koffing vs Caterpie?'"
1254,2058,2617,2018-11-26 19:39:42,thanks Bulbasaur &lt;3 
1255,2059,2618,2018-11-26 19:39:40,The aftermath 
1256,2060,2619,2018-11-26 19:39:38,So pretty! 
1257,2061,2620,2018-11-26 19:39:23,For ppl still saying that isnt selling well: 
1258,2063,2622,2018-11-26 19:39:17,"Today in nickname origins, Ibuki is Hibiki's (also my Pikachu's name) rival in Kamen Rider "
1260,2069,2628,2018-11-26 19:38:36,Someone tell her she got her wish. 
1262,2072,2631,2018-11-26 19:38:31,"[spoilers?] PLEASE TELL ME  EVERYONE GETS THESE , I WILL DIE HAPPY "
1265,2075,2634,2018-11-26 19:38:11,HOLY CRAP LOIS 
1267,2078,2637,2018-11-26 19:37:51,Arcanine :3 
1268,2079,2638,2018-11-26 19:37:50,He's too god damn cute!!! 
1270,2085,2644,2018-11-26 19:36:57,Beautiful 
1271,2086,2645,2018-11-26 19:36:39,my friends were talking nonstop about during thanksgiving breakme on the other hand? I was thinking about the real game original artist 
1272,2087,2646,2018-11-26 19:36:37,"JUST GIVE ME A SHINY, OH MY GOD "
1273,2089,2648,2018-11-26 19:36:22,The shiny hunt begins!!!!Join me on while we hunt kanto for some ultra special pokemon on 
1275,2092,2651,2018-11-26 19:36:02,Why is haunter so huge!! 
1276,2093,2652,2018-11-26 19:35:54,[spoilers?] FANGIRL NOISES???  
1277,2095,2654,2018-11-26 19:35:28,Best remake game. 
1278,2097,2656,2018-11-26 19:35:12,I beat the elite 4 with this team! 
1279,2098,2657,2018-11-26 19:34:56,"sorry for the spam, I just really like this picture. "
1280,2099,2658,2018-11-26 19:34:54,Rofl
1281,2100,2659,2018-11-26 19:34:47,cuuuuuuuuuute &gt;.&lt; 
1284,2105,2664,2018-11-26 19:34:30,"has been fantastic so far! I do kinda miss the wild battles, but I love all the trainer battles. They were sorely lacking in Sun&amp;Moon, so I'm glad there's a ton of them here"""
1285,2106,2665,2018-11-26 19:34:26,The book of Kokichi. 
1286,2107,2666,2018-11-26 19:34:25,"Pokedex completed, part 2! "
1287,2109,2668,2018-11-26 19:33:58,mood 
1289,2112,2671,2018-11-26 19:33:12,But why 
1290,2114,2673,2018-11-26 19:33:00,Pokedex completed!! 
1292,2117,2676,2018-11-26 19:32:54,Love the Alola version of Vulpix and Ninetales 
1294,2119,2678,2018-11-26 19:32:26,"Oh hey, it's tiny. "
1295,2121,2680,2018-11-26 19:32:21,oh. my. god.  
1298,2124,2683,2018-11-26 19:31:57,"So, my friend got Pikachu and named the rival after me. That's some solid no homo friendship right there"""
1300,2127,2686,2018-11-26 19:31:22,I forgot to post this on Friday. 
1302,2133,2692,2018-11-26 19:31:02,EXCUSE ME WTF 
1304,2136,2695,2018-11-26 19:30:45,"So myself and a few others have decided to create a Pokemon Stream Team! Pallet Town Heroes! We will be doing marathons, contests, multistreams and more together! If you're interested in joining us, DM me or comment here!:) The more the better!:)"
1305,2137,2696,2018-11-26 19:30:17,Suffering for shinies ; A ; 
1307,2142,2701,2018-11-26 19:29:51,how youu doiiin xD 
1308,2143,2702,2018-11-26 19:29:49,well i got really lucky didnt think i would even get it 
1309,2145,2704,2018-11-26 19:29:34,Damn... I just remembered this... :( 
1310,2146,2705,2018-11-26 19:29:29,I am now LIVE! What would happen if you played the Pokemon Games using Ash's Team and followed Anime Logic? Find out in my Ash Ketchum Team Challenge series! The next installment being Retweets appreciated Click here to watch  
1311,2147,2706,2018-11-26 19:29:28,I can control my in 
1313,2150,2709,2018-11-26 19:29:01,"LIVE with my first playthrough of I'm a POKEMON TRAINER, chat!!!|| ||"
1314,2153,2712,2018-11-26 19:28:15,Perfect 6IV Bulbasaur Giveaway! on a 100 Bulbasaur Catch Combo!'
1315,2154,2713,2018-11-26 19:28:12,Hey cutey you literally just murdered this guy's best friend... don't look at me like that! 
1317,2156,2715,2018-11-26 19:28:09,Keep an eye out for my next tweet to be alerted when i go live with some more ! we will be shiny hunting in Mt.Moon tonight hopefully chaining Clefairy's! i need a good IV &amp; Natured one so 2 birds! Last night we got a Bulbasaur while hunting for a weedle! 
1318,2158,2717,2018-11-26 19:28:04,I FAILED THIS STUPID THING 
1319,2160,2719,2018-11-26 19:27:54,IT FINALLY HAPPENED (Next is Pidgey!) 
1320,2162,2721,2018-11-26 19:27:47,Found this little guy while hunting for a Pinsir! number 3! 
1321,2163,2722,2018-11-26 19:27:47,the new squadron 
1323,2165,2724,2018-11-26 19:27:38,Kanto Champion  
1325,2169,2728,2018-11-26 19:27:30,El Shiny imposible....... 
1326,2170,2729,2018-11-26 19:27:25,OMG RANDOM ENCOUNTER SHINY GRAVELER!!! 
1327,2171,2730,2018-11-26 19:26:59,we stan 
1328,2172,2731,2018-11-26 19:26:58,Third set incoming 
1329,2176,2735,2018-11-26 19:26:15,"My favorite is Venusaur, but I LOVE my new shiny "
1330,2177,2736,2018-11-26 19:26:13,There's my beautiful girl &lt;3 
1331,2179,2738,2018-11-26 19:26:04,All the Geodudes! Looking for that last shiny. 
1332,2181,2740,2018-11-26 19:25:54,am so happy they gave an explanation for this! 
1333,2182,2741,2018-11-26 19:25:46,*cries in spanish* 
1335,2185,2744,2018-11-26 19:25:16,Here's the second set 
1337,2187,2746,2018-11-26 19:25:00,LOOK AT STARMIE 
1338,2188,2747,2018-11-26 19:24:59,lets go for badge no 6 tonight!!! 30hrs in and still loving it!! 
1339,2194,2753,2018-11-26 19:24:41,Prepare for trouble 
1340,2196,2755,2018-11-26 19:24:15,Here's the first set 
1342,2199,2758,2018-11-26 19:23:40,quite easy 
1343,2200,2759,2018-11-26 19:23:38,OMG Pokemon/Nintendo/Gamefreak ... No... just... no 
1344,2207,2766,2018-11-26 19:22:27,I hunted Nidoran for hours... 
1345,2209,2768,2018-11-26 19:22:15,im back. 
1346,2210,2769,2018-11-26 19:22:03,excuse me ma'am????????? 
1347,2213,2772,2018-11-26 19:21:46,Not expected but I'll take it. 
1348,2218,2777,2018-11-26 19:21:09,Shiny Youtube Playlist! Check out my reactions :D
1350,2220,2779,2018-11-26 19:21:04,What Masterball? 
1352,2222,2781,2018-11-26 19:20:54,MI PRIMER SHINYYY ;;;;;W;;;;;; 
1353,2225,2784,2018-11-26 19:20:13,my shiny moonstone babies   
1354,2226,2785,2018-11-26 19:20:07,"im live in about 20 minutes, sit tight "
1355,2227,2786,2018-11-26 19:19:51,I dont know if anything ever hurt more than replacing our VenusaursVine Whip with a new move  
1358,2236,2795,2018-11-26 19:18:43,Caught a 2nd Pidgey for living dex 
1360,2242,2801,2018-11-26 19:17:16,Cool guys don't look at explosions 
1361,2244,2803,2018-11-26 19:16:49,Bulk posting! Caught a shiny Metapod and Pidgey+ evolved things. 
1362,2245,2804,2018-11-26 19:16:49,"A new baby! and only 13 chain, not the best stats but modest nature! "
1363,2246,2805,2018-11-26 19:16:41,What should my next shiny hunt be on stream? 
1364,2247,2806,2018-11-26 19:16:39,this move is hilariously satisfying 
1365,2248,2807,2018-11-26 19:16:23,im glad i bought this game. Been holding me over til dec 7th 
1366,2251,2810,2018-11-26 19:16:01,"This game was a lot of fun!!! Still wish there was another section after the end like Omega Ruby, but...eh.  "
1367,2253,2812,2018-11-26 19:15:39,ok i do not i repeat DO NOT recommend walking around the cerulean cave for 3 hours trying to find snorlax because i only found 4 and my head hurts 
1368,2254,2813,2018-11-26 19:15:36,Got myself something for Christmas 
1370,2256,2815,2018-11-26 19:15:12,very large heart eyes asdfghhjk 
1371,2258,2817,2018-11-26 19:15:09,So I opened up and found this bad boy! Might send him to 
1372,2261,2820,2018-11-26 19:14:47,at least Moltres was nice enough to look me in the eye instead of blasting me 
1373,2264,2823,2018-11-26 19:14:32,I don't like pikachu much but its voice is real cute in this game 
1374,2266,2825,2018-11-26 19:14:22,theres no fucking way! i was chaining venonat 
1376,2270,2829,2018-11-26 19:13:59,"Ouch, so sorry bro "
1377,2272,2831,2018-11-26 19:13:13,Collecting all 8 gym badges 
1378,2274,2833,2018-11-26 19:13:05,Caught more meltan today 
1380,2277,2836,2018-11-26 19:12:48,why does the rival smooch you 
1381,2279,2838,2018-11-26 19:12:42,Finally!!!! 
1384,2284,2843,2018-11-26 19:12:02,Gave Kitsune 94 Vulpix candy! Come at us! 
1385,2285,2844,2018-11-26 19:12:00,First shiny!!! rip shiny grimer 
1387,2290,2849,2018-11-26 19:11:00,"NOWTaking on the Don of Celadon!Hopefully seeing our Charmeleon and Wartortle evolve!Laughs, tears and cheers... you can find it here: "
1389,2293,2852,2018-11-26 19:10:30,Oddish. 
1390,2294,2853,2018-11-26 19:10:22,"I was going to stream some more but Im not feeling too good, Im exhausted and stressed with a lot going on. But I will be uploading a new ep of Sorry everyone. "
1391,2296,2855,2018-11-26 19:10:11,kill mee 
1392,2301,2860,2018-11-26 19:09:26,Umm what is this this guy's girlfriend? 
1393,2302,2861,2018-11-26 19:09:23,RIP Shiny Porygon :'( 
1394,2303,2862,2018-11-26 19:09:22,"come on! Bring the GTS to its awfull I have to go to the internet to find out if theres someone somewhere that helps me evolve my Hunters, Gravelers and Kadabras.'"
1395,2307,2866,2018-11-26 19:08:37,Going live at 1:30 CST! (22 minutes from now) 
1398,2311,2870,2018-11-26 19:07:46,All charged up and READY for action ! Let;s play some !Come join my adventure !
1400,2313,2872,2018-11-26 19:07:37,captured a good face on accident 
1401,2314,2873,2018-11-26 19:07:32,Champ! 
1402,2315,2874,2018-11-26 19:07:20,just checking for shiny belsprout WHEN SUDDENLY 
1403,2320,2879,2018-11-26 19:06:53,I did some rough coloring for my Arbok lady. Shiny and normal version. 
1404,2321,2880,2018-11-26 19:06:45,Me &amp; My Mom ()  Got From Amazon.My Dad () Got My On Today My Is Already Looking Good.  
1406,2323,2882,2018-11-26 19:06:27,Hunting is going well at least 
1410,2330,2889,2018-11-26 19:05:56,Live now playing Filling up the Pokedex Then We Shiney Hunt 
1411,2331,2890,2018-11-26 19:05:56,"I just, I need this shirt. "
1412,2332,2891,2018-11-26 19:05:53,I finally got the opportunity to get the Mystery Box in ! 
1414,2338,2897,2018-11-26 19:05:08,Caught Shiny Caterpie while I was collecting Bulbasaur candies! 
1415,2341,2900,2018-11-26 19:04:55,"Tonight I'm gonna have myself a real good time, I feel alive! But more important, we are gonna take over the Pokmon Ligue, become a Pokmon Master and finish this game ! Then, we'll complete the pokdex ! "
1416,2343,2902,2018-11-26 19:04:47,"uhm early mander while hunting for Ekans, now i know how Pattytrills felt..... xD "
1417,2348,2907,2018-11-26 19:03:48,"Someone wants to on Need to trade machoke - machoke, graveler - graveler, kadabra - kadabra and haunter - haunter to get the evolutions'"
1418,2354,2913,2018-11-26 19:02:53,Great gift for my children thank you x'
1419,2355,2914,2018-11-26 19:02:52,Quiet happy.. so fast.. 
1420,2356,2915,2018-11-26 19:02:47,"Hey so, those playing , I found this ""pok rap"" online and y\'all won\'t believe this but there might be more than 151 pokmon out there, shit\'s wild "
1421,2360,2919,2018-11-26 19:01:57,Pokemon Let's Go Eevee! - Part 11 - Vs Lt. Surge &amp; Dat Secret Dechnique! via 
1422,2361,2920,2018-11-26 19:01:52,Ya got me right in the feels Eevee 
1423,2362,2921,2018-11-26 19:01:44,Some sketches last night of and a little skull girl inspired by 
1424,2364,2923,2018-11-26 19:01:28,Well is going to new places as the boardwalk leads to on 
1425,2365,2924,2018-11-26 19:01:00,I didnt think there was a Safari Zone in this game... 
1426,2366,2925,2018-11-26 19:01:00,Wahoo! Also caught it! 
1427,2367,2926,2018-11-26 19:00:49,Worked on a little editorial video about the design work behind Pokemon Let's Go Pikachu and Eevee! 
1429,2369,2928,2018-11-26 19:00:44,GIMME BACK MY SANDSLASH!! D'x 
1430,2370,2929,2018-11-26 19:00:34,So happy with this little beauty. Will name her Kitsune which means Fox in Japanese! 
1431,2373,2932,2018-11-26 19:00:22,It's time to take on Lorelei of the in I take our her tough ice types? Or will I be left frozen to the bone?!WATCH &gt; 
1432,2374,2933,2018-11-26 19:00:07,Anyone got a shiny Charmander in 
1433,2375,2934,2018-11-26 19:00:02,What an eventful weekend...  
1434,2376,2935,2018-11-26 18:59:58,ok youcan find all fossils 
1436,2382,2941,2018-11-26 18:59:23,"I was looking for vulpix, but I'll take it "
1438,2386,2945,2018-11-26 18:58:53,"LIVE I'm back!  I hope you all were good - snowflakes should be here by Thursday :)  We'll be playing today and more !  Help me catch some shinies!!!Also - I have a giveaway today from a community member!"""
1439,2387,2946,2018-11-26 18:58:51,"has dominated the Black Friday weekend!""Statistics reported so far are pretty crazy; Pokmon Let\'s Go was still a brand new game WITHOUT Black Friday discounts, so buyers were clearly choosing it over other discounted holiday gift ideas.""~ Via Adobe Analytics "
1441,2391,2950,2018-11-26 18:58:38,Going into work today like..Coworker: How was your weekend? Do anything fun?Me Internally: *Good! My husband surprised me with a Nintendo Switch on Friday and I played for 14 hours!!*Me IRL: It was good! Just stayed home and relaxed. How was yours?'
1442,2393,2952,2018-11-26 18:58:33,I did it! 
1443,2394,2953,2018-11-26 18:58:22,"It just came running into the bottom of the screen, number 16 for the challenge (see 2nd tweet)"
1444,2395,2954,2018-11-26 18:58:20,"my gorl,, "
1445,2397,2956,2018-11-26 18:58:08,i'm CRYING? 
1446,2400,2959,2018-11-26 18:57:57,Going to get on stream a bit earlier tonight for some on and going on a shiny hunt! How many do you think we will find?'
1448,2406,2965,2018-11-26 18:56:45,That painting 
1449,2408,2967,2018-11-26 18:56:42,Been having a blast playing pokemon! I did a video on my first impressions and will be doing a shortly 
1451,2411,2970,2018-11-26 18:56:27,Finally got Shiny Squirtle! Had to sacrifice a Shiny Rhyhorn for it. 
1452,2413,2972,2018-11-26 18:56:22,........ I just caught another shiny Bulbasaur..... 
1453,2415,2974,2018-11-26 18:56:07,"Random shiny Golduck while shiny hunting Snorlax! I was about to go back up the ladder too, way too close. "
1455,2419,2978,2018-11-26 18:55:42,I'm never going to run out of any type of pokballs now! 
1456,2423,2982,2018-11-26 18:55:10,OH LAWD HE COMIN 
1457,2425,2984,2018-11-26 18:55:09,comme promis &lt;3 
1458,2426,2985,2018-11-26 18:54:59,Finally found a shiny Vulpix after around 10 hours hunting! I'm so happy! 
1460,2430,2989,2018-11-26 18:54:46,The time is now. 
1461,2432,2991,2018-11-26 18:54:35,hey shiny 
1462,2433,2992,2018-11-26 18:54:26,"Another 1,000 Streak in the books. Only 1 Shiny this time though."
1463,2434,2993,2018-11-26 18:54:17,"Whilst I may be dying in another room, the person you actually tune in for (aka. will be chilling with some GIVE HER SOME LOVE"
1464,2435,2994,2018-11-26 18:54:15,"Alright, in this thread I'll share my thoughts about now that I finished it after around eighteen hours. "
1465,2436,2995,2018-11-26 18:54:10,I hope everyone had a good holiday/day lolWe're playing the Japanese demo for Katamari Damacy Reroll! It's a quick little demo so after that we will continue 
1466,2438,2997,2018-11-26 18:53:55,I love that kind of moment where I can play with my daughter! For me this one is my Legacy to share with her 
1467,2439,2998,2018-11-26 18:53:54,Still no Charizard 
1469,2445,3004,2018-11-26 18:52:59,~I want to see my lit-tle boy~ 
1470,2446,3005,2018-11-26 18:52:53,A random encounter shiny! 
1471,2456,3015,2018-11-26 18:50:58,Being able to fly on my favorite pokemon back is the coolest thing ever 
1472,2457,3016,2018-11-26 18:50:55,Cool guys dont look at explosions 
1473,2458,3017,2018-11-26 18:50:49,got my yay :3
1474,2459,3018,2018-11-26 18:50:48,Shiny
1475,2462,3021,2018-11-26 18:50:43,3rd shiny!!! 
1476,2469,3028,2018-11-26 18:50:04,My first shiny in 
1477,2470,3029,2018-11-26 18:49:49,We got ourselves a new look 
1478,2471,3030,2018-11-26 18:49:47,I love my girl so much 
1479,2474,3033,2018-11-26 18:49:41,My latest shiny conquest in ! 
1480,2475,3034,2018-11-26 18:49:40,Hey everyone! In just a few minutes we will be streaming ! Come join us at !! 
1481,2477,3036,2018-11-26 18:49:33,"""lol how are you gonna beat giovanni with pikachus. also silph co is difficult""Bitch please, I didn\'t even use items :] "
1482,2480,3039,2018-11-26 18:49:03,I did it!! Big thanks to and a random player online for helping me fill in the missing pieces! 
1484,2483,3042,2018-11-26 18:48:34,"Playing on my school campus, sipping on a hot white chocolate drink and chillin before class...Living the life "
1485,2484,3043,2018-11-26 18:48:30,i hate how cute this game is 
1486,2485,3044,2018-11-26 18:48:22,pokemon let go NintendoSwitch review on BBC Click @persianclick'
1488,2492,3051,2018-11-26 18:47:32,Glad I decided to reset for one of these! 
1489,2493,3052,2018-11-26 18:47:32,still waiting on a charizard but I'll settle for now 
1490,2494,3053,2018-11-26 18:47:18,Am I dead  
1492,2498,3057,2018-11-26 18:47:04,Look at this bad boy 
1493,2499,3058,2018-11-26 18:47:03,I just met Channeler Yanny 
1494,2500,3059,2018-11-26 18:47:01,I found this shiny Chansey today. I also ran from this shiny Chansey cause I'm sick of seeing Chansey on EVERY ROUTE! My Farfetch'd chain is worth more than this crap. 
1495,2502,3061,2018-11-26 18:46:50,Pokmon Let's GO! Yellow Version8am Pacific every  Tuesday  Wednesday  Thursday  Fridayon YouTube  
1496,2503,3062,2018-11-26 18:46:50,Has anyone got Eevee looking to for the Pikachu edition exclusive and other future trades?'
1497,2504,3063,2018-11-26 18:46:45,rip le mewto 
1501,2516,3075,2018-11-26 18:45:28,aaaaand evolved 
1502,2518,3077,2018-11-26 18:45:26,"So this happens when you take Snorlax out of his pokeball, so cute       "
1503,2520,3079,2018-11-26 18:45:23,YOOO!!! Two shinies in two hours?? 
1504,2522,3081,2018-11-26 18:45:14,Remember in Pokemon Yellow where you just beat the shit out of this Marowak instead 
1505,2523,3082,2018-11-26 18:45:13,A big boy 
1506,2526,3085,2018-11-26 18:45:07,If youve been waiting to purchase now is your chance to get it at a really great price! 
1507,2527,3086,2018-11-26 18:44:58,got my shiny jolteon!!! 
1508,2531,3090,2018-11-26 18:44:20,first shiny in 
1509,2535,3094,2018-11-26 18:43:42,Soundtrack of the day? 2 B A Master!What's your favorite tune? I'm partial to the original Pokerap too.
1510,2540,3099,2018-11-26 18:43:25,Lorelei is hot and also awesome. 
1512,2548,3107,2018-11-26 18:42:43,i wanna die  ... i failed.......... 
1514,2552,3111,2018-11-26 18:42:07,siiiiick 
1515,2553,3112,2018-11-26 18:42:06,Got me a shiny bird :3 
1518,2560,3119,2018-11-26 18:41:35,"Live Now. With Pokedex completed, it's time to start hunting for all of the Shineys! "
1519,2562,3121,2018-11-26 18:41:31,My good friend is live challenging the in (click this link below &amp; re-tweets appreciated)
1520,2566,3125,2018-11-26 18:41:03,These stats in this level feels unnatural... 
1521,2568,3127,2018-11-26 18:41:01,Woah 
1522,2570,3129,2018-11-26 18:40:44,lol finally 
1523,2578,3137,2018-11-26 18:40:09,Time to farm some shiny Pokmon now I guess 
1524,2581,3140,2018-11-26 18:40:01,"Where to find Red, Blue and Green in "
1525,2585,3144,2018-11-26 18:39:46,HORARI DISSABTE:Stage 115:30 (((PS4)20:30 Fase Bonus  + Entrega Premis 1.Stage 216:30 ( por Parejas18:00 / (Switch)'
1527,2590,3149,2018-11-26 18:38:48,Big mood 
