,Unnamed: 0,Unnamed: 0.1,date,text
3784,6622,7181,2018-11-26 04:59:35,"hecken rad dude, thanks for all the sets!!! "
3786,6624,7183,2018-11-26 04:59:03,Having a BLAST with this game thus far 
3787,6625,7184,2018-11-26 04:58:58,Can anyone trade me a Gengar on 
3788,6626,7185,2018-11-26 04:58:39,So. Many. Cubone. 
3789,6627,7186,2018-11-26 04:58:39,"(USA) 8085 2092 3008 Please help a Solo player I'm currently level 37 and I play mainly alone I Work in retail so I won't be able to play much till the third week of January due to Christmas. I can mass gift back about 1-2 days a week till my schedule lightens up"""
3792,6630,7189,2018-11-26 04:58:15,Ok so hear me out Johto dlc for but the catch you have to start from scratch like in the anime. And to make it less complicated you get a new eevee or pikachu partner. 
3793,6631,7190,2018-11-26 04:58:11,picked up letsgo for a couple mins and immediately found this blueberry THERE GOES MY EEVEE CHAIN 
3794,6632,7191,2018-11-26 04:58:09,HORN DRILL SPAMMING ASSHOLE FUCK YOU 
3795,6633,7192,2018-11-26 04:57:59,New streaming schedule for this week up barely before Monday  IT COUNTS!  LOVING Pikachu and I'll be streaming with and on Wednesday!  
3796,6634,7193,2018-11-26 04:57:37,PACK RIP!! &lt;&lt;@youtubert'
3798,6639,7198,2018-11-26 04:57:07,story of my life 
3799,6641,7200,2018-11-26 04:56:48,Super excited for Mondays stream. Going to finish off Minish Cap then straight into Pokemon Let's Go Pikachu! I bought it today and will somehow hold myself from playing it until tomorrow. Stream will start sometime between 8/10pm EST. 
3800,6642,7201,2018-11-26 04:56:43,a family 
3801,6644,7203,2018-11-26 04:56:29,I failed this shiny earlier today 
3802,6648,7207,2018-11-26 04:56:06,It's just nice to know that after a long day at work this is what's waiting for me 
3803,6649,7208,2018-11-26 04:55:43,Just completed 
3804,6650,7209,2018-11-26 04:55:33,And another one 
3805,6652,7211,2018-11-26 04:55:16,Sassy nature be like... 
3806,6653,7212,2018-11-26 04:54:47,more vee cuteness 
3807,6654,7213,2018-11-26 04:54:37,Got it! 
3808,6655,7214,2018-11-26 04:54:34,"Need more best friends, here's my code.  Colorado, USA. "
3809,6657,7216,2018-11-26 04:54:24,look at the total number caught in the top right corner  
3811,6660,7219,2018-11-26 04:53:56,"Does a bug ever fly in and everyone is like, ""kill it,"" but you\'re vegan so that make you a master pokemon trainer so you catch it and let it out before there\'s a huge rucous? No jus\' me? "
3812,6661,7220,2018-11-26 04:53:43,Wasn't sure which one to get 
3813,6664,7223,2018-11-26 04:52:40,Time innovations needed to reach 50 mln users (in years) 
3814,6665,7224,2018-11-26 04:52:38,I am very mature. 
3815,6667,7226,2018-11-26 04:52:04,"First shiny! Terrible stats and nature, but still pretty sweet. "
3817,6672,7231,2018-11-26 04:50:59,Gamers rise up 
3818,6673,7232,2018-11-26 04:50:58,Shiny Ninetails with 4/6 perfect IV's... Very happy to say the least :) 
3819,6675,7234,2018-11-26 04:50:42,Trying to get shiny Growlithe and this motherfucker shows up 
3821,6677,7236,2018-11-26 04:50:26,That's a guy. From tip to toe that's a dude 
3823,6680,7239,2018-11-26 04:49:40,Eevee from has cured me of my depression and in exchange given me diabetes cuz of how sweet it is.'
3824,6682,7241,2018-11-26 04:49:23,Starting a Living Dex playthrough of on Twitch
3826,6685,7244,2018-11-26 04:48:58,Was chasing a shiny rhyhorn and didn't get it. ended up with one that was 6iv and used all those candies on it. Here's the result 
3827,6686,7245,2018-11-26 04:48:46,Sad times 
3828,6688,7247,2018-11-26 04:48:26,My first shiny in Let's Go is this beauty! I have wanted a shiny Ponyta for so long! 
3829,6689,7248,2018-11-26 04:48:21,I defeated the league yesterday. 
3831,6692,7251,2018-11-26 04:47:41,Why do people care about the shiny odds so much? Just play the game and search for a shiny if you want. Any slight deviation in the odds (even though the correct odds have been proven) will make little to no difference in how long it takes to find a shiny. 
3832,6693,7252,2018-11-26 04:47:39,*in the game 
3833,6695,7254,2018-11-26 04:47:27,hey bitch 
3834,6697,7256,2018-11-26 04:47:05,Pichi 
3835,6698,7257,2018-11-26 04:47:00,When you're playing and a Shiny Tangela ran before you use the Master Ball on it 
3836,6699,7258,2018-11-26 04:46:55,It's about time we got legendary encounter cutscenes of this caliber. 
3837,6700,7259,2018-11-26 04:46:52,About time! Just need some bottle caps.... 
3838,6701,7260,2018-11-26 04:46:46,"12 Plays Pikachu!We froze our asses off for 5 hours waiting in line at so if you want to watch a vlog-style retelling of the event, the unboxing of all the goodies &amp; the game, check it out! "
3839,6703,7262,2018-11-26 04:46:03,my heart 
3840,6705,7264,2018-11-26 04:45:53,"Get the 11 places in the Kanto Map for Pokemon: Let's Go, Pikachu! and Let's Go, Eevee! and the differences between the old and new map. "
3841,6711,7270,2018-11-26 04:45:10,phew 
3842,6713,7272,2018-11-26 04:44:55,I could of used this money on something else aaa 
3844,6716,7275,2018-11-26 04:44:43,Dallas shiny fail from tonight! Tangela was the one who got away! 
3845,6717,7276,2018-11-26 04:44:42,Lance 
3846,6719,7278,2018-11-26 04:44:30,I have acquired one of them Shiny-mon the kids are all talking about. 
3848,6722,7281,2018-11-26 04:44:11,Exhilarating 
3849,6723,7282,2018-11-26 04:43:36,Meltan is Mythical... so why can I put it on gyms? 
3850,6724,7283,2018-11-26 04:43:06,My little eevee is so cute with her little bows  
3851,6725,7284,2018-11-26 04:42:55,DRAMA IN ROUND 2!!! CONGRATULATIONS to for winning Round 2 in such an exciting fashion! Shoutout to for nearly winning Round 2 with the Shiny Tangela 
3852,6726,7285,2018-11-26 04:42:51,Giovanni down for the count Encounter 
3853,6728,7287,2018-11-26 04:42:44,2 badges left. 
3854,6729,7288,2018-11-26 04:42:34,I feel valid 
3856,6731,7290,2018-11-26 04:42:04,was I just given a stolen item 
3858,6734,7293,2018-11-26 04:41:42,"After 22 resets!!, such a relief "
3859,6735,7294,2018-11-26 04:41:33,THIRD SHINY! This one was a grind 
3860,6737,7296,2018-11-26 04:41:20,WE DID IT BOYS 
3861,6738,7297,2018-11-26 04:41:16,Now that is over. Back to it with 
3862,6739,7298,2018-11-26 04:41:00,Shiny hunting just got real!....... 
3863,6740,7299,2018-11-26 04:40:44,When that Shiny Tangela ran before you use the Master Ball on it in 
3864,6741,7300,2018-11-26 04:40:07,"""draw me like one of your kalos girls"" "
3865,6745,7304,2018-11-26 04:39:37,Check out this video so you know when a Pokmon is going to run away and break your chain!!! 
3866,6748,7307,2018-11-26 04:39:05,I haven't even started any chain at all and this fkers want me to chain'em 
3867,6749,7308,2018-11-26 04:39:04,a good team 
3869,6751,7310,2018-11-26 04:38:50,FUCK THIS GAME 
3870,6753,7312,2018-11-26 04:38:41,Eevee is the cutest change my mind. 
3871,6754,7313,2018-11-26 04:38:30,He too tubby 
3872,6755,7314,2018-11-26 04:38:29,My winning cut scene in let's go i love it &lt;3 &lt;3 &lt;3 
3873,6756,7315,2018-11-26 04:37:45,The shiny hunts continues 
3874,6759,7318,2018-11-26 04:37:17,She's so daper 
3877,6763,7322,2018-11-26 04:36:07,AFTER 2 FAILED ATTEMPTS. TIMID WITH NO ULTRA BALL BITCH IM SCREAMING. WORTH 3 HOURSSS 
3879,6765,7324,2018-11-26 04:35:49,"5 shiny pokemon today. Got my 3rd shiny Zubat, my 2nd shiny Graveler, a shiny Pidgey, and these two. "
3880,6766,7325,2018-11-26 04:35:40,Someone has to animate all the outlandish and terrible things we as a community have come up regarding that backstabbing double agent Ms. Thing and her shady ways...
3881,6767,7326,2018-11-26 04:35:40,DETECTIVE EEVEE IS ALREADY ON THE CASE TYVM! 
3882,6768,7327,2018-11-26 04:35:35,success 
3883,6769,7328,2018-11-26 04:35:31,Only took about 15 hours but omg I got one! I can't finally play another game on my switch! 
3884,6770,7329,2018-11-26 04:35:08,Check out Let's go Eevee! Part 1 
3885,6771,7330,2018-11-26 04:35:01,Trying... To find... Shiny Eevee... 
3886,6772,7331,2018-11-26 04:34:55,i did that 
3887,6773,7332,2018-11-26 04:34:27,"Sure, this seems respectful "
3888,6775,7334,2018-11-26 04:34:04,"All gym badges, beat the Elite Four and completed the Pokedex. "
3890,6778,7337,2018-11-26 04:33:31,Who got a with a eevee? Trying to complete my dex 
3892,6782,7341,2018-11-26 04:33:10,FUCK OFF 
3893,6783,7342,2018-11-26 04:33:05,I Finnaly got my shiny puppo ( growlith)  in im so happy now 
3895,6786,7345,2018-11-26 04:33:02,HOLY SHIT I GOT A SHINY RAPIDASH WITH NO CATCH COMBOOOOO 
3896,6787,7346,2018-11-26 04:32:59,Random as fuck shiny 
3897,6788,7347,2018-11-26 04:32:51,Don't you forget it Mr.!!!! Winner is me!!! 
3898,6789,7348,2018-11-26 04:32:47,First shiny I've caught in 
3899,6790,7349,2018-11-26 04:32:18,"As an F2P player, and with dividing my game time, I'm just glad I got the golden epithet and the twinkling sands. Good thing this banner wasn't as attractive as last time so I'm saving my banner for the next one "
3900,6792,7351,2018-11-26 04:32:03,"Well not a shiny Vulpix, but it will do to end the night. Back to Vulpix comboing tomorrow "
3901,6793,7352,2018-11-26 04:32:00,It's Pay Your Respects To Dead Pokmon day 
3902,6794,7353,2018-11-26 04:31:41,gender affirmation 
3903,6795,7354,2018-11-26 04:31:36,green 3 borb 
3904,6796,7355,2018-11-26 04:31:31,excuse me? 
3905,6798,7357,2018-11-26 04:31:02,Shiny jigglypuff caught on stream while on a combo 12 for growlithe! 
3906,6799,7358,2018-11-26 04:31:00,better than my uwi degree 
3907,6801,7360,2018-11-26 04:30:36,you suggesting i break the law?...IM IN! 
3908,6802,7361,2018-11-26 04:30:00,"If you didn't snag the Poipole Legendary code, here's one of my spares. First come, first serve. "
3910,6804,7363,2018-11-26 04:29:35, best friends 
3911,6806,7365,2018-11-26 04:29:23,My boyfriend left his switch and Pokemon at my house the week before finals...I thought he loved me. Why would he sabotage me this way?!  
3912,6807,7366,2018-11-26 04:28:59,Even after I won they still wanted to fight. It's a good thing I have Eevee at my side to protect me 
3914,6809,7368,2018-11-26 04:28:35,That's right. 
3916,6811,7370,2018-11-26 04:28:27,my awesome team so far! 
3917,6812,7371,2018-11-26 04:28:23,A couple nights ago I lost my first ever shiny (ponyta). REDEMPTION!!! 
3918,6813,7372,2018-11-26 04:28:17,SHINY GASTLY YEAHHHHHH!!! TURN MY SWAG ON BROS!!! 
3919,6814,7373,2018-11-26 04:28:11,Shinies from the last two nights! Just caught Pidgey. 
3921,6816,7375,2018-11-26 04:28:00,tail waggle!! 
3922,6817,7376,2018-11-26 04:27:56,Told y'all. This my house son 
3923,6818,7377,2018-11-26 04:27:45,Isn't that just... cheating? 
3924,6823,7382,2018-11-26 04:27:12,"You can expect the following:reallly digging this variety streaming thing, and I hope you all are too! '"
3926,6825,7384,2018-11-26 04:27:06,NICE 
3927,6826,7385,2018-11-26 04:27:03,This game is great. 
3928,6827,7386,2018-11-26 04:26:51,I never knew I needed the ability to ride on a Starmie until this exact moment 
3929,6830,7389,2018-11-26 04:26:49,don't talk to me or my son ever again 
3930,6831,7390,2018-11-26 04:26:43,Bouta smoke this punk 
3931,6833,7392,2018-11-26 04:26:32,Been curious on how Alolan Exeggutor would lookoutside in Pokemon Let's Go. RIP 2nd floor.   
3932,6834,7393,2018-11-26 04:26:27,two hot ladies show up next to you. what do you do? 
3933,6835,7394,2018-11-26 04:26:24,chai looks like a pika lesbian and i love her 
3934,6836,7395,2018-11-26 04:26:09,my way to grab some golden berries from Cerulean Cave I spotted some shine in the water 
3935,6837,7396,2018-11-26 04:26:09,I still get a kick out of seeing a Dragonite's shadow fly past me in 
3936,6839,7398,2018-11-26 04:26:02,"The man, the myth, the legend. "
3937,6840,7399,2018-11-26 04:26:01,4th shiny today 
3938,6841,7400,2018-11-26 04:25:46,There he is 
3939,6842,7401,2018-11-26 04:25:43,Am I hardcore yet 
3941,6844,7403,2018-11-26 04:25:40,going to battle celadon gym and i show the person my vee 
3942,6845,7404,2018-11-26 04:25:39,"Based on reports from Adobe, Pokemon Lets Go Pikachu and Eevee was the best selling video game on Black Friday and one of the top 5 (no.4) selling products in general on that day.Source:"
3943,6846,7405,2018-11-26 04:25:31,It's time for some well deserved payback! Eevee is super fired up too! 
3944,6849,7408,2018-11-26 04:25:00,i cant stop playing pokmon go please add me!!  my Trainer Code is 6325 0429 8658  
3945,6851,7410,2018-11-26 04:24:28,"We did it, Yuki! "
3946,6852,7411,2018-11-26 04:24:24,big mood 
3947,6853,7412,2018-11-26 04:24:05,she likes arcade games! we have something in common 
3948,6855,7414,2018-11-26 04:23:49,"Nothin' personnel, kid "
3949,6856,7415,2018-11-26 04:23:19,Eevee managed to climb up there to get the Lift Key. I had to catch her when she jumped down though 
3950,6857,7416,2018-11-26 04:22:53,First shiny of the day 
3951,6858,7417,2018-11-26 04:22:52,Not sure if Pikachu is digging his new outfit... 
3952,6859,7418,2018-11-26 04:22:40,wtf i was playing and out of nowhere this little boy materialized 
3953,6860,7419,2018-11-26 04:22:33,WHY DOES HE LOOK SO PISSED 
3954,6863,7422,2018-11-26 04:21:55,finally got my main party together! took all day to get a shiny ponyta lmao. now to start silph co :-) 
3955,6864,7423,2018-11-26 04:21:55,New rival same name. 
3956,6865,7424,2018-11-26 04:21:49,"Just realized if I catch these from Go Park, I can technically now trade with friends online via (even though pokemon will stay in the switch)... But the amount of shinies...'"
3957,6866,7425,2018-11-26 04:21:35,no regrets 
3959,6868,7427,2018-11-26 04:21:24,Hi I'm in love with my baby  
3960,6870,7429,2018-11-26 04:21:21,Finally got it!! 
3961,6872,7431,2018-11-26 04:20:38,no stream everyone. I need the rest. I havnt gotten any correct sleep since pokemon lets go release :) Thanks for tuning into all the streams ive been doing everyone! 
3962,6873,7432,2018-11-26 04:20:33,We were following the Rockets to Cubone but this bonehead just ruined all our effort. Eevee seems to have an idea though... 
3963,6874,7433,2018-11-26 04:20:25,just need 12 more pokemon to complete my dex in !! Mostly missing pikachu exclusives + pinsir!'
3964,6876,7435,2018-11-26 04:20:16,Connecting Pokemon Go to the switch was a nightmare but I finally got it working &amp; transferred!! 
3965,6877,7436,2018-11-26 04:20:13,"Once again, full odds "
3966,6878,7437,2018-11-26 04:20:09,What the ........... 
3967,6879,7438,2018-11-26 04:19:33,Hope you guys are ready for the return of on this Tuesday!
3969,6883,7442,2018-11-26 04:19:02,I love this 
3971,6885,7444,2018-11-26 04:18:56,FINE I'LL TAKE THE SHITTY RAT I AM SO DONE WITH CHARMANDER 
3972,6886,7445,2018-11-26 04:18:50,prickly diglett!!!! 
3973,6887,7446,2018-11-26 04:18:38,Shiny Vulpix!!!  
3975,6894,7453,2018-11-26 04:17:27,Like this 
3977,6902,7461,2018-11-26 04:16:17,Ohh.. a repeat shiny... thanks?! Its good but I was unting for something else lmao. It happened arounCC 12. 
3978,6904,7463,2018-11-26 04:16:08,Leveling is hard... 
3979,6908,7467,2018-11-26 04:15:29,Chaining for squirtle got pidgey 3 chains in  
3980,6909,7468,2018-11-26 04:15:26,pokmon game I've ever played and I'm lovin' it! &lt;3 
3982,6911,7470,2018-11-26 04:15:10,combo catches work! :o 
3983,6912,7471,2018-11-26 04:15:10,I did it. 
3984,6916,7475,2018-11-26 04:14:57,...THAT'S your mega? really? 
3985,6919,7478,2018-11-26 04:14:31,Never to late to cop some heat 
3986,6920,7479,2018-11-26 04:14:22,Got it all set up and should be putting out a video this week hopefully Im currently on a 10 hr + hunt for a shiny charmander 
3987,6921,7480,2018-11-26 04:14:09,"Huzzah, Snorlax is mine!! "
3989,6925,7484,2018-11-26 04:13:35,Week 2.How many Meltan have you catch (?) 
3990,6926,7485,2018-11-26 04:13:09,Youngster: FUCK YOU MY SHORTS ARE GUCCI 
3991,6927,7486,2018-11-26 04:12:45,POSTGAME TIME 
3992,6929,7488,2018-11-26 04:12:41,Moments before the beatdown...  
3993,6930,7489,2018-11-26 04:12:35,Finally! After 6 hours of waiting and a chain of 464! 
3994,6931,7490,2018-11-26 04:12:34,What is my luck 
3995,6932,7491,2018-11-26 04:12:17,holy shinx! shiny freaking snorlax!! 
3996,6938,7497,2018-11-26 04:11:57,I'm King of the Worms! 
3997,6941,7500,2018-11-26 04:11:33,A dangerous man of power  
3998,6942,7501,2018-11-26 04:11:29,Dragonite's shiny is just Charizard's Gen 2 shiny inverted.
3999,6943,7502,2018-11-26 04:11:24,I caught them all! 
4000,6945,7504,2018-11-26 04:11:14,"Oh! As an update, since many folks came by my supah secret bonus strim tonight to ask - I *did* get my shiny Vulpix! Happened this morning, off-stream. Spent a total of ~10.5hrs waiting for it, including Saturdays stream time. Now Im up to 3 total shinies!  "
4003,6949,7508,2018-11-26 04:10:44,"Managed to actually snag Diglett before bed, yay "
4004,6950,7509,2018-11-26 04:10:42,my first two shinies in 
4005,6951,7510,2018-11-26 04:10:37,moves are OP
4006,6952,7511,2018-11-26 04:10:35,Well stream ended with us getting 150 catch combo on gastly. Still not shiny. We passed the stream off to who is playing Pikachu for the first time. Hope he has as much fun with the game as I have.'
4007,6954,7513,2018-11-26 04:10:03,"This always made me cry in the GB originals. 20+ years later, it still does. Poor Cubone. "
4008,6956,7515,2018-11-26 04:09:34,pokedex.
4009,6957,7516,2018-11-26 04:09:34,Omg a second gold magikarp I had to run from. 2 shiny magikarp in like a 15 min span 
4010,6960,7519,2018-11-26 04:09:18,He so tiny! 
4012,6962,7521,2018-11-26 04:09:10,hand over the snorlax and nobody has to get cursed today 
4013,6964,7523,2018-11-26 04:09:07,got the best badgeb 
4014,6965,7524,2018-11-26 04:09:05,"My collection is slowly growing. I'm really pleased with the new shiny mechanics. Still tedious to hunt, but much more streamlined than hatching 8213089128409 eggs. The nidoran ended up going to my sister :&gt; "
4015,6967,7526,2018-11-26 04:08:52,ABSOLUTELY NOT 
4016,6970,7529,2018-11-26 04:08:34,Sidebar: Its not gonna get any better than putting Mistys abusive ass in her place and snatching that Cascade Badge. 
4017,6971,7530,2018-11-26 04:08:33,Never change you creepy SOB 
4019,6979,7538,2018-11-26 04:07:55,It's crowded in here. I think the max spawn is 8? 
4020,6982,7541,2018-11-26 04:07:52,My current  progress!  
4021,6983,7542,2018-11-26 04:07:52,Seafoam Island is a strange place...I didn't expect to almost drown only to be saved by Eevee and then spin to safety 
4022,6988,7547,2018-11-26 04:07:25,THIS SHINY BOY APPEARED OUT OF NOWHERE IN THE FOREST AHHHHHH 
4023,6990,7549,2018-11-26 04:06:59,a moment in history 
4024,6991,7550,2018-11-26 04:06:29,"I'm the Champion, boiiiiis c: "
4028,6999,7558,2018-11-26 04:05:43,SHINY GEODUDE!!! (ft. a very rude Paras) 
4031,7003,7562,2018-11-26 04:05:32,my doodoo son 
4032,7005,7564,2018-11-26 04:05:16,6 badges 
4033,7006,7565,2018-11-26 04:05:15,Dr. Blaine has been the gym leader with whom I have had fun the most so far 
4034,7007,7566,2018-11-26 04:05:10,Blasting off again! 
4035,7010,7569,2018-11-26 04:04:50,oh hey 
4036,7012,7571,2018-11-26 04:04:20,"Forgetting Blue\'s name was meant to be a ""grandpa joke"" all along?? LMAOOOOO "
4037,7013,7572,2018-11-26 04:04:19,3rd shiny so far :D 
4039,7018,7577,2018-11-26 04:03:34,it's about time! 
4040,7019,7578,2018-11-26 04:03:26,"Flying!, but how do you land?  "
4042,7026,7585,2018-11-26 04:02:30,finally!!!! 
4043,7027,7586,2018-11-26 04:02:24,working on getting this big blue shiny boy continuing through the story [blind] afterwards! 
4044,7029,7588,2018-11-26 04:02:11,Part 5 
4045,7031,7590,2018-11-26 04:01:32,time to show her what's up 
4046,7032,7591,2018-11-26 04:01:21,Part 4 
4047,7033,7592,2018-11-26 04:01:17,pikachu seemed excited 
4048,7034,7593,2018-11-26 04:01:13,"After hours of hunting,i finally found this bad boy "
4049,7035,7594,2018-11-26 04:01:09,I'm really good at attracting the shinies I'm not hunting. I'll have my green mime someday.
4051,7037,7596,2018-11-26 04:00:59,My first random shiny in the game! 
4052,7039,7598,2018-11-26 04:00:52,"Eevee is now sitting on my head wearing the same hat as me, this is an extremely important feature.  "
4053,7040,7599,2018-11-26 04:00:50,Part 3 
4054,7044,7603,2018-11-26 04:00:08,It only took 8?!                                                  
4055,7045,7604,2018-11-26 04:00:02,I actually acomplished something! 
4056,7046,7605,2018-11-26 03:59:29,Shout out to the bone smuggler that just had a Zippy Zap Raichu in .'
4057,7047,7606,2018-11-26 03:59:17,"Best of luck with your eventual full odds Dragonite hunt, Just got mine, but it's charm &amp; combo boosted... "
4058,7048,7607,2018-11-26 03:59:17,BASK IN THE GLORY OF ALL MY EEVEE        MOWHAHAHAHA &gt;:} 
4059,7049,7608,2018-11-26 03:59:11,"It wasn't me, Lady "
4060,7051,7610,2018-11-26 03:59:02,SHINYYYYYYYYYYY 
4061,7055,7614,2018-11-26 03:58:02,LETS FUCKIN GOOOOOOOOO 
4062,7056,7615,2018-11-26 03:57:54,im so proud of these bitches 
4063,7057,7616,2018-11-26 03:57:37,"Tried looking into whether Pikachu's Zippy Zap move was busted/OP in &amp; ended up down a rabbit hole of threads where people really break down Pokmon piece by piece. Stuff is over my head, but awesome that it can actually get to that level of playing."""
4064,7058,7617,2018-11-26 03:57:24,Part 2 
4065,7059,7618,2018-11-26 03:57:17,I LOVE HER 
4066,7060,7619,2018-11-26 03:57:15,"When your first chansey catch is a huge one. Holy buckets, that's a ton of experience. "
4067,7061,7620,2018-11-26 03:57:10,For the fake MGS stan 
4068,7062,7621,2018-11-26 03:57:08,Streaming Pokemon: Let's Go Pikachu! Doing a Shiny Badge Quest! Come say hi! :D 
4069,7063,7622,2018-11-26 03:57:04,this is my team for let's go pikachu 
4071,7065,7624,2018-11-26 03:56:57,This is too cute 
4072,7067,7626,2018-11-26 03:56:08,Time to work on my all Dragonite team :)
4073,7068,7627,2018-11-26 03:55:58,Time to add to the wildlife of some more chill up top with me and catch all the goodness now at 
4074,7069,7628,2018-11-26 03:55:56,"Vulpix...Vulpix, not now! Not in Lavender Town! "
4075,7071,7630,2018-11-26 03:54:55,Finally... 
4076,7072,7631,2018-11-26 03:54:45,So far Im at 128 and counting and still no shiny growlirhe 
4077,7073,7632,2018-11-26 03:54:36,YOOOOOOOOOOOOOOOOOOOOOOOOOOOOOOOOOOOOOOOO IT FINALLY WORKSSSSSS I GOT ONE OF MY BABIES OVER!!! 
4078,7074,7633,2018-11-26 03:54:11,What... 
4079,7075,7634,2018-11-26 03:54:07,Poofy princess~ 
4080,7076,7635,2018-11-26 03:54:06,Part 1 
4082,7079,7638,2018-11-26 03:53:33,Yeah. He did. He really did. 
4083,7082,7641,2018-11-26 03:53:09,"Vulpix, teach me your teleporting secrets! "
4086,7086,7645,2018-11-26 03:52:19,"Thankfully, unlike the last one i saw it didn't run away before I caught it "
4087,7087,7646,2018-11-26 03:52:10,"I'll get a shiny soon, right? "
4088,7088,7647,2018-11-26 03:52:02,thickumss 
4089,7089,7648,2018-11-26 03:52:02,"Ladies and gentlemen, we got him. "
4090,7091,7650,2018-11-26 03:51:46,Weird Cat 
4091,7093,7652,2018-11-26 03:51:25,"""Fighting type"" "
4092,7094,7653,2018-11-26 03:51:18,Watch GoTenks1 with me on Twitch! 
4093,7095,7654,2018-11-26 03:51:14,Headbutt 
4094,7096,7655,2018-11-26 03:51:12,Rideable Haunters 
4095,7097,7656,2018-11-26 03:51:08,"Typically, I hate the extra hand-holding in the newer games, but I'm really liking this fast travel. "
4097,7100,7659,2018-11-26 03:50:34,Now we're talkin' 
4098,7102,7661,2018-11-26 03:50:28,blep in the dark 
4099,7103,7662,2018-11-26 03:50:17,THAT'S A LOT OF PIKACHU 
4100,7104,7663,2018-11-26 03:49:57,this game is so cute 
4101,7107,7666,2018-11-26 03:49:40,ow oof ow! green you are a crazy gal 
4102,7108,7667,2018-11-26 03:49:32,ball pls 
4103,7109,7668,2018-11-26 03:49:24,"Dang it, I caved in. "
4104,7111,7670,2018-11-26 03:49:14,eevee is a smug girl 
4105,7112,7671,2018-11-26 03:49:07,I was chaining Chansey and found this- I'll take it! 
4106,7114,7673,2018-11-26 03:48:59,When she wasn't expecting those huge pokeballs. 
4107,7115,7674,2018-11-26 03:48:57,WOW LETS SHINY HUNT AND BATTLE RADOS ONLINE! 
4108,7116,7675,2018-11-26 03:48:35,Finally caught a Shiny Pikachu 
4109,7117,7676,2018-11-26 03:48:30,I had to break my geodude combo for this 
4111,7119,7678,2018-11-26 03:48:11,highly disappointed 
4114,7122,7681,2018-11-26 03:47:36,Pretty birdie 
4115,7124,7683,2018-11-26 03:47:13,I WON!!!!  and its all thanks to Bella!!! 
4116,7125,7684,2018-11-26 03:47:07,New wallpaper 
4117,7126,7685,2018-11-26 03:47:07,henlo ow! 
4118,7127,7686,2018-11-26 03:47:00,"Lol, I'm having more fun with this game than I did with Gens 6 and 7. "
4119,7129,7688,2018-11-26 03:46:16,Shiny Dratini!! 
4122,7132,7691,2018-11-26 03:45:52,Took me a while to get this so I'll keep it for now 
4123,7133,7692,2018-11-26 03:45:48,"you ever read their pokedex entries? ghost pokemon ARE scary"" "
4125,7135,7694,2018-11-26 03:45:34,"SuperSonic, even as a magikarp you still try to be quick and nimble. "
4126,7137,7696,2018-11-26 03:45:27,tort 
4128,7139,7698,2018-11-26 03:45:19,This is what happens when you try to shiny hunt. 
4129,7140,7699,2018-11-26 03:45:16,I just want a shiny vulpix  Patience is a virtue. Taking a break and continuing the story. 
4132,7143,7702,2018-11-26 03:45:07,another shiny! 
4133,7144,7703,2018-11-26 03:44:57,Mood 
4134,7145,7704,2018-11-26 03:44:49,My eevee is a cop. Names gatoraid by the flavors 
4135,7147,7706,2018-11-26 03:44:27,Time for the Elite Four! The ultimate challenge foral- WHY DO YOU ONLY HAVE FIVE POKEMON?!? 
4136,7148,7707,2018-11-26 03:44:20,FINALLY caught you 
4138,7150,7709,2018-11-26 03:44:01,Nothing. NOTHING! 
4139,7152,7711,2018-11-26 03:43:47,my first shiny! 
