,Unnamed: 0,Unnamed: 0.1,date,text
4430,11944,80670,2018-11-20 12:56:09,What it's like to hunt Lapras in the wild. :) 
4431,11945,80671,2018-11-20 12:56:05,Honey is so cute! 
4432,11959,80685,2018-11-20 12:55:07,Now Live playing some 
4433,11964,80690,2018-11-20 12:54:55,nani the fuck ?_?
4434,11971,80697,2018-11-20 12:54:29,Thank you so Gosh Darn much for another amazing stream!&amp; So much love whilst playing We threw the love back over to BobbyJ for his Freakshow Battle Royale'
4435,11976,80702,2018-11-20 12:53:41,Got my first shiny and it's an ugly ass Fearow. :( 
4437,11981,80707,2018-11-20 12:53:18,holy shit what??? 
4438,11983,80709,2018-11-20 12:53:14,That 500 pokdollar investment finally paid out! Gyarados before the third gym! 
4439,11985,80711,2018-11-20 12:53:12,Trying to figure out WHY THE FUCK will NOT connect with my and I paired BOTH of them up via Bluetooth they did communicate but they seem unable to initiate the transfer process as I want to it to do.UUUGGHH!'
4440,11986,80712,2018-11-20 12:53:08,Really hope noone saw me petting my Pikachu on tnis train 
4441,11988,80714,2018-11-20 12:52:47,Dig the paint-covered outfit. 
4442,12001,80727,2018-11-20 12:52:16,Shiny Squirtle is my 4th Shiny for my Eevee shiny lock run. So happy right now! :D 
4443,12004,80730,2018-11-20 12:52:09,I'm ready... 
4444,12006,80732,2018-11-20 12:52:07,DAMN! I put THAT MANY hours into this game already? I guess thats what addiction and shiny hunting do to me 
4445,12009,80735,2018-11-20 12:51:54,"Raichu's little waddle has to be the cutest thing ever.Also, look how long that tail is!?Vid description: An in-game video of a female character running around with a large gold and brown mouse type Pokmon waddling behind them. "
4446,12010,80736,2018-11-20 12:51:53,I put on my Slender Man mask and it looked so weird while playing Pokmon lol 
4447,12019,80745,2018-11-20 12:51:08,I love my little Eevee 
4450,12035,80761,2018-11-20 12:50:08,I must protect her at all costs &lt;3 
4452,12042,80768,2018-11-20 12:49:30,U bet i do 
4453,12045,80771,2018-11-20 12:49:00,Lucky number 210 
4454,12046,80772,2018-11-20 12:48:59,Cuties 
4455,12048,80774,2018-11-20 12:48:49,A Rhydon spawned under me as I was picking up an item and now this 
4456,12051,80777,2018-11-20 12:48:41,i is cute bich 
4460,12063,80789,2018-11-20 12:48:00,Ya damn right 
4463,12075,80801,2018-11-20 12:47:22,Having too much fun adding text part 6. 
4464,12078,80804,2018-11-20 12:47:12,"Sigh, this guy broke my bulbacombo "
4465,12081,80807,2018-11-20 12:46:45,"[Review] From to motion control issues, to Mastering the and experiencing once more, Mike and Jack cover it all and go into extensive detail with their joint DEFINITIVE review of on "
4466,12083,80809,2018-11-20 12:46:43,"I think is worth picking up regardless.  I'm enjoying it a lot"""
4467,12091,80817,2018-11-20 12:46:02,No reward for 1000 
4468,12095,80821,2018-11-20 12:45:45,LOOK AT THIS LITTLE SQUISH 
4471,12115,80841,2018-11-20 12:44:24,Time to farm some gold!Play time: 47:30Money: $61
4472,12116,80842,2018-11-20 12:44:23,"Just about 10 hours to go for the poll for our first Affiliate stream! You guys REALLY want to see me nerd out to some more so far, but there's still time left for something else to come from behind! "
4474,12128,80854,2018-11-20 12:43:34,I love Lapras 
4476,12131,80857,2018-11-20 12:43:17,When you need to complete the dex I'm pokemon lets go eevee and pikachu but you can't afford the pokeball to get mew  
4477,12135,80861,2018-11-20 12:42:38,shit yall never say 
4478,12138,80864,2018-11-20 12:42:26, L I V Ecatch up after and jump into Pikachu for the first time! Who's that pokemon? It'ssssss Mouse!
4479,12150,80876,2018-11-20 12:41:28,well rip nido chain 
4480,12157,80883,2018-11-20 12:41:04,Shiny vulpix whereeeee 
4481,12168,80894,2018-11-20 12:40:14,This is SO cool!! 
4482,12169,80895,2018-11-20 12:40:03,Fuck you and yo dragons bitch 
4483,12172,80898,2018-11-20 12:39:53,suspicious packagee 
4485,12180,80906,2018-11-20 12:39:23,"GameSpot ""Meltan is a new Mythical Pokemon, and you can catch one easily by linking Pokemon Go with Pikachu and Eevee! Here\'s how. "
4486,12186,80912,2018-11-20 12:38:55,Second shiny of Let's Go 
4487,12187,80913,2018-11-20 12:38:53,"Meddl, "
4488,12199,80925,2018-11-20 12:38:10,now on playing with my buddy Piers! Pop by and hang out!
4489,12203,80929,2018-11-20 12:37:57,I'm at Silph Co 
4491,12210,80936,2018-11-20 12:37:23,He looks it 
4492,12212,80938,2018-11-20 12:37:09,What did I just saw?
4494,12216,80942,2018-11-20 12:37:00,This is the coolest Gym I have EVER seen! 
4495,12220,80946,2018-11-20 12:36:52,All the Eevee! 
4496,12225,80951,2018-11-20 12:36:40,Surfing around looking for a shiny Krabby/Kingler so I can name it Tamatoa. 
4497,12226,80952,2018-11-20 12:36:37,My team so far. 
4498,12229,80955,2018-11-20 12:36:16,"Meltan is a new Mythical Pokemon, and you can catch one easily by linking Pokemon Go with Pikachu and Eevee! Here's how. "
4499,12230,80956,2018-11-20 12:36:13,I love this game 
4500,12235,80961,2018-11-20 12:35:57,"Well played sign, well played "
4501,12244,80970,2018-11-20 12:35:17,Oh no what is you doing my son?! 
4502,12248,80974,2018-11-20 12:35:05,So he's gonna eat my berry &amp; leave just like that... 
4503,12250,80976,2018-11-20 12:34:50,Can Eevee get any cuter 
4504,12255,80981,2018-11-20 12:34:18,Pokemon Lets Go - Day 4: Last night I beat the Elite 4 &amp; caught all 3 Legendary Birds. Today I will catch Mewtwo and the final 20 Pokemon for a complete Pokedex.GoTY!
4505,12286,81012,2018-11-20 12:31:55,running around with mew is the best 
4507,12290,81016,2018-11-20 12:31:42,About time -_-
4508,12299,81025,2018-11-20 12:31:01,I hate that Team Rocket member more than anyone! Get out of Princess's way! 
4509,12301,81027,2018-11-20 12:30:47,Girls are bullies :( 
4510,12302,81028,2018-11-20 12:30:44,"Going to give hunting a go, whats an easy to start off with for a newbie such as myself? "
4512,12308,81034,2018-11-20 12:30:16,This Rattata is probably not meant to be in the kitchen. 
4513,12310,81036,2018-11-20 12:30:08,Shiny Metapod in Let's Go ! Only took me 6 hours uh 
4515,12312,81038,2018-11-20 12:29:54,Nope 
4516,12315,81041,2018-11-20 12:29:37,Yeet 
4517,12316,81042,2018-11-20 12:29:33,Live on Pikachu and  City that Never Sleeps DLC today from 6ish         
4518,12318,81044,2018-11-20 12:29:25,I skipped all the trainers and went straight to seafoam island to get articuno xD. My fav part so far is Blue. I read the whole manga series so when I saw him I freaked out. The team aced his characterization! 
4519,12319,81045,2018-11-20 12:29:24,Thank YOU for making the game! 
4520,12323,81049,2018-11-20 12:28:56,"End of day 3, streak 423, still no shiny growlithes. Will persist @NintendoAmerica'"
4521,12324,81050,2018-11-20 12:28:53,RIP Psyduck! I'm so easily amused... a laugh from on 
4522,12325,81051,2018-11-20 12:28:53,Porygon is unsettling 
4523,12326,81052,2018-11-20 12:28:49,It's so strange seeing the anime intro recreated. Im glad they haven't forgotten about it!!
4525,12341,81067,2018-11-20 12:27:44,Not far behind the release of we've got hitting stores Dec 7th! With this many Exclusives my wallet is starting to look like this Gif!We've got loads of Editions and Merch alongside this release so pop in store and pre-order today! 
4526,12346,81072,2018-11-20 12:27:35,wtf is ever happening ever 
4527,12353,81079,2018-11-20 12:26:26,Paint me like one of your french girls 
4528,12355,81081,2018-11-20 12:26:24,Spot the twins! 
4529,12367,81093,2018-11-20 12:25:41,Oh Yeah! Finally post my 1st pic of Pokemon Lets Go Pikachu. She so cute.
4530,12370,81096,2018-11-20 12:25:32,Whoop! 
4531,12371,81097,2018-11-20 12:25:31,Sounds about right  
4532,12373,81099,2018-11-20 12:25:29,AGAIN?????????? 
4533,12376,81102,2018-11-20 12:25:22,Look how cute my baby's stroller is!!! 
4534,12398,81124,2018-11-20 12:23:57,Bow before your god! Broken stats. 
4536,12406,81132,2018-11-20 12:23:20,I need to commission someone that can make me my eevee from Let's Go as a plush once I saved some money ahh 
4537,12408,81134,2018-11-20 12:23:17,new anime crush 
4538,12409,81135,2018-11-20 12:23:16,showing one of my besties the dynamicto andfro pretty battles!! 
4539,12410,81136,2018-11-20 12:23:14,Team Rocket's blasting off again!!! 
4540,12416,81142,2018-11-20 12:22:59,I Think We've Been Having A Little Bit Too Much Fun 
4541,12418,81144,2018-11-20 12:22:48,"I was lost on mt. moon a couple of days. Coming back with all to ranked, just 2 weeks to reach X rank in TC "
4542,12420,81146,2018-11-20 12:22:46,Still not a shiny pidgey that I wanted but finally got a second shiny  
4543,12437,81163,2018-11-20 12:21:16,"I think I speak for everyone when I say: Step on me, Lorelei. "
4544,12454,81180,2018-11-20 12:19:18,YEAAH!!!! 
4545,12467,81193,2018-11-20 12:18:29,Saffron Gym has never looked more amazing! 
4546,12468,81194,2018-11-20 12:18:29,Red boy 
4547,12469,81195,2018-11-20 12:18:19,My special 
4551,12502,81228,2018-11-20 12:16:38,Possible 2019 screenshot inside the pokemon center in ? 
4552,12503,81229,2018-11-20 12:16:34,Whats The Best Way To Play Pokemon Lets Go?Read: 
4553,12507,81233,2018-11-20 12:16:24,So is this a My Neighbor Totoro reference. because i am totally getting that vibe hehe 
4554,12509,81235,2018-11-20 12:16:19,"she sneeze, then she i uninpressed "
4555,12515,81241,2018-11-20 12:15:59,haha love how you ride on Snorlax's belly 
4556,12517,81243,2018-11-20 12:15:51,"has set such a high stand for the series to me that now, if a game doesn't let me pet an Eevee, its now automatically trash."""
4557,12520,81246,2018-11-20 12:15:36,He's a clever boy!! 
4558,12521,81247,2018-11-20 12:15:29, fine! Next time I wont lend you my game!!! 
4559,12526,81252,2018-11-20 12:15:18,HOLY SHIT!!!!! 
4560,12530,81256,2018-11-20 12:14:55,They both have bad control...
4561,12532,81258,2018-11-20 12:14:48,I love high fiving my special boy 
4562,12537,81263,2018-11-20 12:14:32,She is so damn cute 
4563,12539,81265,2018-11-20 12:14:23,"About to watch interview and an advert for came on with a remake of the original anime theme song, man it's like being 9 all over again. I'm so in love "
4564,12551,81277,2018-11-20 12:13:28,this game has cleansed my soul 
4565,12553,81279,2018-11-20 12:13:24,Good Couple of minutes!!  
4566,12556,81282,2018-11-20 12:13:17,*NEW VIDEO* SHINY BUG!!! Shiny Weedle Reaction in Pokemon Let's Go Pikachu! Shiny Living Dex 013 
4567,12560,81286,2018-11-20 12:12:53,I now have a shiny Sandshrew and a shiny Sandslash c: 
4568,12562,81288,2018-11-20 12:12:45,LOOK what I found!!! 
4570,12574,81300,2018-11-20 12:11:43,Don't you dare try to say this isn't adorable!!!! 
4571,12590,81316,2018-11-20 12:10:06,Borrowing my housemate's game while he's at work and I'm home sick. Some people just want to see the world burn! 
4573,12593,81319,2018-11-20 12:10:04,"Absolutely unbelievable, if Mew didn't stop for the item I would have missed this one. "
4574,12594,81320,2018-11-20 12:09:57,Lavender time! 
4575,12595,81321,2018-11-20 12:09:43,EARLY BLACK FRIDAY DEAL!! Pokemon Black Limited Edition Nintendo DSi Console &amp; Game + Case+ FREE UK SHIPPING!
4577,12602,81328,2018-11-20 12:08:47,"makes me realize one truth that, no matter how shit a game is, somebody or many bodies would buy it just for its IP. They don't care what would it take to Pokemon gaming series."""
4578,12604,81330,2018-11-20 12:08:42,pokemon is calling me out ...... 
4579,12611,81337,2018-11-20 12:08:29,"Sure, seems relaxed to me. "
4580,12617,81343,2018-11-20 12:07:40,Le qui troll pendant un combo de ! / I just wanted a shiny ! 
4581,12621,81347,2018-11-20 12:07:21,who wants a tutorial on YouTube to put smiley on PokemonGo 
4583,12626,81352,2018-11-20 12:06:57,Snorlax ran away from food quick call Nurse Joy 
4584,12632,81358,2018-11-20 12:06:31,So cute &lt;3 
4585,12634,81360,2018-11-20 12:06:25,Venusaur walks like a boss 
4586,12642,81368,2018-11-20 12:05:58,So I got both starters in my team! 
4587,12643,81369,2018-11-20 12:05:53,SO MUCH PINK 
4588,12653,81379,2018-11-20 12:05:26,SUPER BLUE 
4589,12654,81380,2018-11-20 12:05:21,Yeah ! Merci  
4590,12657,81383,2018-11-20 12:05:14,Finally got something 
4591,12662,81388,2018-11-20 12:05:00,YESSSSS I FOUND HER 
4592,12664,81390,2018-11-20 12:04:57,Weeps...... openly.......... 
4593,12665,81391,2018-11-20 12:04:56,Bark! 
4594,12674,81400,2018-11-20 12:04:23,Shiny Vulpiiiiix!!! 
4595,12677,81403,2018-11-20 12:03:59,Ok what? 
4597,12683,81409,2018-11-20 12:03:16,psyduck 
4598,12686,81412,2018-11-20 12:02:58,NO FREAKING WAY!!! I WAS GOING FOR SHINY METAPOD AFTER I GAVE UP ON THAT FREAKING NIDORAN MALE!!!! WHAAAAAT? 
4599,12687,81413,2018-11-20 12:02:52,Onixpected early stream! 
4600,12691,81417,2018-11-20 12:02:41,Saw this and nearly jumped out of my seat! 
4601,12693,81419,2018-11-20 12:02:40,Your not my Mum 
4602,12695,81421,2018-11-20 12:02:36,"Love any form of Bulbasaur following me, got Chansey using a lure &amp; it makes an adorable travel friend!! "
4603,12696,81422,2018-11-20 12:02:13,My bby 
4604,12699,81425,2018-11-20 12:01:46,MY FIRST SHINY POKEMON 
4605,12709,81435,2018-11-20 12:01:00,Was 2000 the very best like no film ever was or was it Pok Balls?Find out in the latest 
4606,12711,81437,2018-11-20 12:00:57,Cute AF 
4607,12716,81442,2018-11-20 12:00:25,97/150 Pokedex plus story stream! Got Shiny Nidoran! 
4609,12719,81445,2018-11-20 12:00:11,Been having fun with this game! I actually dont miss all the battles so much. 
4610,12722,81448,2018-11-20 11:59:43,Celine Dion singing in the background 
4611,12723,81449,2018-11-20 11:59:32,I had to stare in disbelief 4 a sec. Caught him  
4612,12726,81452,2018-11-20 11:59:01,Here is my thoughts and impression regarding the accessory for 
4613,12727,81453,2018-11-20 11:58:57,Too cute for a spooky town 
4615,12730,81456,2018-11-20 11:58:49,running a little late (probably about 30 minutes) bc adulting sucks but we'll be live soon starting 
4616,12731,81457,2018-11-20 11:58:45,Man I love this Pokeball! 
4617,12732,81458,2018-11-20 11:58:40,"Here's Jean's card and her team of ~ It features powerful fire and psychic types, and ones that can seriously mess with their opponent's minds. art by ExoroDesigns) "
4618,12733,81459,2018-11-20 11:58:27,Lately my pastime has been watching play while I play and these have been some very peaceful evenings.Until she cusses at the TV screen. '
4619,12744,81470,2018-11-20 11:57:38,"Basicly, Im glad I Skipped it and went for instead, because that game is amazing.'"
4621,12756,81482,2018-11-20 11:56:27,shiny growlithe 
4622,12758,81484,2018-11-20 11:55:47,I LOVE MY TINY SON. 
4623,12762,81488,2018-11-20 11:55:32,Just found this a few minutes ago! 
4624,12768,81494,2018-11-20 11:55:12,My only goal for is to have a full team of level 100 
4625,12773,81499,2018-11-20 11:54:50,Found Pikachu for 30 bucks. No chance I don't bite that  
4626,12775,81501,2018-11-20 11:54:36,OMG THAT ENDING!!!! The story was great but at times the amount of enemies made it difficult to actually survive. Ive now turned to to hunt for the rest of the gym badges...
4627,12776,81502,2018-11-20 11:54:32,"No Ronny, go away "
4628,12777,81503,2018-11-20 11:54:20,It finally happened! 
4630,12781,81507,2018-11-20 11:54:07,its ya boiskinny penis 
4631,12792,81518,2018-11-20 11:53:07,I'm really trying to find a shiny here 
4632,12795,81521,2018-11-20 11:52:31,"first impressions of Graphics are amazing, really showcase what the Switch hardware can handle for the next Pokmon game. There seems to be a lack of a plot, but I can see the correlation to Yellow. The catching system actually isnt too bad.'"
4633,12798,81524,2018-11-20 11:52:14,My team:EeveeClefableGengarArcanineBlastoiseDragonite
4635,12804,81530,2018-11-20 11:51:46,I know that one! 
4637,12807,81533,2018-11-20 11:51:32,so beautiful :') forever tweeting on the wrong acc bc im waiting for michael to add me :( 
4638,12811,81537,2018-11-20 11:51:25,Mood. 
4639,12822,81548,2018-11-20 11:49:45,My Mew lives somehow 
4643,12840,81566,2018-11-20 11:47:53,AAAAAAH SHINY CHARMANDAR I was just looking for a decent Ekans! 
4644,12843,81569,2018-11-20 11:47:45,"OH, I GIVE YOU A FANCY HAIRSTYLE AND SUDDENLY YOU'RE JUDGING ME "
4645,12847,81573,2018-11-20 11:47:30,Pardon!? 
4646,12848,81574,2018-11-20 11:47:24,Well thank you fellow Pokmon trainer.  I grew them both myself!  
4647,12850,81576,2018-11-20 11:47:09,Wanted this since I started so very happy!  
4648,12856,81582,2018-11-20 11:45:49,"Hey there :)Does anyone wanna trade the version exclusive Pokemon from Lets Go Pikachu to Lets Go Eevee? I own only Lets Go Pikachu. The version exclusives are the last part which holds me back from completing the Pokedex.Best regards,Steffen"
4649,12858,81584,2018-11-20 11:45:21,Something isn't right here 
4650,12861,81587,2018-11-20 11:45:12,Blue assume grave pas son gp 
4651,12867,81593,2018-11-20 11:44:45,"Trading pokmon with my boss today, because we are ten. "
4652,12872,81598,2018-11-20 11:44:14,A battle for thes ages. 
4653,12873,81599,2018-11-20 11:44:12,Me trying to build an audience. 
4654,12879,81605,2018-11-20 11:43:47,My is loving all the attention! @NintendoEurope'
4655,12880,81606,2018-11-20 11:43:45,Got 2 extra Scythers Who tryin to get 1? 
4656,12883,81609,2018-11-20 11:43:25,|| I am Slowpoke everyday. 
4657,12890,81616,2018-11-20 11:42:27,Come on Tuan you can do better 
4660,12907,81633,2018-11-20 11:39:45,I'm guessing THIS is why VGC hasn't moved to  
4662,12921,81647,2018-11-20 11:38:26,I'm ready.  
4663,12924,81650,2018-11-20 11:38:17,Bring it 
4664,12930,81656,2018-11-20 11:37:56,This is what losing focus looks like...RIP 88 Geodude combo STILL LIVE: 
4665,12933,81659,2018-11-20 11:37:37,And while we're at it I'll post the finisher. 
4666,12936,81662,2018-11-20 11:37:21,"With this many fans mad worldwide, it seems like Game Freak did a big oopsie. "
4667,12945,81671,2018-11-20 11:36:29,This beautiful switch is tempting me to trade in my old one 
4668,12951,81677,2018-11-20 11:36:15,Guys Thats 4 
4669,12952,81678,2018-11-20 11:36:13,"I love playing but man... I am really wanting that RPG game they are working on and I hope that its good. This game is too damn easy and watered down compared to its original, the removal of HMs is just bad.'"
4670,12954,81680,2018-11-20 11:36:11,Some before work. Going to stream this a little bit tomorrow on 
4671,12958,81684,2018-11-20 11:35:46,"I understand little Rose, Team Rocket will do that to you."
4672,12959,81685,2018-11-20 11:35:36,Going through Rock Tunnel in the dark like it's the 90s without flash!  
4673,12961,81687,2018-11-20 11:35:30,Team's coming together. Probably gonna swap out Agnew the second I find a Scyther though. 
4674,12964,81690,2018-11-20 11:35:19,beautiful :D 
4675,12965,81691,2018-11-20 11:35:14,Honestly I'm getting far too many close calls lately. Bonus: Invalidating an attack completely 
4676,12973,81699,2018-11-20 11:34:19,I wish i was rich so i could get without it denting my bank account lol.'
4677,12983,81709,2018-11-20 11:33:19,"is a blast so far. My one complaint- is there something I can do with all these extra Pokmon? I havent hit Go Park yet, but Im pretty sure thats just for Pokmon transferred in from Go, right?'"
4679,12995,81721,2018-11-20 11:31:54,About to go to the Pokemon League. 
4681,13006,81732,2018-11-20 11:31:00,"Best Pokemon Tier List, ranking the Attack, Defense and Overall Pokemon in "
4682,13008,81734,2018-11-20 11:30:47,Pokemon Let's Go How to Get Shiny Pokemon - Chain Combo 
4683,13011,81737,2018-11-20 11:30:32,i love this. 
4684,13017,81743,2018-11-20 11:29:37,"Here's what Pokemon, moves, items and master trainers that spawn in each location within : "
4685,13019,81745,2018-11-20 11:29:08,yeah nice 
4686,13022,81748,2018-11-20 11:28:47,"If you missed it last night, here's my review of "
4687,13023,81749,2018-11-20 11:28:38,See all the Mega Pokemon in and how to evolve them: 
4688,13024,81750,2018-11-20 11:28:33,That was quick
4689,13027,81753,2018-11-20 11:28:24,Currently 4 gyms completed and 68 Pokmon caught into my journey. Really enjoying the game so far.'
4690,13031,81757,2018-11-20 11:28:09,Elite Four defeated 
4692,13033,81759,2018-11-20 11:28:06,EP129 of The Hungry Gamers is ready for consumption!Expect to hear about:- - - + lots more!----: 
4693,13034,81760,2018-11-20 11:28:03,I was hunting for vulpix and got a shiny porygon instead!!!  
4695,13040,81766,2018-11-20 11:27:44,No regrets... 
4697,13042,81768,2018-11-20 11:27:30,"I encountered two Chansey in Diglett's Cave whilst chaining Diglett, I managedto catch the second one.."
4700,13049,81775,2018-11-20 11:26:58,oh my LORD 
4701,13051,81777,2018-11-20 11:26:47,"Had a bit of fun making a trainer's card for Wanda and her team of 6 What do you think? She's got some fairy types, a few mage-y types... and a Rotom .sure who drew the chibi art) "
4702,13053,81779,2018-11-20 11:26:33,Making some good progress on that synchronized swimming routine. 
4704,13070,81796,2018-11-20 11:25:22,again holy shit thats good xp 
4705,13072,81798,2018-11-20 11:25:13,It wouldn't let me name Raichu. 
4706,13074,81800,2018-11-20 11:24:54,A Child's Dream becomes reality! 
4707,13075,81801,2018-11-20 11:24:43,Got this beauty in 
4708,13077,81803,2018-11-20 11:24:25,"EEVEE IS SO CUTE I COULD DIE.Thanks everyone who came to hang out! Switch stream went off without a hitch!I'll be back to play more same time Thursday!"""
4709,13081,81807,2018-11-20 11:24:21,My shiny baby's first battle! 
4711,13089,81815,2018-11-20 11:23:36,ridding pussy all day 
4712,13093,81819,2018-11-20 11:23:30,don't talk to me 
4714,13101,81827,2018-11-20 11:22:35,"mmm, floor water. "
4715,13104,81830,2018-11-20 11:22:25,"While talking about Chris Hansen,Shiny Blue Balls (Shiny Koffing)On a 69 Catch Combo. "
4716,13107,81833,2018-11-20 11:22:18,first shiny in lets go 
4717,13108,81834,2018-11-20 11:22:10,Trying to split my time between &amp; my other commitments is sooooooo hard '
4718,13110,81836,2018-11-20 11:21:57,Waking up to and at 152 hour stream for the 152 
4720,13113,81839,2018-11-20 11:21:37,progress 
4721,13119,81845,2018-11-20 11:20:51,Yeah boy!
4723,13126,81852,2018-11-20 11:20:25,My first shiny 
4724,13127,81853,2018-11-20 11:20:25,My Raticates stats v my Gyarados 
4725,13128,81854,2018-11-20 11:20:14,weirdly into playing 2 player... by myself lol 
4726,13130,81856,2018-11-20 11:20:09,So this just happened.. I wasn't even shiny hunting 
4727,13132,81858,2018-11-20 11:20:01,From level 7 to level 30 after a two-day stroll in the pokeball. This seems OP but I'll take it! 
4728,13133,81859,2018-11-20 11:19:55,Shasse au shiny sur un shiny :D 
4729,13140,81866,2018-11-20 11:19:13,Vilpix are extinct in the wild because I caught them all just to get one shiny Raticate xD! 
4730,13141,81867,2018-11-20 11:19:10,this is too cute i can't 
4731,13145,81871,2018-11-20 11:18:55,Ready for the league! 
4732,13147,81873,2018-11-20 11:18:48,Like a boss 
4733,13154,81880,2018-11-20 11:17:50,Maxwell is a now!! So cute &lt;3 
4734,13156,81882,2018-11-20 11:17:44,Two solid evenings of searching for shiny Sandshrew and who turns up but this guy. Naebdy's favourite. 
4735,13157,81883,2018-11-20 11:17:43,First Shiny in 
4736,13162,81888,2018-11-20 11:17:27,Shiny Oddish!! 
4737,13163,81889,2018-11-20 11:17:24,I want to play so badly '
4738,13167,81893,2018-11-20 11:16:57,LIVE Did you think I forgot about you guys  
4739,13170,81896,2018-11-20 11:16:44,My catch streak keeps resetting after like 20 but I can't figure out why!?!?! 
4741,13182,81908,2018-11-20 11:15:43,MY PRECIOUS DAUGHTER 
4742,13186,81912,2018-11-20 11:15:28,lol did I really run into a shiny pidgey while on my way to get lures for my 85 combo chain hunt for caterpie? 
4743,13187,81913,2018-11-20 11:15:14,One positive aspect of is that it opened a new glorious age of memes.'
4745,13195,81921,2018-11-20 11:14:18,The evolution screen in this game is gorgeous!! 
4746,13202,81928,2018-11-20 11:13:56,This game is so nice :D 
4747,13211,81937,2018-11-20 11:13:25,One day of work did this 
4748,13212,81938,2018-11-20 11:13:24,Ah... The classic line lives on! 
4749,13213,81939,2018-11-20 11:13:24,"I do play allot of switch in TV mode and the first controller I pick up was the pro. However now it's the  how long that will last will depend on how quickly I finish  with It will flow into weeks I'm sure I'm in no rush to finish!"""
4750,13216,81942,2018-11-20 11:12:54,Pokemon and Monster Hunter moving from 3DS to Nintendo Switch 
4751,13223,81949,2018-11-20 11:12:30,What just happened. Am I buggin? Why wasn't it super effective?? 
4753,13227,81953,2018-11-20 11:12:14,Okay. 
4754,13236,81962,2018-11-20 11:11:50,"Fighting Muk is the worst. I swear all of the Muks in I've had to fight have Protect so it just blocks everything every turn while I take tons of poison damage. Gross."""
4755,13241,81967,2018-11-20 11:11:26,"We have some in stock, 49.99 they're a game changer for any Go or Let's Go player!- Connect to catch Pokemon/spin stops without touching your phone!- Lvl up Pokemon from by taking them for a walk!- Use it to play Let's Go on Switch! "
4756,13242,81968,2018-11-20 11:11:25,my baby!!!!!!!!!!! 
4757,13243,81969,2018-11-20 11:11:12,Team Magma's Courtney   
4758,13244,81970,2018-11-20 11:11:05,Well okay then lol Thanks? 
4759,13246,81972,2018-11-20 11:10:49,The time has come 
4760,13247,81973,2018-11-20 11:10:48,It happened again. 3rd shiny Pokemon in 
4762,13256,81982,2018-11-20 11:10:05,Was shiny-chaining and expected nothing too spectacular... But look who I just met! 
